Rhyme Scheme Letter;Line Number;Lyrics;Phonetic Transcription
a;0;this song (is) originally Performed in Twi This (is) the English Take;dh_ih_s s_ao_ng ih_z er_ih_jh_ah_n_ah_l_iy p_er_f_ao_r_m_d ih_n T_w_iy dh_ih_s ah_z dh_iy ih_ng_g_l_ih_sh t_ey_k
c;4;i use flows thats killer;ay y_uw_s f_l_ow_z dh_ae_t_s k_ih_l_er
b;5;goes in your head;g_ow_z ih_n y_ao_r hh_eh_d
a;3;me too I-M Looking to put status to my name;m_iy t_uw ay_m l_uh_k_ih_ng t_uw p_uh_t s_t_ey_t_ax_s t_uw m_ay n_ey_m
b;2;i drink pito and watch Kaizer Söze get charged;ay d_r_ih_ng_k p_ih_t_oh ah_n_d w_aa_ch K_ah_iy_z_ax_r  g_ih_t ch_aa_r_jh_d
