Rhyme Scheme Letter;Line Number;Lyrics;Phonetic Transcription
c;1;difficult everday nothing ever changes who knows what can happen next till u;d_ih_f_ah_k_ah_l_t eh_v_er_d_ey n_ah_th_ih_ng eh_v_er ch_ey_n_jh_ah_z hh_uw n_ow_z hh_w_ah_t k_ae_n hh_ae_p_ah_n n_eh_k_s t_ih_l ih_k
e;3;quick verbs become easy off thoughts super markets gets sweeped with money;k_w_ih_k v_er_b_z b_ih_k_ah_m iy_z_iy ao_f th_ao_t_s s_uw_p_er m_aa_r_k_ah_t_s g_ih_t_s s_w_iy_p_er_d w_ah_dh m_ah_n_iy
f;5;pictures when I got out cameras be shineing like lights in the sky with the;p_ih_k_ch_er_z w_eh_n ay g_aa_t aw_t k_ae_m_er_ah_z b_iy sh_ay_n_ih_ng l_ay_k l_ay_t_s ih_n dh_ah s_k_ay w_ih_dh dh_ah
b;0;kissing the wind air in face climbing trees with 2 fingers things get more;k_ih_s_ih_ng dh_iy w_ih_n_d eh_r ih_n_ch f_ey_s k_l_ay_m_ih_ng t_r_iy_z w_ah_dh ah_ae f_ih_ng_g_er_z th_ih_ng_z g_ih_t m_ao_r
a;8;to my phone stay high to the ceiling never fall off not to easy to say;t_uw m_ay f_ow_n s_t_ey hh_ay t_uw dh_ah s_iy_l_ih_ng n_eh_v_er f_aa_l ao_f n_ax_t t_ah iy_z_iy t_uw s_ey
a;4;night and day look bright lights flashing every direction I go cameras take;n_ay_t ah_n_d d_ey l_uh_k b_r_ay_t l_ay_t_s f_l_ae_sh_ih_ng eh_v_er_iy d_ih_r_eh_k_sh_n ay g_ow k_ae_m_er_ah_z t_ey_k
d;2;find out the next day mami dimelo que la que hay if im poor I become rich;f_ay_n_d aw_t dh_iy n_eh_k_s d_ey m_ae_m_ih d_l_oh k_y_uw l_aa k_y_uw hh_ey ih_f ih_m p_uh_r ay b_ih_k_ah_m r_ih_ch
b;6;stars we enable the switchs to the fresh cars we drive around the block never;s_t_aa_r_z w_iy ih_n_ey_b_l dh_ah s_w_ih_ch_s t_uw dh_ah f_r_eh_sh k_aa_z w_iy d_r_ay_v er_aw_n_d dh_ah b_l_aa_k n_eh_v_er
