Rhyme Scheme Letter;Line Number;Lyrics;Phonetic Transcription
b;10;without nutrition;w_ih_th_aw_t n_uw_t_r_ih_sh_ah_n
b;6;today-s biggest mission;t_ax_d_ey_z b_ih_g_ah_s_t m_ih_sh_ah_n
c;9;its been 5 days;ih_t_s b_ih_n ah_ae d_ey_z
b;7;investigate the kitchen;ih_n_v_eh_s_t_ah_g_ey_t dh_ah k_ih_ch_ah_n
a;1;but his metallic heart (is) (tickin-);b_ah_t hh_ah_z m_ah_t_ae_l_ih_k hh_aa_r_t ah_z t_ih_k_iy_n_eh
c;3;hes been there for weeks;hh_iy_s b_ih_n dh_eh_r f_ao_r w_iy_k_s
d;4;the robot has got the blues;dh_ah r_ow_b_aa_t hh_ah_z g_aa_t dh_ah b_l_uw_z
a;0;he lies in his bed;hh_iy l_ay_z ih_n_ch hh_ah_z b_eh_d
