Rhyme Scheme Letter;Line Number;Lyrics;Phonetic Transcription
c;1;are cooking who knows where danger stays at im blind when u see me black and;er k_uh_k_ih_ng hh_uw n_ow_z hh_w_eh_r d_ey_n_jh_er s_t_ey_z ae_t ih_m b_l_ay_n_d hh_w_ih_n ih_k s_iy m_iy b_l_ae_k ah_n_d
a;0;we stay high never talk who knows where we stay at watch out where your hands;w_iy s_t_ey hh_ay n_eh_v_er t_ao_k hh_uw n_ow_z hh_w_eh_r w_iy s_t_ey ae_t w_aa_ch aw_t hh_w_eh_r y_uh_r hh_ae_n_d_z
d;4;mamis all over me we drive our cars slow speeds can-t be touched where we go u;m_ae_m_ih_s ao_l ow_v_er m_iy w_iy d_r_ay_v aw_r k_aa_z s_l_ow s_p_iy_d_z k_ae_n_t b_iy t_ah_ch_t w_eh_r w_iy g_ow ih_k
b;2;yellow black and yellow diamonds shining everywhere we go I got so many;y_eh_l_ow b_l_ae_k ah_n_d y_eh_l_ow d_ay_m_ah_n_d_z sh_ay_n_ih_ng eh_v_r_iy_hh_w_eh_r w_iy g_ow ay g_aa_t s_ow m_eh_n_iy
a;6;me up when its over wake me up hun people dye young so think fast;m_iy ah_p hh_w_ih_n ah_t_s ow_v_er w_ey_k m_iy ah_p hh_ah_n p_iy_p_ah_l d_ay y_ah_ng s_ow th_ih_ng_k f_ae_s_t
b;3;females its not even funny trees are green (as) leafs leafs get rolled everyday;f_iy_m_ey_l_z ah_t_s n_ax_t iy_v_ah_n f_ah_n_iy t_r_iy_z aa_r g_r_iy_n ae_z l_iy_f_s l_iy_f_s g_eh_t r_ow_l_d eh_v_r_iy_d_ey
c;5;can-t see us bitch dont kill my time time (is) always here runs like water wake;k_ae_n_t s_iy y_uw_eh_s b_ih_ch d_aa_n_b k_ih_l m_ay t_ay_m t_ay_m ah_z ao_l_w_ey_z hh_ih_r r_ah_n_z l_ay_k w_ao_t_er w_ey_k
