Rhyme Scheme Letter;Line Number;Lyrics;Phonetic Transcription
h;62;i ain-t like some people who gotta be so damn crass;ay ey_n_t l_ay_k s_ah_m p_iy_p_ah_l hh_uw g_aa_t_ah b_iy s_ow d_ae_m k_r_ae_s
b;24;bath city nights;b_ae_th s_ih_t_iy n_ay_t_s
c;93;i be goin to Mt Clemens this summer;ay b_iy g_oy_n t_uw m_aw_n_t k_l_eh_m_ah_n_z dh_ih_s s_ah_m_er
e;16;i do not miss my old school at all;ay d_uw n_ax_t m_ih_s m_ay ow_l_d s_k_uw_l ae_t ao_l
f;17;nor will I ever;n_ao_r w_ah_l ay eh_v_er
r;46;i wish I wasn-t such a jerk or so obscene;ay w_ih_sh ay w_oh_z_n_t s_ah_ch ah jh_er_k ao_r s_ow ah_b_s_iy_n
g;65;i got everything you want and I don-t cost a thing;ay g_aa_t eh_v_r_iy_th_ih_ng y_uw w_aa_n_t ah_n_d ay d_ow_n_t k_aa_s_t ah th_ih_ng
h;48;im judaic arabic and romantic;ay_m jh_uw_d_ey_ih2_z_k ae_r_ah_b_ih_k ah_n_d r_ow_m_ae_n_t_ih_k
h;49;i wheel all your moms leaving all your dads frantic;ay w_iy_l ao_l y_ao_r m_aa_m_z l_iy_v_ih_ng ao_l y_ao_r d_ae_d_z f_r_ae_n_t_ih_k
e;10;i forgive Dominic too or id never write this song;ay f_er_g_ih_v d_aa_m_ah_n_ih_k t_uw ao_r ay_d n_eh_v_er r_ay_t dh_ih_s s_ao_ng
b;36;bath city nights;b_ae_th s_ih_t_iy n_ay_t_s
b;42;bath city nights;b_ae_th s_ih_t_iy n_ay_t_s
n;80;i wish I wasn-t such a jerk or so obscene;ay w_ih_sh ay w_oh_z_n_t s_ah_ch ah jh_er_k ao_r s_ow ax_b_s_iy_n
b;3;the sun also rises and its rays they part the night;dh_iy s_ah_n ao_l_s_ow r_ay_z_ah_z ah_n_d ah_t_s r_ey_z dh_ey p_aa_r_t dh_iy n_ay_t
b;2;my troubles are behind me and my future-s looking bright;m_ay t_r_ah_b_ah_l_z er b_ah_hh_ay_n_d m_iy ah_n_d m_ay f_y_uw_ch_er_z l_uh_k_ih_ng b_r_ay_t
f;77;6th grade friendships; g_r_ey_d f_r_eh_n_d_sh_ih_p_s
o;31;i never thought I would make it this far I guess it worked;ay n_eh_v_er th_ao_t ay w_uh_d m_ey_k ih_t dh_ih_s f_aa_r ay g_eh_s ih_t w_er_k_t
d;41;6th grade days; g_r_ey_d d_ey_z
n;40;i wish I wasn-t such a jerk or so obscene;ay w_ih_sh ay w_oh_z_n_t s_ah_ch ah jh_er_k ao_r s_ow ax_b_s_iy_n
l;92;yo this (is) Mosh Arab comin to you straight from my new place the township;y_ow dh_ih_s ih_z m_ao_sh ae_r_ah_b k_ow_m_ah_n t_uw y_uw s_t_r_ey_t f_r_ah_m m_ay n_y_uw p_l_ey_s dh_ah t_aw_n_sh_ih_p
n;74;i wish I wasn-t such a jerk or so obscene;ay w_ih_sh ay w_oh_z_n_t s_ah_ch ah jh_er_k ao_r s_ow ax_b_s_iy_n
g;90;bath city;b_ae_th s_ih_t_iy
h;56;you girls better run before my love grenade scatter;y_uw g_er_l_z b_eh_t_er r_ah_n b_iy_f_ao_r m_ay l_ah_v g_r_ah_n_ey_d s_k_ae_t_er
n;28;i wish I wasn-t such a jerk or so obscene;ay w_ih_sh ay w_oh_z_n_t s_ah_ch ah jh_er_k ao_r s_ow ax_b_s_iy_n
s;54;to what the ghetto life has done and where it has been;t_ah hh_w_ah_t dh_iy g_eh_t_ow l_ay_f hh_ah_z d_ah_n ah_n_d hh_w_eh_r ah_t hh_ah_z b_ah_n
h;55;nyc Roseville it don-t matter;n_ay_k r_ow_z_v_ih_l ah_t d_ow_n m_ae_t_er
b;86;bath city ways bath city blight;b_ae_th s_ih_t_iy w_ey_z b_ae_th s_ih_t_iy b_l_ay_t
f;32;now I be looking back visited clemens yesterday;n_aw ay b_iy l_uh_k_ih_ng b_ae_k v_ih_z_ah_t_ah_d k_l_eh_m_ah_n_z y_eh_s_t_er_d_ey
a;0;hey girl I wanted to let you know;hh_ey g_er_l ay w_ao_n_ah_d t_ah l_eh_t y_uw n_ow
f;53;me Zane and Frankie be testaments;m_iy z_ey_n ah_n_d f_r_ae_ng_k_iy b_iy t_eh_s_t_ah_m_ah_n_t_s
l;66;my calling card (is) some charm and a love potion too;m_ay k_ao_l_ih_ng k_aa_r_d ih_z s_ah_m ch_aa_r_m ah_n_d ah l_ah_v p_ow_sh_ah_n t_uw
g;64;i got style swag and I got swing;ay g_aa_t s_t_ay_l s_w_ae_g ah_n_d ay g_aa_t s_w_ih_ng
g;14;forgiveness (is) what I be thinkin heres where it begin;f_ax_g_ih_v_n_ax_s ih_z w_ah_t ay b_iy th_ih_ng_k_ah_n hh_ih_r_s w_eh_r ih_t b_ih_g_ih_n
b;50;i could destroy your heart if I winked at you just right;ay k_uh_d d_ah_s_t_r_oy y_ao_r hh_aa_r_t ah_f ay w_ih_ng_k_t ae_t y_uw jh_ah_s_t r_ay_t
i;60;lower em I never could;l_ow_er eh_m ay n_eh_v_er k_uh_d
b;76;bath city nights;b_ae_th s_ih_t_iy n_ay_t_s
f;43;6th grade friendships; g_r_ey_d f_r_eh_n_d_sh_ih_p_s
l;67;i might be perservering but Im victorious too;ay m_ay_t b_iy p_eh_r_s_eh_r_v_er_r_ax_ng b_ah_t ay_m v_ih_k_t_ao_r_iy_ah_s t_uw
d;23;6th grade days; g_r_ey_d d_ey_z
d;7;i hope troubles are over and theyre out of the way;ay hh_ow_p t_r_ah_b_ah_l_z aa_r ow_v_er ah_n_d dh_ey_r aw_t ah_v dh_ah w_ey
u;79;broken teeth mended hearts and (in-between);b_r_ow_k_ah_n t_iy_th m_eh_n_d_ah_d hh_aa_r_t_s ah_n_d ih_n_b_ih_t_w_iy
c;4;you walkin round Clinton with your hair inside a bun;y_uw w_aa_k_iy_n r_aw_n_d k_l_ih_n_t_ah_n w_ah_dh y_uh_r hh_eh_r ih_n_s_ay_d ey b_ah_n
p;39;broken teeth mended hearts and (in-between);b_r_ow_k_ah_n t_iy_th m_eh_n_d_ah_d hh_aa_r_t_s ah_n_d ih_n_b_ih_t_w_iy
b;70;bath city nights;b_ae_th s_ih_t_iy n_ay_t_s
d;6;the things get better ain-t it going good today;dh_ah th_ih_ng_z g_eh_t b_eh_t_er ey_n_t ih_t g_ow_ih_ng g_uh_d t_ah_d_ey
b;51;and I could kill all you boys off with a whisper to your wife;ah_n_d ay k_uh_d k_ih_l ao_l y_uw b_oy_z ao_f w_ah_dh ey w_ih_s_p_er t_ah y_uh_r w_ay_f
f;11;i forgive Eric Joe and Derrick;ay f_er_g_ih_v eh_r_ih_k jh_ow ah_n_d d_eh_r_ih_k
m;27;broken teeth mended hearts and (in-between);b_r_ow_k_ah_n t_iy_th m_eh_n_d_ah_d hh_aa_r_t_s ah_n_d ih_n_b_ih_t_w_iy
i;58;casenova if I wanted to I could;k_ey_s_n_ow_v_ah ih_f ay w_ao_n_ah_d t_ah ay k_uh_d
f;18;i yet wish the year there could have lasted forever;ay y_eh_t w_ih_sh dh_ah y_ih_r dh_eh_r k_uh_d hh_ae_v l_ae_s_t_ah_d f_er_eh_v_er
d;35;6th grade days; g_r_ey_d d_ey_z
g;88;bath city;b_ae_th s_ih_t_iy
b;44;6th grade fights; g_r_ey_d f_ay_t_s
l;21;that every day that passes im still thinking about you;dh_ae_t eh_v_er_iy d_ey dh_ae_t p_ae_s_ah_z ay_m s_t_ih_l th_ih_ng_k_ah_ng ah_b_aw_t y_uw
b;26;6th grade fights; g_r_ey_d f_ay_t_s
d;69;6th grade days; g_r_ey_d d_ey_z
b;78;6th grade fights; g_r_ey_d f_ay_t_s
d;33;im the king of bath city get the hell outta my way;ay_m dh_ah k_ih_ng ah_v b_ae_th s_ih_t_iy g_eh_t dh_ah hh_eh_l uw_t_ah m_ay w_ey
q;45;broken teeth mended hearts and (in-between);b_r_ow_k_ah_n t_iy_th m_eh_n_d_ah_d hh_aa_r_t_s ah_n_d ih_n_b_ih_t_w_iy
b;72;6th grade fights; g_r_ey_d f_ay_t_s
b;82;bath city king watch me flash my blind;b_ae_th s_ih_t_iy k_ih_ng w_aa_ch m_iy f_l_ae_sh m_ay b_l_ay_n_d
d;75;6th grade days; g_r_ey_d d_ey_z
f;25;6th grade friendships; g_r_ey_d f_r_eh_n_d_sh_ih_p_s
l;20;i wish I let you knew;ay w_ih_sh ay l_eh_t y_uw n_uw
h;59;its just I got high standards;ih_t_s jh_ah_s_t ay g_aa_t hh_ay s_t_ae_n_d_er_d_z
a;1;the things between you and me I decided to let go;dh_iy th_ih_ng_z b_iy_t_w_iy_n y_uw ah_n_d m_iy ay d_ah_s_ay_d_ah_d t_ah l_eh_t g_ow
h;61;i might be an (ex-ghetto) rat but you know I got class;ay m_ay_t b_iy ae_n ah_k_s_g_eh_t_ow r_ae_t b_ah_t y_uw n_ow ay g_aa_t k_l_ae_s
c;5;its all golden colored right below the summer sun;ih_t_s ao_l g_ow_l_d_ah_n k_ah_l_er_d r_ay_t b_ah_l_ow dh_ah s_ah_m_er s_ah_n
f;19;but time and time comes to an end;b_ah_t t_ay_m ah_n_d t_ay_m k_ah_m_z t_uw ae_n eh_n_d
g;89;bath city;b_ae_th s_ih_t_iy
h;94;i can take a few people but I need you to feature with me in a rap;ay k_ah_n t_ey_k ah f_y_uw p_iy_p_ah_l b_ah_t ay n_iy_d y_uw t_uw f_iy_ch_er w_ih_dh m_iy ih_n ah r_ae_p
f;12;Matthew and Aaron;m_ae_th_y_uw ah_n_d eh_r_ah_n
f;37;6th grade friendships; g_r_ey_d f_r_eh_n_d_sh_ih_p_s
f;71;6th grade friendships; g_r_ey_d f_r_eh_n_d_sh_ih_p_s
b;85;bath city days batch city nights;b_ae_th s_ih_t_iy d_ey_z b_ae_ch s_ih_t_iy n_ay_t_s
t;73;broken teeth mended hearts and (in-between);b_r_ow_k_ah_n t_iy_th m_eh_n_d_ah_d hh_aa_r_t_s ah_n_d ih_n_b_ih_t_w_iy
e;30;i wore my hair long in the past and now its short;ay w_ao_r m_ay hh_eh_r l_ao_ng ih_n dh_ah p_ae_s_t ah_n_d n_aw ih_t_s sh_ao_r_t
b;38;6th grade fights; g_r_ey_d f_ay_t_s
e;9;i forgive all of you for sometimes being wrong;ay f_er_g_ih_v ao_l ah_v y_uw f_ao_r s_ah_m_t_ay_m_z b_iy_ih_ng r_ao_ng
g;83;ima be fuckin with you (as) I go on my damn fling;ih_m_ah b_iy f_ah_k_iy_n w_ih_dh y_uw ae_z ay g_ow aa_n m_ay d_ae_m f_l_ih_ng
