Rhyme Scheme Letter;Line Number;Lyrics;Phonetic Transcription
b;6;i counted mile I never wanted it to end;ay k_aw_n_t_ah_d m_ay_l ay n_eh_v_er w_oh_n_t_ih_d ih_t t_uw eh_n_d
a;3;and you should you know that I will never let you go;ah_n_d y_uw sh_uh_d y_uw n_ow dh_ae_t ay w_ah_l n_eh_v_er l_eh_t y_uw g_ow
b;7;you made it worth my while I felt like I was whole again;y_uw m_ey_d ih_t w_er_th m_ay w_ay_l ay f_eh_l_t l_ay_k ay w_ah_z hh_ow_l ah_g_eh_n
a;0;i remember the way you slept when we were on our way back home;ay r_ih_m_eh_m_b_ax dh_ah w_ey y_uw s_l_eh_p_t w_eh_n w_iy w_er aa_n aw_r w_ey b_ae_k hh_ow_m
a;1;it was (forty-seven) miles I kept inside my heart and soul;ih_t w_ah_z f_ao_t_ih_s_eh_v m_ay_l_z ay k_eh_p_t ih_n_s_ay_d m_ay hh_aa_r_t ah_n_d s_ow_l
a;4;i will never fail I will never let you go;ay w_ah_l n_eh_v_er f_ey_l ay w_ah_l n_eh_v_er l_eh_t y_uw g_ow
