Rhyme Scheme Letter;Line Number;Lyrics;Phonetic Transcription
l;39;joint;jh_oy_n_t
w;46;and even if it wasn-t with me Id want her life to carry on;ah_n_d iy_v_ah_n ah_f ih_t w_oh_z_n_t w_ih_dh m_iy ay_d w_aa_n_t hh_er l_ay_f t_uw k_ae_r_iy aa_n
i;31;i feel like Im gonna snap cause my rap career won-t get far;ay f_iy_l l_ay_k ay_m g_aa_n_ah s_n_ae_p k_aa_z m_ay r_ae_p k_er_ih_r w_ow_n_t g_eh_t f_aa_r
f;26;because it feels like Im never ever gonna make millions;b_ih_k_ao_z ih_t f_iy_l_z l_ay_k ay_m n_eh_v_er eh_v_er g_aa_n_ah m_ey_k m_ih_l_y_ah_n_z
l;37;where I took my own life Then what would be the point;w_eh_r ay t_uh_k m_ay ow_n l_ay_f dh_eh_n hh_w_ah_t w_uh_d b_iy dh_ah p_oy_n_t
f;25;im tired of hanging around this place like Robin Williams;ay_m t_ay_r_d ah_v hh_ae_ng_ih_ng er_aw_n_d dh_ih_s p_l_ey_s l_ay_k r_aa_b_ah_n w_ih_l_y_ah_m_z
f;30;but recently Ive been having these fucked up visions;b_ah_t r_iy_s_ah_n_t_l_iy ay_v b_ih_n hh_ae_v_ih_ng dh_iy_z f_ah_k_t ah_p v_ih_zh_ah_n_z
e;14;up;ah_p
p;15;my life will be successful Ill make sure of it;m_ay l_ay_f w_ah_l b_iy s_ah_k_s_eh_s_f_ah_l ay_l m_ey_k sh_uh_r ah_v ih_t
t;36;what if nobody cared about that cold night in September;w_ah_t ah_f n_ow_b_aa_d_iy k_eh_r_d ah_b_aw_t dh_ae_t k_ow_l_d n_ay_t ih_n s_eh_p_t_eh_m_b_er
g;22;i wanna stay in your mind;ay w_aa_n_ah s_t_ey ih_n y_ao_r m_ay_n_d
a;51;and bury him like a bone I found;ah_n_d b_eh_r_iy hh_ih_m l_ay_k ah b_ow_n ay f_aw_n_d
m;59;see out here in this game Im Unnamed;s_iy aw_t hh_ih_r ih_n_ch dh_ih_s g_ey_m ay_m ah_n_n_ey_m_d
p;13;but anyone who knows me will tell you Ill rip shit up before I ever give shit;b_ah_t eh_n_iy_w_ah_n hh_uw n_ow_z m_iy w_ah_l t_eh_l y_uw ay_l r_ih_p sh_iy_t ah_p b_ah_f_ao_r ay eh_v_er g_ih_v sh_iy_t
f;54;im just not ready to die give me a few more years;ay_m jh_ah_s_t n_ax_t r_eh_d_iy t_uw d_ay g_ih_v m_iy ah f_y_uw m_ao_r y_ih_r_z
f;38;i might aswell hang around for a while cause it ain-t my time to leave this;ay m_ay_t aa_s_w_eh_l hh_ae_ng er_aw_n_d f_ao_r ah w_ay_l k_aa_z ih_t ey_n_t m_ay t_ay_m t_uw l_iy_v dh_ih_s
a;2;doubt;d_aw_t
e;44;at my funeral my family would cry and a few friends would show up;ae_t m_ay f_y_uw_n_er_ah_l m_ay f_ae_m_ax_l_ih w_uh_d k_r_ay ah_n_d ah f_y_uw f_r_eh_n_d_z w_uh_d sh_ow ah_p
g;47;if she moved on from me and fell in love with another guy;ah_f sh_iy m_uw_v_d aa_n f_r_ah_m m_iy ah_n_d f_eh_l ih_n l_ah_v w_ih_dh ah_n_ah_dh_er g_ay
q;18;id be fucking crucified before I ever commit suicide;ay_d b_iy f_ah_k_ih_ng k_r_uw_s_ah_f_ay_d b_ah_f_ao_r ay eh_v_er k_ah_m_ih_t s_uw_ah_s_ay_d
f;16;because when Im gone I want you to remember that I never did quit;b_ih_k_ao_z w_eh_n ay_m g_ao_n ay w_aa_n_t y_uw t_uw r_ih_m_eh_m_b_ax dh_ae_t ay n_eh_v_er d_ih_d k_w_ih_t
c;3;theres people whos life ended so premature;dh_eh_r_s p_iy_p_ah_l hh_uw_s l_ay_f eh_n_d_ah_d s_ow p_r_iy_m_ah_ch_uh_r
e;43;man if I left this world tomorrow who would actually give a fuck;m_ae_n ah_f ay l_eh_f_t dh_ih_s w_er_l_d t_ah_m_aa_r_ow hh_uw w_uh_d ae_k_ch_ah_w_ah_l_iy g_ih_v ey f_ah_k
e;12;angel of death-s coming closer with her touch;ey_n_jh_ah_l ah_v d_eh_th_s k_ah_m_ih_ng k_l_ow_s_ax_r w_ih_dh hh_er t_ah_ch
b;1;this life ain-t fair and the fact that Im still here leaves me with no;dh_ih_s l_ay_f ey_n_t f_eh_r ah_n_d dh_ah f_ae_k_t dh_ae_t ay_m s_t_ih_l hh_ih_r l_iy_v_z m_iy w_ih_dh n_ow
a;0;why am I here Im still trying to figure it out;w_ay ae_m ay hh_ih_r ay_m s_t_ih_l t_r_ay_ih_ng t_uw f_ih_g_y_er ih_t aw_t
l;32;and I just flip and go crazy like Chris Benoit;ah_n_d ay jh_ah_s_t f_l_ih_p ah_n_d g_ow k_r_ey_z_iy l_ay_k k_r_ih_s b_ah_n_oy_t
g;48;all I can say (is) at least the baby has her beautiful eyes;ao_l ay k_ah_n s_ey ih_z ae_t l_iy_s_t dh_ah b_ey_b_iy hh_ah_z hh_er b_y_uw_t_ah_f_ah_l ay_z
r;20;i don-t wanna leave this world;ay d_ow_n_t w_aa_n_ah l_iy_v dh_ih_s w_er_l_d
d;8;and of my own destiny I know that Im the master;ah_n_d ah_v m_ay ow_n d_eh_s_t_ah_n_iy ay n_ow dh_ae_t ay_m dh_ah m_ae_s_t_er
s;21;but when I do remember me;b_ah_t w_eh_n ay d_uw r_ih_m_eh_m_b_ax m_iy
d;10;and stronger and smarter and I just wanna fall apart like bad plaster;ah_n_d s_t_r_oh_ng_g_ax ah_n_d s_m_aa_r_t_er ah_n_d ay jh_ah_s_t w_aa_n_ah f_aa_l ah_p_aa_r_t l_ay_k b_ae_d p_l_ae_s_t_er
u;45;my girl wouldn-t know what to do but I want her to stay strong;m_ay g_er_l w_uh_d_ah_n_t n_ow w_ah_t t_uw d_uw b_ah_t ay w_aa_n_t hh_er t_uw s_t_ey s_t_r_ao_ng
g;49;and his ass (is) getting haunted if he don-t treat her nice;ah_n_d hh_ih_z ae_s ih_z g_eh_t_ih_ng hh_ao_n_ah_d ah_f hh_iy d_ow_n_t t_r_iy_t hh_er n_ay_s
g;40;and like I said before I don-t wanna die;ah_n_d l_ay_k ay s_eh_d b_ah_f_ao_r ay d_ow_n_t w_aa_n_ah d_ay
e;52;cause Im a pit bull when it comes to my special someone;k_aa_z ay_m ah p_ih_t b_uh_l w_eh_n ih_t k_ah_m_z t_uw m_ay s_p_eh_sh_ah_l s_ah_m_w_ah_n
c;4;and Ive had too many chances to make my life (as) meaningful (as) yours;ah_n_d ay_v hh_ae_d t_uw m_eh_n_iy ch_ae_n_s_ah_z t_uw m_ey_k m_ay l_ay_f ae_z m_iy_n_ih_ng_f_ah_l ae_z y_uh_r_z
i;33;im mad enough to throw my own body in front of a moving car;ay_m m_ae_d ah_n_ah_f t_uw th_r_ow m_ay ow_n b_aa_d_iy ih_n f_r_ah_n_t ah_v ah m_uw_v_ih_ng k_aa_r
h;35;what if Im not remembered;w_ah_t ah_f ay_m n_ax_t r_ah_m_eh_m_b_er_d
m;58;just thinking about it fills me with pain;jh_ah_s_t th_ih_ng_k_ah_ng ah_b_aw_t ih_t f_ih_l_z m_iy w_ih_dh p_ey_n
d;7;and I know deep inside that there ain-t a chance of me being a famous rapper;ah_n_d ay n_ow d_iy_p ih_n_s_ay_d dh_ae_t dh_eh_r ey_n_t ah ch_ae_n_s ah_v m_iy b_iy_ih_ng ah f_ey_m_ah_s r_ae_p_er
d;6;laughter;l_ae_f_t_er
f;29;theyd do anything I asked of them theyre like fucking minions;dh_ey_d d_uw eh_n_iy_th_ih_ng ay ae_s_k_t ah_v dh_eh_m dh_ey_r l_ay_k f_ah_k_ih_ng m_ih_n_y_ah_n_z
e;53;no one-s stopping me like a teenage boy in a school with a machine gun;n_ow w_ah_n_z s_t_aa_p_ih_ng m_iy l_ay_k ah t_iy_n_ey_jh b_oy ih_n ah s_k_uw_l w_ih_dh ey m_ih_sh_iy_n g_ah_n
o;11;cause I can-t keep up and the;k_aa_z ay k_ae_n_t k_iy_p ah_p ah_n_d dh_ah
a;50;nah fuck that Ill climb my rotted ass out of the ground;n_aa f_ah_k dh_ae_t ay_l k_l_ay_m m_ay r_aa_t_ah_d ae_s aw_t ah_v dh_ah g_r_aw_n_d
f;56;to delay my biggest fear laying in the supine position;t_ah d_ah_l_ey m_ay b_ih_g_ah_s_t f_ih_r l_ey_ih_ng ih_n dh_ah s_ah_p_ay_n p_ah_z_ih_sh_ah_n
m;60;but when Im gone I hope you think of Ste in your brain;b_ah_t w_eh_n ay_m g_ao_n ay hh_ow_p y_uw th_ih_ng_k ah_v S_t_er ih_n y_ao_r b_r_ey_n
e;27;but then I remember that it isn-t all about the money;b_ah_t dh_eh_n ay r_ih_m_eh_m_b_ax dh_ae_t ih_t ih_z_n_t ao_l ah_b_aw_t dh_ah m_ah_n_iy
s;28;and I think of all the people that adore me;ah_n_d ay th_ih_ng_k ah_v ao_l dh_ah p_iy_p_ah_l dh_ae_t ah_d_ao_r m_iy
h;23;ill be an immortal memory;ay_l b_iy ae_n ih_m_ao_r_t_ah_l m_eh_m_ax_r_iy
g;17;i just wish I could stay forever I don-t wanna die;ay jh_ah_s_t w_ih_sh ay k_uh_d s_t_ey f_er_eh_v_er ay d_ow_n_t w_aa_n_ah d_ay
i;34;all because nobody ever recognized Unnamed bars;ao_l b_ih_k_ao_z n_ow_b_aa_d_iy eh_v_er r_eh_k_ah_g_n_ay_z_d ah_n_n_ey_m_d b_aa_r_z
f;55;i don-t want my loved ones to be in tears Im on a mission;ay d_ow_n_t w_aa_n_t m_ay l_ah_v_d w_ah_n_z t_uw b_iy ih_n t_eh_r_z ay_m aa_n ah m_ih_sh_ah_n
d;9;but recently it feels (as) though theres another whos much faster;b_ah_t r_iy_s_ah_n_t_l_iy ih_t f_iy_l_z ae_z dh_ow dh_eh_r_s ah_n_ah_dh_er hh_uw_s m_ah_ch f_ae_s_t_er
g;41;this (is) a what if situation that constantly runs through my mind;dh_ih_s ih_z ah w_ah_t ah_f s_ih_ch_uw_ey_sh_ah_n dh_ae_t k_aa_n_s_t_ah_n_t_l_iy r_ah_n_z th_r_uw m_ay m_ay_n_d
b;57;but Id never go the same way (as) Cobain;b_ah_t ay_d n_eh_v_er g_ow dh_ah s_ey_m w_ey ae_z k_ow_b_ey_n
n;5;but it never will be because youre succesful and your life-s filled with;b_ah_t ih_t n_eh_v_er w_ah_l b_iy b_ih_k_ao_z y_uw_r s_ah_k_c_eh_s_f_uw_l ah_n_d y_ao_r l_ay_f_s f_ih_l_d w_ih_dh
