Rhyme Scheme Letter;Line Number;Lyrics;Phonetic Transcription
a;35;quick forward your portion after your order takes a common hit;k_w_ih_k f_ao_r_w_er_d y_ao_r p_ao_r_sh_ah_n ae_f_t_er y_ao_r ao_r_d_er t_ey_k_s ah k_aa_m_ah_n hh_ih_t
f;26;and see them niggas neck bleed;ah_n_d s_iy dh_eh_m n_ih_g_ae_s n_eh_k b_l_iy_d
a;0;tryn-a tell these niggas Xali different;t_ax_r t_eh_l dh_iy_z n_ih_g_ae_s X_ae_l_ax d_ih_f_r_ah_n_t
a;9;poverty with tucking triggers;p_aa_v_er_t_iy w_ih_dh t_ah_k_ih_ng t_r_ih_g_er_z
t;38;this ice cold flow (is) my control for you walking dicks all for the show;dh_ih_s ay_s k_ow_l_d f_l_ow ih_z m_ay k_ah_n_t_r_ow_l f_ao_r y_uw w_ao_k_ih_ng d_ih_k_s ao_l f_ao_r dh_ah sh_ow
g;44;never deal in luck;n_eh_v_er d_iy_l ih_n l_ah_k
o;19;all for better or setting doom gets selected;ao_l f_ao_r b_eh_t_er ao_r s_eh_t_ih_ng d_uw_m g_eh_t_s s_ah_l_eh_k_t_ah_d
c;23;and young thugs approaching they prime;ah_n_d y_ah_ng th_ah_g_z ah_p_r_ow_ch_ih_ng dh_ey p_r_ay_m
i;3;to give em personal causes convictions;t_uw g_ih_v eh_m p_er_s_ah_n_ah_l k_aa_z_ah_z k_ah_n_v_ih_k_sh_ah_n_z
f;37;plenty niggas talking shit;p_l_eh_n_t_iy n_ih_g_ae_s t_ao_k_ih_ng sh_iy_t
a;10;stuffing they pockets due to they option of corrupted fictions;s_t_ah_f_ih_ng dh_ey p_aa_k_ah_t_s d_uw t_uw dh_ey aa_p_sh_ah_n ah_v k_er_ah_p_t_ah_d f_ih_k_sh_ah_n_z
g;46;take cover keep your feelings tucked;t_ey_k k_ah_v_er k_iy_p y_ao_r f_iy_l_ih_ng_z t_ah_k_t
f;25;take lead or take heed;t_ey_k l_iy_d ao_r t_ey_k hh_iy_d
e;22;just decaders for the youth;jh_ah_s_t d_eh_k_ey_d_l_s f_ao_r dh_ah y_uw_th
g;45;either way this life (is) real (as) fuck;iy_dh_er w_ey dh_ih_s l_ay_f ih_z r_iy_l ae_z f_ah_k
a;40;Till real niggas started walking with clips or they stalking your bitch;t_ih_l r_iy_l n_ih_g_ae_s s_t_aa_r_t_ah_d w_ao_k_ih_ng w_ih_dh k_l_ih_p_s ao_r dh_ey s_t_ao_k_ih_ng y_ao_r b_ih_ch
m;8;still this better who (is) just a nigga fucking with killers that fight they;s_t_ih_l dh_ih_s b_eh_t_er hh_uw ih_z jh_ah_s_t ah n_ih_g_ae f_ah_k_ih_ng w_ih_dh k_ih_l_er_z dh_ae_t f_ay_t dh_ey
c;17;helping you cuff dimes;hh_eh_l_p_ih_ng y_uw k_ah_f d_ay_m_z
b;5;niggas simple in their conquest hold no contest;n_ih_g_ae_s s_ih_m_p_ah_l ih_n dh_eh_r k_aa_ng_k_w_eh_s_t hh_ow_l_d n_ow k_aa_n_t_eh_s_t
c;24;hit the bodies with the hammers hold the holsters in time;hh_ih_t dh_ah b_aa_d_iy_z w_ih_dh dh_ah hh_ae_m_er_z hh_ow_l_d dh_ah hh_ow_l_s_t_er_z ih_n t_ay_m
n;15;bloodline bloodline your finger print when you touch 9-s;b_l_ah_d_l_ay_n b_l_ah_d_l_ay_n y_ao_r f_ih_ng_g_er p_r_ih_n_t w_eh_n y_uw t_ah_ch ah_ae_z
a;1;i spit the shit that get your body rhythmic;ay s_p_ih_t dh_iy sh_iy_t dh_ah_t g_ih_t y_uh_r b_aa_d_iy r_ih_dh_m_ih_k
a;39;impressing hoes from you talking stiff;ih_m_p_r_eh_s_ih_ng hh_ow_z f_r_ah_m y_uw t_ao_k_ih_ng s_t_ih_f
g;43;take cover keep your feelings tucked;t_ey_k k_ah_v_er k_iy_p y_ao_r f_iy_l_ih_ng_z t_ah_k_t
c;6;see the niggas who watching you motivated by my state of mind;s_iy dh_ah n_ih_g_ae_s hh_uw w_aa_ch_ih_ng y_uw m_ow_t_ah_v_ey_t_ah_d b_ay m_ay s_t_ey_t ah_v m_ay_n_d
e;21;hella crude they cater some stuff to do;hh_eh_l_ae k_r_uw_d dh_ey k_ey_t_er s_ah_m s_t_ah_f t_uw d_uw
b;34;inhaling with caution losing organs from all this coughing;ih_n_hh_ey_l_ih_ng w_ih_dh k_aa_sh_ah_n l_uw_z_ih_ng ao_r_g_ah_n_z f_r_ah_m ao_l dh_ih_s k_aa_f_ih_ng
s;33;like its a hundred grams of piff;l_ay_k ih_t_s ah hh_ah_n_d_r_ah_d g_r_ae_m_z ah_v f_f
q;31;smoking on some cannabis shit-ll make you (*) cannums (*);s_m_ow_k_ih_ng aa_n s_ah_m k_ae_n_ah_b_ah_s sh_l_iy m_ey_k y_uw ah_ae k_ae_n_uw_m_s ah_ae
d;14;how the fuck do you escape what you relate in the past;hh_aw dh_ah f_ah_k d_uw y_uw ah_s_k_ey_p w_ah_t y_uw r_ah_l_ey_t ih_n dh_ah p_ae_s_t
p;30;outcast alasing the order hella offstandish;aw_t_k_ae_s_t ah_l_ae_s_ih_ng dh_ah ao_r_d_er hh_eh_l_ae ao_f_ha_s_t_ae_n_d_ih_sh
f;27;make up scenes of your seed before you make seeds;m_ey_k ah_p s_iy_n_z ah_v y_ao_r s_iy_d b_ah_f_ao_r y_uw m_ey_k s_iy_d_z
g;42;either way this life (is) real (as) fuck;iy_dh_er w_ey dh_ih_s l_ay_f ih_z r_iy_l ae_z f_ah_k
a;11;clocking 6 figures get their bricks quicker;k_l_aa_k_ih_ng ah_ae f_ih_g_y_er_z g_eh_t dh_eh_r b_r_ih_k_s k_w_ih_k_er
h;2;im talking combinations of comments in place for my competition;ay_m t_ao_k_ih_ng k_aa_m_b_ah_n_ey_sh_ah_n_z ah_v k_aa_m_eh_n_t_s ih_n p_l_ey_s f_ao_r m_ay k_aa_m_p_ah_t_ih_sh_ah_n
c;16;8 bars breaking the tough times;ah_ae b_aa_r_z b_r_ey_k_ih_ng dh_iy t_ah_f t_ay_m_z
f;36;pussies contorted leaking waste from all that talking shit;p_uh_s_iy_s k_ah_n_t_ao_r_t_ah_d l_iy_k_ih_ng w_ey_s_t f_r_ah_m ao_l dh_ae_t t_ao_k_ih_ng sh_iy_t
d;29;im the menace of the mansion;ay_m dh_ah m_eh_n_ah_s ah_v dh_ah m_ae_n_sh_ah_n
r;32;puffin on something crash landing if you mishandling;p_ah_f_ih_n aa_n s_ah_m_th_ih_ng k_r_ae_sh l_ae_n_d_ih_ng ih_f y_uw m_ih_s_hh_ae_n_d_l_ih_ng
l;4;you no content no concept no caustic no type of complex;y_uw n_ow k_ax_n_t_eh_n n_ow k_aa_n_s_eh_p_t n_ow k_aa_s_t_ih_k n_ow t_ay_p ah_v k_oh_m_p_l_eh_k_s
c;7;fear from harsh reality only get greater with time;f_ih_r f_r_ah_m hh_aa_r_sh r_iy_ae_l_ah_t_iy ow_n_l_iy g_eh_t g_r_ey_t_er w_ih_dh t_ay_m
e;20;or choose to move with intentions to elude;ao_r ch_uw_z t_uw m_uw_v w_ih_dh ih_n_t_eh_n_ch_ah_n_z t_uw ah_l_uw_d
d;13;know some brothers raised under the flag;n_ow s_ah_m b_r_ah_dh_er_z r_ey_z_d ah_n_d_er dh_ah f_l_ae_g
e;18;in this life know you can-t choose your womb;ih_n_ch dh_ah_s l_ay_f n_ow y_uw k_ae_n_t ch_uw_z y_ao_r w_uw_m
