Rhyme Scheme Letter;Line Number;Lyrics;Phonetic Transcription
a;1;when you the one than never knew you was the one until the world put that;hh_w_ih_n y_uw dh_iy hh_w_ah_n dh_ah_n n_eh_v_er n_y_uw y_uw w_ah_z dh_iy hh_w_ah_n ah_n_t_ih_l dh_iy w_er_l_d p_uh_t dh_ah_t
a;0;when you the one the world look at;hh_w_ih_n y_uw dh_iy hh_w_ah_n dh_iy w_er_l_d l_uh_k ae_t
d;5;i took y-all joy I know how sadness feels;ay t_uh_k y_ao_l jh_oy ay n_ow hh_aw s_ae_d_n_ah_s f_iy_l_z
e;6;from inside out I know how bad its been;f_er_m ih_n_s_ay_d aw_t ay n_ow hh_aw b_ae_d ih_t_s b_ih_n
f;8;from now on when I leave town the whole squad come with;f_r_ah_m n_aw aa_n w_eh_n ay l_iy_v t_aw_n dh_ah hh_ow_l s_k_w_aa_d k_ah_m w_ih_dh
c;3;way way before the jumpman came;w_ey w_ey b_iy_f_ao_r dh_iy jh_ah_m_p_m_ae_n k_ey_m
a;10;never try to flex for a blog post;n_eh_v_er t_r_ay t_uw f_l_eh_k_s f_ao_r ah b_l_aa_b_g p_ow_s_t
b;2;title on you I been on this Micheal Jordan;t_ay_t_ah_l aa_n y_uw ay b_ah_n aa_n dh_ah_s m_ay_k_ah_l jh_ao_r_d_ah_n
