Rhyme Scheme Letter;Line Number;Lyrics;Phonetic Transcription
a;8;go broke from your lost position No home or a pot to piss in;g_ow b_r_ow_k f_r_ah_m y_ao_r l_ao_s_t p_ah_z_ih_sh_ah_n n_ow hh_ow_m ao_r ah p_aa_t t_uw p_ih_s ih_n
a;1;im going to rot in prison I-Ve Broken the laws of physics;ay_m g_ow_ih_ng t_uw r_aa_t ih_n p_r_ih_z_ah_n ay_v b_r_ow_k_ah_n dh_ah l_ao_z ah_v f_ih_z_ih_k_s
c;23;teaching paleontology to an alien colony;t_iy_ch_ih_ng p_ey_l_iy_ah_n_t_aa_l_ah_jh_iy t_uw ae_n ey_l_iy_ah_n k_aa_l_ah_n_iy
d;20;fire bars ignite flaming light on y-all Cuz Im greater;f_ay_er b_aa_r_z ih_g_n_ay_t f_l_ey_m_ih_ng l_ay_t aa_n y_ao_l k_ah_z ay_m g_r_ey_t_er
b;10;to me cuz I-M jottin writtens that bolts over common (spittin-);t_uw m_iy k_ah_z ay_m jh_aa_t_t_ih_n r_ih_t_ah_n_z dh_ae_t b_ow_l_t_s ow_v_er k_aa_m_ah_n s_p_ih_t_t_ih_n_eh
a;4;your flow (is) so awful in this you blow like a common mistress;y_ao_r f_l_ow ih_z s_ow aa_f_ah_l ih_n dh_ih_s y_uw b_l_ow l_ay_k ah k_aa_m_ah_n m_ih_s_t_r_ah_s
a;13;thats golden Ive got the vision I know it Im on a mission;dh_ae_t_s g_ow_l_d_ah_n ay_v g_aa_t dh_ah v_ih_zh_ah_n ay n_ow ih_t ay_m aa_n ah m_ih_sh_ah_n
b;26;got A lot of drive like 60 civics Modified with hemi engines;g_aa_t ah l_aa_t ah_v d_r_ay_v l_ay_k  s_ih_v_ih_k_s m_aa_d_ah_f_ay_d w_ih_dh hh_eh_m_iy eh_n_jh_ah_n_z
b;33;im the light Im pretty vivid Psycho mind like jimi hendrix;ay_m dh_ah l_ay_t ay_m p_r_ih_t_iy v_ih_v_ah_d s_ay_k_ow m_ay_n_d l_ay_k jh_ih_m_iy hh_eh_n_d_r_ih_k_s
a;0;my flow (is) so raw and twisted Im colder than all the winters;m_ay f_l_ow ah_z s_ow r_aa ah_n_d t_w_ih_s_t_ah_d ay_m k_ow_l_d_er dh_ae_n ao_l dh_ah w_ih_n_t_er_z
d;21;might just make-em think I train in Hyberbolic time chambers;m_ay_t jh_ah_s_t m_m_ah th_ih_ng_k ay t_r_ey_n ih_n  t_ay_m ch_ey_m_b_er_z
a;12;stay going Im always driven In moments Ill cop the ticket;s_t_ey g_ow_ih_ng ay_m ao_l_w_ey_z d_r_ih_v_ah_n ih_n m_ow_m_ah_n_t_s ay_l k_aa_p dh_ah t_ih_k_ah_t
a;6;you jokes Are my competition I-M roasting you all to cinders;y_uw jh_ow_k_s aa_r m_ay k_aa_m_p_ah_t_ih_sh_ah_n ay_m r_ow_s_t_ih_ng y_uw ao_l t_uw s_ih_n_d_er_z
a;31;i qoute lines thats clearly different I provide Sincerely driven;ay q_ao_uw_t_ax l_ay_n_z dh_ae_t_s k_l_ih_r_l_iy d_ih_f_r_ax_n_t ay p_r_ah_v_ay_d s_ih_n_s_ih_r_l_iy d_r_ih_v_ah_n
l;22;…  Im an amazing anomaly; ah_ae ay_m ae_n ah_m_ey_z_ih_ng ah_n_aa_m_ah_l_iy
c;15;like showing Muhammad-s image to those that are not of islam;l_ay_k sh_ow_ih_ng m_uh_hh_aa_m_ah_d_z ih_m_ah_jh t_uw dh_ow_z dh_ae_t aa_r n_ax_t ah_v ih_s_l_aa_m
d;18;ive been called divine savior writing on this line paper;ay_v b_ih_n k_ao_l_d d_ih_v_ay_n s_ey_v_y_er r_ay_t_ih_ng aa_n dh_ih_s l_ay_n p_ey_p_er
a;29;dollar signs descending digits Ill decide whos getting business;d_aa_l_er s_ay_n_z d_ah_s_eh_n_d_ih_ng d_ih_jh_ah_t_s ay_l d_ah_s_ay_d hh_uw_s g_eh_t_ih_ng b_ih_z_n_ah_s
a;11;ill motivate top decisions of folks that are talkin business;ay_l m_ow_t_ah_v_ey_t t_aa_p d_ah_s_ih_zh_ah_n_z ah_v f_ow_k_s dh_ae_t aa_r t_aa_k_ah_n b_ih_z_n_ah_s
a;5;you know that Im awesome listen my quotes are like godly Scriptures;y_uw n_ow dh_ae_t ay_m aa_s_ah_m l_ih_s_ah_n m_ay k_w_ow_t_s aa_r l_ay_k g_aa_d_l_iy s_k_r_ih_p_ch_er_z
a;28;all Those guys are penny (pinchin-) All those lives Ill quickly finish;ao_l dh_ow_z g_ay_z aa_r p_eh_n_iy p_ih_n_ch_iy_n_eh ao_l dh_ow_z l_ih_v_z ay_l k_w_ih_k_l_iy f_ih_n_ih_sh
e;24;i am crazy At jotting schemes hear the greatness I-M dropping see;ay ae_m k_r_ey_z_iy ae_t jh_aa_t_t_ih1_n_g s_k_iy_m_z hh_ih_r dh_ah g_r_ey_t_n_ah_s ay_m d_r_aa_p_ih_ng s_iy
i;16;Now Im showing a loss of interest;n_aw ay_m sh_ow_ih_ng ah l_ao_s ah_v ih_n_t_r_ax_s_t
e;25;theres no way that Ill stop to leave ‘  til Im ranked (as) a God emcee;dh_eh_r_s n_ow w_ey dh_ae_t ay_l s_t_aa_p t_uw l_iy_v  ah_ae t_ih_l ay_m r_ae_ng_k_t ae_z ah g_aa_d eh_m_s_iy
h;14;its over just call it finished I hope that youre all offended;ih_t_s ow_v_er jh_ah_s_t k_ao_l ih_t f_ih_n_ih_sh_t ay hh_ow_p dh_ae_t y_uw_r ao_l ah_f_eh_n_d_ah_d
f;30;im the guy That-S really gifted Not surprised I swiftly kill it;ay_m dh_ah g_ay dh_ae_t_s r_ih_l_iy g_ih_f_t_ah_d n_ax_t s_ax_p_r_ay_z_d ay s_w_ih_f_t_l_iy k_ih_l ih_t
a;7;ill go to the top with lyrics Ill own Every spot in minutes;ay_l g_ow t_uw dh_ah t_aa_p w_ih_dh l_ih_r_ih_k_s ay_l ow_n eh_v_er_iy s_p_aa_t ih_n m_ih_n_ah_t_s
a;27;i don-t (lie-bout) spending riches killing men or any fiction;ay d_ow_n_t l_ay_b_aw_t s_p_eh_n_d_ih_ng r_ih_ch_ah_z k_ih_l_ih_ng m_eh_n ao_r eh_n_iy f_ih_k_sh_ah_n
a;9;no homies or flocks of women no dough cuz its all been given;n_ow hh_aa_m_ah_er_s ao_r f_l_aa_k_s ah_v w_ih_m_ah_n n_ow d_ow k_ah_z ih_t_s ao_l b_ih_n g_ih_v_ah_n
d;19;tightest on the mic makin guys just wan na die later;t_ay_t_ah_s_t aa_n dh_ah m_ih_k m_ae_k_ih_n g_ay_z jh_ah_s_t w_aa_n n_aa d_ay l_ey_t_er
g;3;grabbed hold of the stars and moon just to throw at the opposition;g_r_ae_b_d hh_ow_l_d ah_v dh_ah s_t_aa_r_z ah_n_d m_uw_n jh_ah_s_t t_uw th_r_ow ae_t dh_ah aa_p_ah_z_ih_sh_ah_n
a;32;time goes by my fifteen minutes won-t decline transending limits;t_ay_m g_ow_z b_ay m_ay f_ih_f_t_iy_n m_ih_n_ah_t_s w_ow_n_t d_ih_k_l_ay_n t_r_ae_n_z_ha_eh_n_d_ih_ng l_ih_m_ah_t_s
f;2;the globe-s In my palm I gripped it just so I can stop its spinnin- ;dh_ah g_l_ow_b_z ih_n m_ay p_aa_m ay g_r_ih_p_t ih_t jh_ah_s_t s_ow ay k_ah_n s_t_aa_p ih_t_s  s_p_ih_n_ih_ng_ae
