Rhyme Scheme Letter;Line Number;Lyrics;Phonetic Transcription
b;4;a homie said why waste in 25 to life- ;ey hh_ao_m_iy_ax s_eh_d hh_w_ay w_ey_s_t ih_n  t_ah  l_ay_f
b;2;rapping was a bitch For me Hustling was my wife;r_ae_p_ih_ng w_ah_z ey b_ih_ch f_ao_r m_iy hh_ah_s_ah_l_ih_ng w_ah_z m_ay w_ay_f
a;6;with the dope ass beat and the beasty flow;w_ah_dh dh_iy d_ow_p ae_s b_iy_t ah_n_d dh_iy b_iy_s_t_iy f_l_ow
c;8;man I got skills I can kill with the beat;m_ae_n ay g_aa_t s_k_ih_l_z ay k_ae_n k_ih_l w_ah_dh dh_iy b_iy_t
d;10;this song (is) for every inches of dhaka;dh_ah_s s_ao_ng ah_z f_r_er eh_v_r_iy ih_n_ch_ah_z ah_v d_aa_k_ah
d;22;in bengali;ih_n b_eh_ng_g_aa_l_iy
c;9;you spit for yourself I spit for my streets;y_uw s_p_ih_t f_r_er y_ao_r_s_eh_l_f ay s_p_ih_t f_r_er m_ay s_t_r_iy_t_s
g;38;to all the beefers that wan na beef bitch stay down;t_uw ao_l dh_ah b_iy_f_er_r_s dh_ae_t w_aa_n n_aa b_iy_f b_ih_ch s_t_ey d_aw_n
b;5;when You got skills like a mac 10 so fine;hh_w_ih_n y_uw g_aa_t s_k_ih_l_z l_ay_k ey m_ae_k  s_ow f_ay_n
f;12;its a street shit for you so turn system up;ih_t_s ah s_t_r_iy_t sh_iy_t f_ao_r y_uw s_ow t_er_n s_ih_s_t_ah_m ah_p
c;27;welcome to the hood theke D O P E;w_eh_l_k_ah_m t_uw dh_ah hh_uh_d k_er d_iy ow p_iy iy
e;17;the streets know me cus They know the shit I-Ve been through;dh_ah s_t_r_iy_t_s n_ow m_iy k_ah dh_ey n_ow dh_ah sh_iy_t ay_v b_ih_n th_r_uw
m;26;punkstah ke eita shobai Ke janaisi;p_uw_n_k_s_t_ax_hh g_k t_ae sh_ao_b_ae_ax K_er 
n;28;same flow same rhythm e ami kapaitesi;s_ey_m f_l_ow s_ey_m r_ih_dh_ah_m iy aa_m_iy k_ah_p_ae_ax_t_e_z_i
b;19;my story goes through every words and every line;m_ay s_t_ao_r_iy g_ow_z th_r_uw eh_v_er_iy w_er_d_z ah_n_d eh_v_er_iy l_ay_n
a;1;in the night on the club Bang some hoes;ih_n dh_iy n_ay_t aa_n dh_iy k_l_ah_b b_ae_ng s_ah_m hh_ow_z
f;13;and smash everything whats up front;ah_n_d s_m_ae_sh eh_v_r_iy_th_ih_ng w_ah_t_s ah_p f_r_ah_n_t
a;34;emon on the beat thats how shit goes;eh_m_ah_n aa_n dh_ah b_iy_t dh_ae_t_s hh_aw sh_iy_t g_ow_z
f;31;with underworld hiphop crew niggas can-t fuck with us;w_ih_dh ah_n_d_er_w_er_l_d hh_ih_p_hh_aa_p k_r_uw n_ih_g_ah_z k_ae_n_t f_ah_k w_ih_dh ah_s
c;33;vxl raf saz and alter ego; r_ae_f s_aa_z ah_n_d ao_l_t_er iy_g_ow
f;32;we the real souljas We only aim to bust;w_iy dh_ah r_iy_l s_ow_l_jh_ey_m_z w_iy ow_n_l_iy ey_m t_uw b_ah_s_t
a;0;i used to def jam doing crime sell some dope;ay y_uw_z_d t_ah d_iy_f jh_ae_m d_uw_ih_ng k_r_ay_m s_eh_l s_ah_m d_ow_p
f;36;to all the brothers on th streets put your hands up;t_uw ao_l dh_ah b_r_ah_dh_er_z aa_n t_iy_ey_ch s_t_r_iy_t_s p_uh_t y_ao_r hh_ae_n_d_z ah_p
e;11;a shout out to all of U mothafuckas;ey sh_aw_t aw_t t_ah ao_l ah_v ih_k m_ao_th_ah_f_uw_k_k_ax_s
b;15;i can see the fear right through your mothafuckin Eyes;ay k_ah_n s_iy dh_ah f_ih_r r_ay_t th_r_uw y_ao_r m_ao_th_ah_f_uw_k_k_ax_n ay_z
m;23;dui hazar noy theke tero chaar bosor dhoira kapaisi;d_iy_y_uw_ay hh_ae_z_er n_oy k_er t_er_oh ch_aa_ae_r b_ow_s_ow_l d_hh_ao_iy_r_ax k_ae_p_ax_i_z_i
b;14;punkstah (is) the name Remember till u die;p_uw_n_k_s_t_ax_hh ih_z dh_ah n_ey_m r_ah_m_eh_m_b_er t_ih_l ih_k d_ay
l;20;thats the origami of the streets and origami of my life 2x;dh_ae_t_s dh_ah ao_r_ih_g_a_m_iy ah_v dh_ah s_t_r_iy_t_s ah_n_d ao_r_ih_g_a_m_iy ah_v m_ay l_ay_f 
g;37;to all the hoes I used to love bitch stay down;t_uw ao_l dh_ah hh_ow_z ay y_uw_z_d t_uw l_ah_v b_ih_ch s_t_ey d_aw_n
i;18;im maybe new to the game but im still oldschool;ih_m m_ey_b_iy n_y_uw t_uw dh_ah g_ey_m b_ah_t ih_m s_t_ih_l ow_l_d_z_ch_uw1_l
b;3;get The cash check the gat ready to fight;g_ih_t dh_ah k_ae_sh ch_eh_k dh_iy g_ae_t r_eh_d_iy t_ah f_ay_t
d;29;shuru hoile toh ami ar thamte chai na;sh_er_uw l_er t_uw_ae aa_m_iy aa_r th_t_er ch_ay n_aa
h;7;i never looked back in no hustling no more;ay n_eh_v_er l_uh_k_t b_ae_k ih_n n_ow hh_ah_s_l_ih_ng n_ow m_ao_r
f;35;to all the homies in the corner put your hands Up;t_uw ao_l dh_ah hh_aa_m_ah_er_s ih_n dh_ah k_ao_r_n_er p_uh_t y_ao_r hh_ae_n_d_z ah_p
n;25;je jei kothai bolse buk fulaya agaisi;jh_eh jh_iy_iy k_ao_th_ae_ax b_ow_l_s_ah_ae b_y_uw_ah_k f_ah_l_ah_iy_ax ae_g_a_i_z_i
d;30;ar kawre toh akhn ar chance dei na;aa_r k_aa_w_r_er t_uw_ae ae_k_hh_n aa_r ch_ae_n_s d_iy n_aa
