Rhyme Scheme Letter;Line Number;Lyrics;Phonetic Transcription
g;45;thats some shit losing my mind;dh_ae_t_s s_ah_m sh_iy_t l_uw_z_ih_ng m_ay m_ay_n_d
i;41;your stuck on buying drinks and getting juiced up;y_ao_r s_t_ah_k aa_n b_ay_ih_ng d_r_ih_ng_k_s ah_n_d g_eh_t_ih_ng jh_uw_s_ih_p ah_p
f;14;trying to build a dynasty and enterprise up off the rhyming shit;t_r_ay_ng t_ah b_ih_l_d ey d_ay_n_ah_s_t_iy ah_n_d eh_n_t_er_p_r_ay_z ah_p ao_f dh_iy r_ay_m_ih_ng sh_iy_t
d;8;grateful to have a dad some don-t when theyre born;g_r_ey_t_f_ah_l t_uw hh_ae_v ah d_ae_d s_ah_m d_ow_n_t w_eh_n dh_ey_r b_ao_r_n
i;49;maybe you can learning something;m_ey_b_iy y_uw k_ah_n l_er_n_ih_ng s_ah_m_th_ih_ng
l;57;thats how the game goes;dh_ae_t_s hh_aw dh_ah g_ey_m g_ow_z
c;17;just to make a mark you know to make it stick;jh_ah_s_t t_uw m_ey_k ah m_aa_r_k y_uw n_ow t_uw m_ey_k ih_t s_t_ih_k
g;33;well damn at least I got mine;w_eh_l d_ae_m ae_t l_iy_s_t ay g_aa_t m_ay_n
h;29;thats the rap life no I don-t fake;dh_ae_t_s dh_ah r_ae_p l_ay_f n_ow ay d_ow_n_t f_ey_k
g;46;but I plan to be around for a real long time;b_ah_t ay p_l_ae_n t_uw b_iy er_aw_n_d f_ao_r ah r_iy_l l_ao_ng t_ay_m
i;28;nice rims on the car but I can-t gas this bitch up;n_ay_s r_ih_m_z aa_n dh_ah k_aa_r b_ah_t ay k_ae_n_t g_ae_s dh_ih_s b_ih_ch ah_p
g;34;thats the best 30 seconds of your life girl stop lying;dh_ae_t_s dh_ah b_eh_s_t  s_eh_k_ah_n_d_z ah_v y_ao_r l_ay_f g_er_l s_t_aa_p l_ay_ih_ng
g;15;get a mind of a mad scientist to devise;g_eh_t ah m_ay_n_d ah_v ah m_ae_d s_ay_ah_n_t_ah_s_t t_ah d_ih_v_ay_s
q;38;mouthpiece and the beers can take you girlfriend;m_aw_th_p_iy_s ah_n_d dh_ah b_ih_r_z k_ah_n t_ey_k y_uw g_er_l_f_r_eh_n_d
c;47;you bitch;y_uw b_ih_ch
c;44;then get off the bus for her boyfriend and they started kissing;dh_eh_n g_eh_t ao_f dh_ah b_ah_s f_ao_r hh_er b_oy_f_r_eh_n_d ah_n_d dh_ey s_t_aa_r_t_ah_d k_ih_s_ih_ng
c;43;seen the chick suck four dicks in one visit;s_iy_n dh_ah ch_ih_k s_ah_k f_ao_r d_ih_k_s ih_n w_ah_n v_ih_z_ah_t
l;55;thats how the game goes;dh_ae_t_s hh_aw dh_ah g_ey_m g_ow_z
d;40;this shit (is) like a pussy getting shortcut;dh_ih_s sh_iy_t ih_z l_ay_k ah p_uh_s_iy g_eh_t_ih_ng sh_ao_r_t_k_ah_t
a;6;try to save up to get this tumor off my chest;t_r_ay t_uw s_ey_v ah_p t_uw g_eh_t dh_ih_s t_uw_m_er ao_f m_ay ch_eh_s_t
i;39;real shit especially a tour bus;r_iy_l sh_iy_t ah_s_p_eh_sh_l_iy ah t_uh_r b_ah_s
d;12;big lips but in ten years theyll be deformed;b_ih_g l_ih_p_s b_ah_t ih_n_ch t_eh_n y_er_z dh_ey_l b_iy d_ah_f_ao_r_m_d
b;7;my dad just had surgery while I was at tour;m_ay d_ae_d jh_ah_s_t hh_ae_d s_er_jh_er_iy w_ay_l ay w_ah_z ae_t t_uh_r
c;4;head first splat Good night kids;hh_eh_d f_er_s_t s_p_l_ae_t g_uh_d n_ay_t k_ih_d_z
g;19;i been through more shit than a sewage pipe;ay b_ah_n th_r_uw m_ao_r sh_iy_t dh_ah_n ey s_uw_ih_jh p_ay_p
l;53;thats how the game goes;dh_ae_t_s hh_aw dh_ah g_ey_m g_ow_z
a;37;thats the realness its all about the ends;dh_ae_t_s dh_ah r_iy_l_n_eh_s ih_t_s ao_l ah_b_aw_t dh_ah eh_n_d_z
c;3;the other day I thought about jumping from Sunset Cliffs;dh_iy ah_dh_er d_ey ay th_ao_t ah_b_aw_t jh_ah_m_p_ih_ng f_er_m s_ah_n_s_eh_t k_l_ih_f_s
h;24;my love life so weak probably marry my skateboard;m_ay l_ah_v l_ay_f s_ow w_iy_k p_r_aa_b_ah_b_l_iy m_eh_r_iy m_ay s_k_ey_t_b_ao_r_d
c;36;cause you can-t buy time but you can buy a bitch;k_aa_z y_uw k_ae_n_t b_ay t_ay_m b_ah_t y_uw k_ae_n b_ay ey b_ih_ch
m;52;thats what Im about;dh_ae_t_s w_ah_t ay_m ah_b_aw_t
a;5;shout out to all the fucking drugs that provide my stress;sh_aw_t aw_t t_uw ao_l dh_ah f_ah_k_ih_ng d_r_ah_g_z dh_ae_t p_r_ah_v_ay_d m_ay s_t_r_eh_s
c;18;if you think Im corny cause Im friends with Nick then suck a dick;ah_f y_uw th_ih_ng_k ay_m k_ao_r_n_iy k_aa_z ay_m f_r_eh_n_z w_ah_dh n_ih_k dh_eh_n s_ah_k ey d_ih_k
m;54;thats what Im about;dh_ae_t_s w_ah_t ay_m ah_b_aw_t
l;51;thats how the game goes;dh_ae_t_s hh_aw dh_ah g_ey_m g_ow_z
o;25;thinking bout death on the daily but can you blame me;th_ih_ng_k_ah_ng b_aw_t d_eh_th aa_n dh_ah d_ey_l_iy b_ah_t k_ah_n y_uw b_l_ey_m m_iy
c;35;thats why Im focused on the grip;dh_ae_t_s w_ay ay_m f_ow_k_ah_s_t aa_n dh_ah g_r_ih_p
e;11;with fake tits and ass shots and silicon scars;w_ih_dh f_ey_k t_ih_t_s ah_n_d ae_s sh_aa_t_s ah_n_d s_ih_l_ah_k_ah_n s_k_aa_r_z
n;9;i wonder what the fuck am I working so hard for;ay w_ah_n_d_er w_ah_t dh_ah f_ah_k ae_m ay w_er_k_ih_ng s_ow hh_aa_r_d f_ao_r
m;60;thats what Im about;dh_ae_t_s w_ah_t ay_m ah_b_aw_t
l;59;thats how the game goes;dh_ae_t_s hh_aw dh_ah g_ey_m g_ow_z
g;20;me and moms used to have to find a place to sleep at night;m_iy ah_n_d m_aa_m_z y_uw_z_d t_ah hh_ae_v t_uw f_ay_n_d ah p_l_ey_s t_uw s_l_iy_p ae_t n_ay_t
h;26;eighty days on the road can make anybody go crazy;ey_t_iy d_ey_z aa_n dh_ah r_ow_d k_ah_n m_ey_k eh_n_iy_b_ah_d_iy g_ow k_r_ey_z_iy
c;16;a plan to spray my name on the side of Obamas crib;ey p_l_ae_n t_ah s_p_r_ey m_ay n_ey_m aa_n dh_ah s_ay_d ah_v O_b_ae_m_ax_s k_r_ih_b
b;1;we interrupt this record to bring you a special bulletin;w_iy ih_n_er_ah_p_t dh_ah_s r_ah_k_ao_r_d t_ah b_r_ih_ng y_uw ey s_p_eh_sh_ah_l b_uh_l_ah_t_ah_n
h;30;only day I take a bitch from (is) noodles at my place;ow_n_l_iy d_ey ay t_ey_k ah b_ih_ch f_r_ah_m ih_z n_uw_d_ah_l_z ae_t m_ay p_l_ey_s
e;22;at least we had a car look at the bright side of the dark;ae_t l_iy_s_t w_iy hh_ae_d ah k_aa_r l_uh_k ae_t dh_ah b_r_ay_t s_ay_d ah_v dh_ah d_aa_r_k
d;10;so I can pull up nice car and bad broad;s_ow ay k_ah_n p_uh_l ah_p n_ay_s k_aa_r ah_n_d b_ae_d b_r_ao_d
d;23;i been gone so long got no friends anymore;ay b_ih_n g_ao_n s_ow l_ao_ng g_aa_t n_ow f_r_eh_n_d_z eh_n_iy_m_ao_r
i;42;i can guarantee my life (is) more fun;ay k_ah_n g_eh_r_ah_n_t_iy m_ay l_ay_f ih_z m_ao_r f_ah_n
p;32;she let me fuck and bust a nut and I just stop trying;sh_iy l_eh_t m_iy f_ah_k ah_n_d b_ah_s_t ah n_ah_t ah_n_d ay jh_ah_s_t s_t_aa_p t_r_ay_ih_ng
e;21;either in the motel room or the car;iy_dh_er ih_n dh_ah m_ow_t_eh_l r_uw_m ao_r dh_ah k_aa_r
a;0;we should examine carefully;w_iy sh_uh_d ih_g_z_ae_m_ah_n k_eh_r_f_ah_l_iy
i;50;maybe you can learning something;m_ey_b_iy y_uw k_ah_n l_er_n_ih_ng s_ah_m_th_ih_ng
f;13;no Fuck these hoes and fuck that shiny shit;n_ow f_ah_k dh_iy_z hh_ow_z ah_n_d f_ah_k dh_ah_t sh_ay_n_iy sh_iy_t
g;31;top ramen and a beer call it wine and dining;t_aa_p r_ae_m_er_n ah_n_d ah b_ih_r k_ao_l ih_t w_ay_n ah_n_d d_ay_n_ih_ng
i;27;my mind fucked working to find bucks;m_ay m_ay_n_d f_ah_k_t w_er_k_ih_ng t_uw f_ay_n_d b_ah_k_s
m;56;thats what Im about;dh_ae_t_s w_ah_t ay_m ah_b_aw_t
m;58;thats what Im about;dh_ae_t_s hh_w_ah_t ay_m ah_b_aw_t
