Rhyme Scheme Letter;Line Number;Lyrics;Phonetic Transcription
a;0;ice on my chain diamonds shining swinging it side ways haters got me wrong;ay_s aa_n m_ay ch_ey_n d_ay_m_ah_n_d_z sh_ay_n_ih_ng s_w_ih_ng_ih_ng ah_t s_ay_d w_ey_z hh_ey_t_er_z g_aa_t m_iy r_ao_ng
c;2;eye doctor where should I go if I can-t see right walls show best work of art;ay d_aa_k_t_er hh_w_eh_r sh_uh_d ay g_ow ih_f ay k_ae_n_t s_iy r_ay_t w_ao_l_z sh_ow b_eh_s_t w_er_k ah_v aa_r_t
b;4;straight;s_t_r_ey_t
b;1;when I walk in sight tattoos are my work of art on my skin see better with the;hh_w_ih_n ay w_ao_k ih_n_ch s_ay_t t_ae_t_uw_z er m_ay w_er_k ah_v aa_r_t aa_n m_ay s_k_ih_n s_iy b_eh_t_er w_ah_dh dh_iy
a;3;to the world to see shades on at night nice view to see I keep on walking;t_uw dh_ah w_er_l_d t_uw s_iy sh_ey_d_z aa_n ae_t n_ay_t n_ay_s v_y_uw t_uw s_iy ay k_iy_p aa_n w_ao_k_ih_ng
