Rhyme Scheme Letter;Line Number;Lyrics;Phonetic Transcription
i;0;produced by The Entreproducers;p_r_ah_d_uw_s_t b_ay dh_ah 
a;2;touch Taste Sight Smell Hearing;t_ah_ch t_ey_s_t s_ay_t s_m_eh_l hh_ih_r_ih_ng
l;3;these are the senses that connect us to the world;dh_iy_z er dh_iy s_eh_n_s_ah_z dh_ah_t k_ah_n_eh_k_t y_uw_eh_s t_ah dh_iy w_er_l_d
m;4;but Are there more than 5 senses;b_ah_t aa_r dh_eh_r m_ao_r dh_ae_n ah_ae s_eh_n_s_ah_z
b;6;dreaming of things that two eyes can never see;d_r_iy_m_ih_ng ah_v th_ih_ng_z dh_ae_t t_uw ay_z k_ah_n n_eh_v_er s_iy
a;7;consciousness future levels that he never did;k_aa_n_sh_ah_s_n_ah_s f_y_uw_ch_er l_eh_v_ah_l_z dh_ae_t hh_iy n_eh_v_er d_ih_d
a;8;imagine fathomable but the story only brings;ih_m_ae_jh_ah_n f_ae_dh_ah_m_ah_b_ah_l b_ah_t dh_ah s_t_ao_r_iy ow_n_l_iy b_r_ih_ng_z
a;9;an unimaginable trinity to a king;ae_n ah_n_ah_m_ae_jh_ah_n_ah_b_ah_l t_r_ih_n_ah_t_iy t_uw ah k_ih_ng
a;10;who traded the adversities of sin;hh_uw t_r_ey_d_ah_d dh_ah ae_d_v_er_s_ah_t_iy_s ah_v s_ih_n
c;11;so He could transcend to a gloriful place;s_ow hh_iy k_uh_d t_r_ae_n_s_eh_n_d t_uw ah g_l_ao_r_iy_f_uh_l p_l_ey_s
c;12;he loved the beneficial fruit so plentiful in taste;hh_iy l_ah_v_d dh_ah b_eh_n_ah_f_ih_sh_ah_l f_r_uw_t s_ow p_l_eh_n_t_ah_f_ah_l ih_n t_ey_s_t
c;13;and rid superficial delusions of a human race;ah_n_d r_ih_d s_uw_p_er_f_ih_sh_ah_l d_ah_l_uw_zh_ah_n_z ah_v ah hh_y_uw_m_ax_n r_ey_s
d;14;visions of that world (is) what keeps the strong alive;v_ih_zh_ah_n_z ah_v dh_ae_t w_er_l_d ih_z w_ah_t k_iy_p_s dh_ah s_t_r_ao_ng ah_l_ay_v
d;15;but Im immortal so my souls never afraid to die;b_ah_t ay_m ih_m_ao_r_t_ah_l s_ow m_ay s_ow_l_z n_eh_v_er ah_f_r_ey_d t_ah d_ay
a;16;a young pharaoh walking amongst these human lives;ey y_ah_ng f_eh_r_ow w_ao_k_ih_ng ah_m_ah_ng_s_t dh_iy_z y_uw_m_ah_n l_ih_v_z
d;17;consciousness (is) higher;k_aa_n_sh_ah_s_n_ah_s ah_z hh_ay_er
n;18;reaching and grabbing my desires;r_iy_ch_ih_ng ah_n_d g_r_ae_b_ih_ng m_ay d_ah_z_ay_r_z
d;19;the elevated saint creating with his third eye;dh_iy eh_l_ah_v_ey_t_ah_d s_ey_n_t k_r_iy_ey_t_ih_ng w_ah_dh hh_ah_z th_er_d ay
a;20;woke up out of a dream covered in gold like a wristwatch;w_ow_k ah_p aw_t ah_v ah d_r_iy_m k_ah_v_er_d ih_n g_ow_l_d l_ay_k ah r_ih_s_t_w_aa_ch
e;21;now watch (as) I masterfully steal the top spot;n_aw w_aa_ch ae_z ay m_ae_s_t_er_f_ah_l_iy s_t_iy_l dh_ah t_aa_p s_p_aa_t
e;22;i pop like a killer waiting on your doorstop;ay p_aa_p l_ay_k ah k_ih_l_er w_ey_t_ih_ng aa_n y_ao_r d_ao_r_z_t_aa_p
o;23;no straps cause My heart equipped nigga for combat;n_ow s_t_r_ae_p_s k_aa_z m_ay hh_aa_r_t ih_k_w_ih_p_t n_ih_g_ae f_ao_r k_oh_m_b_ae_t
f;24;no rats finest in my clip We reinforce that;n_ow r_ae_t_s f_ay_n_ah_s_t ih_n m_ay k_l_ih_p w_iy r_iy_ih_n_f_ao_r_s dh_ae_t
f;25;boss stats We on our way back (we-bout) to change rap;b_ao_s s_t_ae_t_s w_iy aa_n aw_r w_ey b_ae_k w_eh_b_aw_t t_uw ch_ey_n_jh r_ae_p
f;26;face punt any nigga in our way so keep back;f_ey_s p_ah_n_t eh_n_iy n_ih_g_ae ih_n aw_r w_ey s_ow k_iy_p b_ae_k
c;27;the soon debated greatest spitting shit that nigga craving;dh_ah s_uw_n d_ah_b_ey_t_ah_d g_r_ey_t_ah_s_t s_p_ih_t_ih_ng sh_iy_t dh_ae_t n_ih_g_ae k_r_ey_v_ih_ng
g;28;sixth sense meditated It all a nigga need to make it soul Go;s_ih_k_s_th s_eh_n_s m_eh_d_ah_t_ey2_t_p ih_t ao_l ah n_ih_g_ae n_iy_d t_uw m_ey_k ih_t s_ow_l g_ow
b;29;three smoke burning sour diesel;th_r_iy s_m_ow_k b_er_n_ih_ng s_ao_r d_iy_z_ah_l
c;30;we float like a fairy out a fucking fable;w_iy f_l_ow_t l_ay_k ey f_eh_r_iy aw_t ah f_ah_k_ih_ng f_ey_b_ah_l
c;31;or a ghost all a nigga missing Is his halo;ao_r ey g_ow_s_t ao_l ah n_ih_g_ae m_ih_s_ih_ng ih_z hh_ih_z hh_ey_l_ow
h;32;same flow Don-T you niggas think its time to switch it up;s_ey_m f_l_ow d_ow_n_t y_uw n_ih_g_ae_s th_ih_ng_k ih_t_s t_ay_m t_uw s_w_ih_ch ih_t ah_p
g;33;pesos keep you niggas grindin like some lame goats;p_ey_s_ow_z k_iy_p y_uw n_ih_g_ae_s g_r_ay_n_d_iy_n l_ay_k s_ah_m l_ey_m g_ow_t_s
g;34;you lame goats;y_uw l_ey_m g_ow_t_s
g;36;sixth sense nigga why you talkin you hopeless;s_ih_k_s_th s_eh_n_s n_ih_g_ae w_ay y_uw t_aa_k_ah_n y_uw hh_ow_p_l_ah_s
g;37;and If you only use five you soulless;ah_n_d ah_f y_uw ow_n_l_iy y_uw_s f_ay_v y_uw s_ow_l_l_ah_s
b;38;me and my niggas out a scene from out your dreams;m_iy ah_n_d m_ay n_ih_g_ae_s aw_t ah s_iy_n f_r_ah_m aw_t y_ao_r d_r_iy_m_z
b;39;showin niggas life never would-ve seen;sh_ow_iy_n n_ih_g_ae_s l_ay_f n_eh_v_er w_uh_d_ah_v s_iy_n
e;41;woke up in a cemetary full of martians;w_ow_k ah_p ih_n ah  f_uh_l ah_v m_aa_r_sh_ah_n_z
e;42;body carved and cut up like I was spartan;b_aa_d_iy k_aa_r_v_d ah_n_d k_ah_t ah_p l_ay_k ay w_ah_z s_p_aa_r_t_ah_n
c;43;apart from the rays that band music Played;ah_p_aa_r_t f_r_ah_m dh_ah r_ey_z dh_ae_t b_ae_n_d m_y_uw_z_ih_k p_l_ey_d
c;44;hey rain on the farm for four days;hh_ey r_ey_n aa_n dh_ah f_aa_r_m f_ao_r f_ao_r d_ey_z
d;45;caged in like a (human-headed) lion;k_ey_jh_d ih_n l_ay_k ah hh_y_uw_m_ax_n_hh_eh_d_ih_d l_ay_ah_n
p;46;on the sands of Egypt I;aa_n dh_ah s_ae_n_d_z ah_v iy_jh_ah_p_t ay
b;47;pledge allegiance;p_l_eh_jh ah_l_iy_jh_ah_n_s
m;48;to 40 ounces ballrooms and short blouses;t_uw  aw_n_s_ah_z b_ao_l_r_uw_m_z ah_n_d sh_ao_r_t b_l_aw_s_ah_z
a;49;stare in that mirror Now watch me get aroused quick;s_t_eh_r ih_n dh_ae_t m_ih_r_er n_aw w_aa_ch m_iy g_eh_t er_aw_z_d k_w_ih_k
q;50;low (as) the mountain high (as) the ground (is);l_ow ae_z dh_ah m_aw_n_t_ah_n hh_ay ae_z dh_ah g_r_aw_n_d ih_z
b;51;my Mind (is) on some (upside-down) shit;m_ay m_ay_n_d ih_z aa_n s_ah_m ah_p_s_ay_d_d_aw_n sh_iy_t
q;52;irises showing me how powerful the mind (is);ay_r_ah_s_ah_z sh_ow_ih_ng m_iy hh_aw p_aw_er_f_ah_l dh_ah m_ay_n_d ih_z
r;53;your highness (is) sharin pictures with a talking lioness;y_ao_r hh_ay_n_ah_s ih_z sh_aa_r_iy_m p_ih_k_ch_er_z w_ih_dh ah t_ao_k_ih_ng l_ay_ah_n_er_s_s
c;54;please (is) a;p_l_iy_z ih_z ey
h;55;in a planet like ours where the liars lead us;ih_n ah p_l_ae_n_ah_t l_ay_k aw_er_z w_eh_r dh_ah l_ay_er_z l_iy_d ah_s
h;56;you came here tonight crying to be dusk;y_uw k_ey_m hh_ih_r t_ah_n_ay_t k_r_ay_ih_ng t_uw b_iy d_ah_s_k
d;57;fuss grab a knife fuck life;f_ah_s g_r_ae_b ah n_ay_f f_ah_k l_ay_f
c;58;the sluts pray go deeper than nuns say;dh_ah s_l_ah_t_s p_r_ey g_ow d_iy_p_er dh_ae_n n_ah_n_z s_ey
c;59;front row to the streets gun play;f_r_ah_n_t r_ow t_uw dh_ah s_t_r_iy_t_s g_ah_n p_l_ey
s;60;who (is) to say one (is) and One-S not;hh_uw ih_z t_uw s_ey w_ah_n ih_z ah_n_d w_ah_n_z n_ax_t
e;61;the rock lives The Glock gives just one shot pop;dh_ah r_aa_k l_ih_v_z dh_ah g_l_aa_k g_ih_v_z jh_ah_s_t w_ah_n sh_aa_t p_aa_p
d;62;now youre alive free from all the lies;n_aw y_uw_r ah_l_ay_v f_r_iy f_r_ah_m ao_l dh_ah l_ay_z
f;63;who knew our dreams would be the afterlife;hh_uw n_uw aw_r d_r_iy_m_z w_uh_d b_iy dh_ah ae_f_t_er_l_ay2_f
d;64;grab The rifle shootin at stars (is) so delightful;g_r_ae_b dh_ah r_ay_f_ah_l sh_uw_t_iy_n ae_t s_t_aa_r_z ih_z s_ow d_ah_l_ay_t_f_ah_l
t;65;rippin out hearts No one likes it like I do;r_ih_p_iy_n aw_t hh_aa_r_t_s n_ow w_ah_n l_ay_k_s ih_t l_ay_k ay d_uw
d;66;i do whatever it takes to get the title;ay d_uw w_ah_t_eh_v_er ih_t t_ey_k_s t_uw g_eh_t dh_ah t_ay_t_ah_l
h;67;of one well jack it in the sun Son;ah_v w_ah_n w_iy_l jh_ae_k ih_t ih_n dh_ah s_ah_n s_ah_n
u;68;you know the devil Only when you become one;y_uw n_ow dh_ah d_eh_v_ah_l ow_n_l_iy w_eh_n y_uw b_ih_k_ah_m w_ah_n
i;69;kush cloud now all I;k_uh_sh k_l_aw_d n_aw ao_l ay
h;70;need (is) rum fun;n_iy_d ih_z r_ah_m f_ah_n
c;71;hot stoves grenades and sun shades;hh_aa_t s_t_ow_v_z g_r_ah_n_ey_d_z ah_n_d s_ah_n sh_ey_d_z
f;72;my life (is) abstract;m_ay l_ay_f ih_z ae_b_s_t_r_ae_k_t
e;73;picassos and potholes;p_ih_k_aa_s_ow_s ah_n_d p_aa_t_hh_ow_l_z
g;74;not (knowin-) they soul showed through glows;n_ax_t n_ow_iy_n_eh dh_ey s_ow_l sh_ow_d th_r_uw g_l_ow_z
g;75;i overlap These cons replacin them with pros yo;ay ow_v_er_l_ae_p dh_iy_z k_aa_n_z r_iy_p_l_ey_iy_n dh_eh_m w_ih_dh p_r_ow_z y_ow
