Rhyme Scheme Letter;Line Number;Lyrics;Phonetic Transcription
a;0;adam;ae_d_ah_m
b;1;i think the priorities have never changed something weve all dreamed about;ay th_ih_ng_k dh_iy p_r_ay_ao_r_ah_t_iy_z hh_ae_v n_eh_v_er ch_ey_n_jh_d s_ah_m_th_ih_ng w_iy_v ao_l d_r_iy_m_d ah_b_aw_t
b;2;doing since we were little kids and its uh its a big step in the right;d_uw_ih_ng s_ih_n_s w_iy w_er l_ih_t_ah_l k_ih_d_z ah_n_d ih_t_s ah ih_t_s ah b_ih_g s_t_eh_p ih_n dh_ah r_ay_t
c;3;direction for our careers now that were here drinking beer at 11 AM;d_ih_r_eh_k_sh_n f_ao_r aw_r k_er_ih_r_z n_aw dh_ae_t w_iy_r hh_ih_r d_r_ih_ng_k_ih_ng b_ih_r ae_t  ae_m
a;4;laughing in the background;l_ae_f_ih_ng ih_n dh_ah b_ae_k_g_r_aw_n_d
d;6;noah;n_ow_ah
e;7;no come on dude;n_ow k_ah_m aa_n d_uw_d
a;9;adam;ae_d_ah_m
b;10;he just cares about beer;hh_iy jh_ah_s_t k_eh_r_z ah_b_aw_t b_ih_r
