Rhyme Scheme Letter;Line Number;Lyrics;Phonetic Transcription
a;0;i was always told Im a bad influence;ay w_ah_z ao_l_w_iy_z t_ow_l_d ay_m ah b_ae_d ih_n_f_l_uw_ah_n_s
b;1;your daughter-s life I will ruin;y_ao_r d_ao_t_er_z l_ay_f ay w_ah_l r_uw_ah_n
c;2;brewing up a plan;b_r_uw_ih_ng ah_p ah p_l_ae_n
c;3;just to get inside her pants;jh_ah_s_t t_uw g_eh_t ih_n_s_ay_d hh_er p_ae_n_t_s
b;4;what Im doin;w_ah_t ay_m d_uw_iy_n
h;5;then I zip them things up and find a new one;dh_eh_n ay z_ih_p dh_eh_m th_ih_ng_z ah_p ah_n_d f_ay_n_d ah n_y_uw w_ah_n
d;6;stealing what ain-t mine;s_t_iy_l_ih_ng w_ah_t ey_n_t m_ay_n
b;7;before this younging start suing;b_ah_f_ao_r dh_ih_s y_ah_ng_ih_ng s_t_aa_r_t s_uw_ih_ng
i;8;get the crew involved Menthols;g_eh_t dh_ah k_r_uw ih_n_v_aa_l_v_d M_er_n_th_ax_l_s
e;9;until she blue in the face its amazing;ah_n_t_ih_l sh_iy b_l_uw ih_n dh_ah f_ey_s ih_t_s ah_m_ey_z_ih_ng
e;10;i know she wish she brought her mace said her grace started praying;ay n_ow sh_iy w_ih_sh sh_iy b_r_ao_t hh_er m_ey_s s_eh_d hh_er g_r_ey_s s_t_aa_r_t_ah_d p_r_ey_ih_ng
a;11;told Im a bad influence;t_ow_l_d ay_m ah b_ae_d ih_n_f_l_uw_ah_n_s
c;12;cuz its hell in a handbag;k_ah_z ih_t_s hh_eh_l ih_n ah hh_ae_n_d_b_ae_g
a;13;when I interact its like cinemac;w_eh_n ay ih_n_t_er_ae_k_t ih_t_s l_ay_k s_ih_n_ah_m_ah_k
d;14;in hindsight she-ll know if the times right;ih_n hh_ay_n_d_s_ay_t s_hh_iy_l n_ow ah_f dh_ah t_ay_m_z r_ay_t
d;15;before she had a chance to say sike;b_ah_f_ao_r sh_iy hh_ae_d ah ch_ae_n_s t_uw s_ey s_ay_k
c;16;her hair pulled back getting smacked;hh_er hh_eh_r p_uh_l_d b_ae_k g_eh_t_ih_ng s_m_ae_k_t
c;17;can-t be tamed hotboxin in the stang;k_ae_n_t b_iy t_ey_m_d hh_ao_t_b_oh_x_ax_n ih_n dh_ah s_t_ae_ng
f;18;banging on the rag top til she gag stop;b_ae_ng_ih_ng aa_n dh_ah r_ae_g t_aa_p t_ih_l sh_iy g_ae_g s_t_aa_p
f;19;cherry in her vag popped bop she was on top;ch_eh_r_iy ih_n hh_er v_ae_l_g p_aa_p_t b_aa_p sh_iy w_ah_z aa_n t_aa_p
c;20;dampened call me Manson;d_ae_m_p_ah_n_d k_ao_l m_iy m_ae_n_s_ah_n
c;21;we in an abandoned Mansion;w_iy ih_n ae_n ah_b_ae_n_d_ah_n_d m_ae_n_sh_ah_n
b;22;my move I made her skip school;m_ay m_uw_v ay m_ey_d hh_er s_k_ih_p s_k_uw_l
l;23;cancelled Hampton running;k_ae_n_s_ah_l_d hh_ae_m_p_t_ah_n r_ah_n_ih_ng
c;24;rampant;r_ae_m_p_ah_n_t
c;25;off on a tangent;ao_f aa_n ah t_ae_n_jh_ah_n_t
m;26;sneaked out on our way to Quis house she freaked out;s_n_iy_k_t aw_t aa_n aw_r w_ey t_uw Q_uw_ax_s hh_aw_s sh_iy f_r_iy_k_t aw_t
n;27;we landed she asking where my manz (is);w_iy l_ae_n_d_ah_d sh_iy ae_s_k_ih_ng w_eh_r m_ay m_ae_n_z ih_z
c;28;in the party dancing;ih_n dh_ah p_aa_r_t_iy d_ae_n_s_ih_ng
a;29;i took her to a room with the Uth had to split;ay t_uh_k hh_er t_uw ah r_uw_m w_ih_dh dh_ah  hh_ae_d t_uw s_p_l_ih_t
a;30;passed the spliff then I dipped;p_ae_s_t dh_ah s_p_l_f_f dh_eh_n ay d_ih_p_t
b;31;she stayin with group;sh_iy s_t_ey_iy_n w_ih_dh g_r_uw_p
g;32;assortment of blends;ah_s_ao_r_t_m_ah_n_t ah_v b_l_eh_n_d_z
g;33;spent a day with me now a master at the chem;s_p_eh_n_t ah d_ey w_ih_dh m_iy n_aw ah m_ae_s_t_er ae_t dh_ah k_eh_m
a;34;far from timid;f_aa_r f_r_ah_m t_ih_m_ah_d
a;35;don-t let her meet that nigga Chuck Nimbus;d_ow_n_t l_eh_t hh_er m_iy_t dh_ae_t n_ih_g_ae ch_ah_k n_ih_m_b_ah_s
a;36;doesn-t know her limit;d_ah_z_n_t n_ow hh_er l_ih_m_ah_t
a;37;got a call when they finished;g_aa_t ah k_ao_l w_eh_n dh_ey f_ih_n_ih_sh_t
n;38;explaining what the deal (is);ih_k_s_p_l_ey_n_ih_ng w_ah_t dh_ah d_iy_l ih_z
a;39;ain-t know what to think;ey_n_t n_ow w_ah_t t_uw th_ih_ng_k
a;40;all I heard was blood bathroom and sink;ao_l ay hh_er_d w_ah_z b_l_ah_d b_ae_th_r_uw_m ah_n_d s_ih_ng_k
a;41;instinct was T O M paid a visit;ih_n_s_t_ih_ng_k_t w_ah_z t_iy ow eh_m p_ey_d ah v_ih_z_ah_t
a;42;but the outcome it was more than sunshine and kisses;b_ah_t dh_ah aw_t_k_ah_m ih_t w_ah_z m_ao_r dh_ae_n s_ah_n_sh_ay_n ah_n_d k_ih_s_ah_z
c;43;poster child for our dopest loud album;p_ow_s_t_er ch_ay_l_d f_ao_r aw_r d_ow_p_st l_aw_d ae_l_b_ah_m
n;44;how come the titles what it (is);hh_aw k_ah_m dh_ah t_ay_t_ah_l_z w_ah_t ih_t ih_z
a;46;we turned a cute girl bad thats a Beautiful Sin;w_iy t_er_n_d ah k_y_uw_t g_er_l b_ae_d dh_ae_t_s ah b_y_uw_t_ah_f_ah_l s_ih_n
o;48;pop it Pop it Sniff it Smoke it;p_aa_p ih_t p_aa_p ih_t s_n_ih_f ih_t s_m_ow_k ih_t
o;49;smoke it Pop it;s_m_ow_k ih_t p_aa_p ih_t
o;51;pop it Sniff it Smoke it;p_aa_p ih_t s_n_ih_f ih_t s_m_ow_k ih_t
o;52;smoke it Smoke it;s_m_ow_k ih_t s_m_ow_k ih_t
o;53;smoke it;s_m_ow_k ih_t
o;54;pop it Sniff it Smoke it;p_aa_p ih_t s_n_ih_f ih_t s_m_ow_k ih_t
o;55;smoke it;s_m_ow_k ih_t
h;57;and if we pop a couple Xannies then you know we good;ah_n_d ah_f w_iy p_aa_p ah k_ah_p_ah_l X_ah_n_iy_ax_s dh_eh_n y_uw n_ow w_iy g_uh_d
