Rhyme Scheme Letter;Line Number;Lyrics;Phonetic Transcription
i;0;get your stop watches ready cause this (is) the Countdown 5 Mixtape;g_ih_t y_uh_r s_t_aa_p w_aa_ch_ah_z r_eh_d_iy k_aa_z dh_ah_s ah_z dh_iy k_aw_n_t_d_aw_n ah_ae M_ih_x_t_ae_p_ax
a;1;with DJ Carisma and the Wonder Broz;w_ah_dh  C_ah_r_iy_s_m_ax ah_n_d dh_iy w_ah_n_d_er b_r_aa_z
b;3;code name;k_ow_d n_ey_m
l;4;i got heavy on the beat I do my own thang;ay g_aa_t hh_eh_v_iy aa_n dh_iy b_iy_t ay d_uw m_ay ow_n dh_ae_n_b
b;5;i ain-t scary no indeed I rep my own game;ay ey_n_t s_k_eh_r_iy n_ow ih_n_d_iy_d ay r_eh_p m_ay ow_n g_ey_m
c;6;chickens want beef well we want the same thing;ch_ih_k_ah_n_z w_aa_n_t b_iy_f w_eh_l w_iy w_aa_n_t dh_ah s_ey_m th_ih_ng
m;7;boy bring it out;b_oy b_r_ih_ng ih_t aw_t
n;8;whats a dog to a wolf;w_ah_t_s ah d_ah_g t_uw ah w_uh_l_f
d;9;whats a cat to a lion;w_ah_t_s ah k_ae_t t_uw ey l_ay_ah_n
a;10;whats a fish to a shark;w_ah_t_s ah f_ih_sh t_uw ah sh_aa_r_k
e;11;lemme think all talk;l_eh_m_ah th_ih_ng_k ao_l t_ao_k
e;12;walk the walk prove me wrong;w_ao_k dh_ah w_ao_k p_r_uw_v m_iy r_ao_ng
e;13;put it on the beat this song;p_uh_t ih_t aa_n dh_ah b_iy_t dh_ih_s s_ao_ng
e;14;cause this song (is) a diss song;k_aa_z dh_ih_s s_ao_ng ih_z ah d_ih_s s_ao_ng
o;15;to all you wanna be rappers come on;t_uw ao_l y_uw w_aa_n_ah b_iy r_ae_p_er_z k_ah_m aa_n
e;16;cause this song (is) a diss song;k_aa_z dh_ih_s s_ao_ng ih_z ah d_ih_s s_ao_ng
o;17;to all you wanna be rappers come on;t_uw ao_l y_uw w_aa_n_ah b_iy r_ae_p_er_z k_ah_m aa_n
e;18;cause this song (is) a diss song;k_aa_z dh_ih_s s_ao_ng ih_z ah d_ih_s s_ao_ng
o;19;to all you wanna be rappers come on;t_uw ao_l y_uw w_aa_n_ah b_iy r_ae_p_er_z k_ah_m aa_n
p;20;for Real though Im being real bro;f_ao_r r_iy_l dh_ow ay_m b_iy_ih_ng r_iy_l b_r_ow
c;21;too many non writing and reciting weirdos;t_uw m_eh_n_iy n_aa_n r_ay_t_ih_ng ah_n_d r_iy_s_ay_t_ih_ng w_ih_r_d_ow_z
f;22;shout Out Fly Kid Shout Out Young Sam;sh_aw_t aw_t f_l_ay k_ih_d sh_aw_t aw_t y_ah_ng s_ae_m
f;23;shout Out J and Fresh Shout Out To Ranger Gang;sh_aw_t aw_t jh_ey ah_n_d f_r_eh_sh sh_aw_t aw_t t_uw r_ey_n_jh_er g_ae_ng
q;24;real niggas feel me;r_iy_l n_ih_g_ae_s f_iy_l m_iy
q;25;sticks and stones break bones but y-all flow kill me;s_t_ih_k_s ah_n_d s_t_ow_n_z b_r_ey_k b_ow_n_z b_ah_t y_ao_l f_l_ow k_ih_l m_iy
f;27;yeah yeah yeah yeah yeah yeah;y_ae y_ae y_ae y_ae y_ae y_ae
d;28;y-all know G Im For real bout mine;y_ao_l n_ow jh_iy ay_m f_ao_r r_iy_l b_aw_t m_ay_n
d;29;golden boy with the flow I take it serious each line;g_ow_l_d_ah_n b_oy w_ih_dh dh_ah f_l_ow ay t_ey_k ih_t s_ih_r_iy_ah_s iy_ch l_ay_n
g;30;all the time when I rhyme I go left on the beat;ao_l dh_ah t_ay_m w_eh_n ay r_ay_m ay g_ow l_eh_f_t aa_n dh_ah b_iy_t
g;31;im right handed if you google that youll know what I mean;ay_m r_ay_t hh_ae_n_d_ah_d ah_f y_uw g_uw_g_l_er dh_ae_t y_uw_l n_ow w_ah_t ay m_iy_n
q;32;five steps ahead of you after this add three;f_ay_v s_t_eh_p_s ah_hh_eh_d ah_v y_uw ae_f_t_er dh_ih_s ae_d th_r_iy
c;33;which makes me two steps away from the tops in the industry;w_ih_ch m_ey_k_s m_iy t_uw s_t_eh_p_s ah_w_ey f_r_ah_m dh_ah t_aa_p_s ih_n dh_iy ih_n_d_ah_s_t_r_iy
q;34;in the end Ill be indefinitely;ih_n dh_ah eh_n_d ay_l b_iy ih_n_d_eh_f_ah_n_ah_t_l_iy
c;35;the best to ever do it for infinity;dh_ah b_eh_s_t t_uw eh_v_er d_uw ih_t f_ao_r ih_n_f_ih_n_ah_t_iy
g;36;no son of a gun Im a son of a G;n_ow s_ah_n ah_v ah g_ah_n ay_m ah s_ah_n ah_v ah jh_iy
q;37;built tough raised rough nigga test me;b_ih_l_t t_ah_f r_ey_z_d r_ah_f n_ih_g_ae t_eh_s_t m_iy
a;38;address me if you got a problem;ax_d_r_eh_s m_iy ah_f y_uw g_aa_t ah p_r_aa_b_l_ah_m
r;39;if you tripping I ain-t tripping I know how to solve it;ah_f y_uw t_r_ih_p_ih_ng ay ey_n_t t_r_ih_p_ih_ng ay n_ow hh_aw t_uw s_aa_l_v ih_t
h;40;stall it ink first;s_t_ao_l ih_t ih_ng_k f_er_s_t
h;41;jump to conclusions thats how niggas end up getting hurt;jh_ah_m_p t_uw k_ah_n_k_l_uw_zh_ah_n_z dh_ae_t_s hh_aw n_ih_g_ae_s eh_n_d ah_p g_eh_t_ih_ng hh_er_t
i;42;i punch the clock I work overtime;ay p_ah_n_ch dh_ah k_l_aa_k ay w_er_k ow_v_er_t_ay_m
d;43;niggas wanna gather em up I show em a punch line;n_ih_g_ae_s w_aa_n_ah g_ae_dh_er eh_m ah_p ay sh_ow eh_m ah p_ah_n_ch l_ay_n
