Rhyme Scheme Letter;Line Number;Lyrics;Phonetic Transcription
a;0;people wondering why I flip it up high now;p_iy_p_ah_l w_ah_n_d_er_ih_ng hh_w_ay ay f_l_ih_p ah_t ah_p hh_ay n_aw
a;1;well maybe cause this world has been flipped upside down;w_eh_l m_ey_b_iy k_aa_z dh_ah_s w_er_l_d hh_ah_z b_ah_n f_l_ih_p_t ah_p_s_ay_d d_aw_n
a;2;fuckers get up right now at attention and listen up right now;f_ah_k_er_r_s g_eh_t ah_p r_ay_t n_aw ae_t ah_t_eh_n_sh_ah_n ah_n_d l_ih_s_ah_n ah_p r_ay_t n_aw
b;3;but all I see (is) twitching of the eyebrows;b_ah_t ao_l ay s_iy ih_z t_w_ih_ch_ih_ng ah_v dh_ah ay_b_r_aw_z
c;4;cause when shit gets serious its time to duck and run;k_aa_z w_eh_n sh_iy_t g_eh_t_s s_ih_r_iy_ah_s ih_t_s t_ay_m t_ah d_ah_k ah_n_d r_ah_n
d;5;like This a stick up by some fuckers from Compton;l_ay_k dh_ih_s ah s_t_ih_k ah_p b_ay s_ah_m f_ah_k_er_r_s f_er_m k_aa_m_p_t_ah_n
e;6;with long guns like fuck arms control its over yo;w_ah_dh l_ao_ng g_ah_n_z l_ay_k f_ah_k aa_r_m_z k_ah_n_t_r_ow_l ih_t_s ow_v_er y_ow
b;7;we live and prosper off assault rifles;w_iy l_ay_v ah_n_d p_r_aa_s_p_er ao_f ah_s_ao_l_t r_ay_f_ah_l_z
b;8;while they over there on welfare like;w_ay_l dh_ey ow_v_er dh_eh_r aa_n w_eh_l_f_eh_r l_ay_k
f;9;wheres my money bitch;w_eh_r_s m_ay m_ah_n_iy b_ih_ch
f;10;Till I kill the government and then spend it on honey dips;t_ih_l ay k_ih_l dh_ah g_ah_v_ax_n_m_ax_n_t ah_n_d dh_eh_n s_p_eh_n_d ih_t aa_n hh_ah_n_iy d_ih_p_s
g;11;yeah suck it trick have it till I panic go manic;y_ae s_ah_k ih_t t_r_ih_k hh_ae_v ih_t t_ih_l ay p_ae_n_ih_k g_ow m_ae_n_ih_k
g;12;and bust a nut all over this whole entire planet;ah_n_d b_ah_s_t ah n_ah_t ao_l ow_v_er dh_ih_s hh_ow_l eh_n_t_ay_er p_l_ae_n_ah_t
e;14;ive had it with you backstabbing assholes;ay_v hh_ae_d ih_t w_ih_dh y_uw b_ae_k_s_ha_t_ae_b_ih_ng ae_s_hh_ow_l_s
g;15;im maxed out on that yo but Im loading up my ammo;ay_m m_ae_k_s_t aw_t aa_n dh_ae_t y_ow b_ah_t ay_m l_ow_d_ih_ng ah_p m_ay ae_m_ow
g;16;preppin to blast at you in case of attack;p_r_eh_p_p_ih_n t_uw b_l_ae_s_t ae_t y_uw ih_n k_ey_s ah_v ah_t_ae_k
g;17;leave you shadows of the past;l_iy_v y_uw sh_ae_d_ow_z ah_v dh_ah p_ae_s_t
g;18;then switch my last name to Castro;dh_eh_n s_w_ih_ch m_ay l_ae_s_t n_ey_m t_uw k_ae_s_t_r_ow
b;20;you will never change the way that our people ride;y_uw w_ah_l n_eh_v_er ch_ey_n_jh dh_ah w_ey dh_ae_t aw_r p_iy_p_ah_l r_ay_d
b;21;so don-t fall victim and believe a lie;s_ow d_ow_n_t f_aa_l v_ih_k_t_ah_m ah_n_d b_ah_l_iy_v ah l_ay
b;22;now jot notes on my advice don-t even try;n_aw jh_aa_t n_ow_t_s aa_n m_ay ax_d_v_ay_s d_ow_n_t iy_v_ah_n t_r_ay
h;24;this shits getting hectic my motherfucking objective;dh_ih_s sh_iy_t_s g_eh_t_ih_ng hh_eh_k_t_ih_k m_ay m_ah_dh_er_ha_f_ah_k_ih_ng ah_b_jh_eh_k_t_ih_v
l;25;your neck you better protect it;y_ao_r n_eh_k y_uw b_eh_t_er p_r_ax_t_eh_k_t ih_t
h;26;but all attempts end pathetic;b_ah_t ao_l ax_t_eh_m_p_t_s eh_n_d p_ah_th_eh_t_ih_k
l;27;and if I said it you know I meant it;ah_n_d ah_f ay s_eh_d ih_t y_uw n_ow ay m_eh_n_t ih_t
h;28;never empathetic;n_eh_v_er eh_m_p_ah_th_eh_t_ih_k
i;29;cause I am so fucking disconnected from this world;k_aa_z ay ae_m s_ow f_ah_k_ih_ng d_ih_s_k_ah_n_eh_k_t_ah_d f_r_ah_m dh_ih_s w_er_l_d
d;30;ive been ejected like fighter pilot cockpit;ay_v b_ih_n ih_jh_eh_k_t_ah_d l_ay_k f_ay_t_er p_ay_l_ah_t k_aa_k_p_ih_t
d;31;you should try to widen optics;y_uw sh_uh_d t_r_ay t_uw w_ay_d_ah_n aa_p_t_ih_k_s
d;32;while I lie a silent promise;w_ay_l ay l_ay ah s_ay_l_ah_n_t p_r_aa_m_ah_s
m;33;and pay the Pied Piper homage;ah_n_d p_ey dh_ah p_ay_d p_ay_p_er hh_oh_m_ih_jh
l;34;im gone full throttle Autobahn;ay_m g_ao_n f_uh_l th_r_aa_t_ah_l ao_t_ow_b_aa_n
c;35;like Im living on the run;l_ay_k ay_m l_ih_v_ih_ng aa_n dh_ah r_ah_n
c;36;olympic competition won;ow_l_ih_m_p_ih_k k_aa_m_p_ah_t_ih_sh_ah_n w_ah_n
a;37;Till I fuck around and drink from a fountain;t_ih_l ay f_ah_k er_aw_n_d ah_n_d d_r_ih_ng_k f_r_ah_m ah f_aw_n_t_ah_n
e;38;oh this Sochi;ow dh_ih_s s_ow_ch_iy
a;39;its so cheap that its eating out my mouth;ih_t_s s_ow ch_iy_p dh_ae_t ih_t_s iy_t_ih_ng aw_t m_ay m_aw_th
a;40;and this allowed;ah_n_d dh_ih_s ah_l_aw_d
i;41;its absurd the shit that occurs;ih_t_s ah_b_s_er_d dh_ah sh_iy_t dh_ae_t ah_k_er_z
i;43;a poor man snatching your purse;ah p_uh_r m_ae_n s_n_ae_ch_ih_ng y_ao_r p_er_s
i;44;a whore raped who was laughing at first;ah hh_ao_r r_ey_p_t hh_uw w_ah_z l_ae_f_ih_ng ae_t f_er_s_t
i;45;it happens you heard;ih_t hh_ae_p_ah_n_z y_uw hh_er_d
a;46;so yeah don-t fret Big Brother-s in town;s_ow y_ae d_ow_n_t f_r_eh_t b_ih_g b_r_ah_dh_er_z ih_n t_aw_n
a;47;and hes here to bring the motherfucking troublesome down;ah_n_d hh_iy_s hh_ih_r t_uw b_r_ih_ng dh_ah m_ah_dh_er_ha_f_ah_k_ih_ng t_r_ah_b_ah_l_s_ah_m d_aw_n
