Rhyme Scheme Letter;Line Number;Lyrics;Phonetic Transcription
i;0;got ta watch your back;g_aa_t t_aa w_aa_ch y_ao_r b_ae_k
a;1;these niggas out here gon hate to see you win;dh_iy_z n_ih_g_ae_s aw_t hh_ih_r g_aa_n hh_ey_t t_uw s_iy y_uw w_ih_n
b;2;got ta watch your friends;g_aa_t t_aa w_aa_ch y_ao_r f_r_eh_n_d_z
b;3;for the right price tag never know them Rules might bend;f_ao_r dh_ah r_ay_t p_r_ay_s t_ae_g n_eh_v_er n_ow dh_eh_m r_uw_l_z m_ay_t b_eh_n_d
a;4;got ta stay alert and trust No fuck nigga;g_aa_t t_aa s_t_ey ah_l_er_t ah_n_d t_r_ah_s_t n_ow f_ah_k n_ih_g_ae
c;5;steal the words right out your mouth;s_t_iy_l dh_ah w_er_d_z r_ay_t aw_t y_ao_r m_aw_th
c;6;say word point em out;s_ey w_er_d p_oy_n_t eh_m aw_t
d;7;nigga swerve reroute;n_ih_g_ae s_w_er_v r_iy_r_uw_t_ah
a;9;fuck nigga;f_ah_k n_ih_g_ae
a;10;fuck nigga;f_ah_k n_ih_g_ae
a;11;fuck nigga;f_ah_k n_ih_g_ae
a;12;pussy nigga;p_uh_s_iy n_ih_g_ae
a;13;pussy nigga;p_uh_s_iy n_ih_g_ae
a;14;fuck nigga;f_ah_k n_ih_g_ae
a;15;fuck nigga;f_ah_k n_ih_g_ae
a;17;let me tell you something bout Young Zipper;l_eh_t m_iy t_eh_l y_uw s_ah_m_th_ih_ng b_aw_t y_ah_ng z_ih_p_er
a;18;i done shot more paper than a printer;ay d_ah_n sh_aa_t m_ao_r p_ey_p_er dh_ae_n ah p_r_ih_n_t_er
a;19;when I was a baby gave my babysitter jitters;w_eh_n ay w_ah_z ah b_ey_b_iy g_ey_v m_ay b_ey_b_iy_s_ih_t_er jh_ih_t_er_z
a;20;i made that sitter reconsider;ay m_ey_d dh_ae_t s_ih_t_er r_iy_k_ah_n_s_ih_d_er
a;21;that come up make fucks feel bitter;dh_ae_t k_ah_m ah_p m_ey_k f_ah_k_s f_iy_l b_ih_t_er
e;22;can-t trust niggas Can-t trust hoes;k_ae_n_t t_r_ah_s_t n_ih_g_ae_s k_ae_n_t t_r_ah_s_t hh_ow_z
f;23;and They say Im a lost case;ah_n_d dh_ey s_ey ay_m ah l_ao_s_t k_ey_s
e;24;when in that case This case done closed;w_eh_n ih_n dh_ae_t k_ey_s dh_ih_s k_ey_s d_ah_n k_l_ow_z_d
b;25;i remember most everything;ay r_ih_m_eh_m_b_ax m_ow_s_t eh_v_r_iy_th_ih_ng
b;26;im taking shots for my leisure;ay_m t_ey_k_ih_ng sh_aa_t_s f_ao_r m_ay l_eh_zh_er
b;27;except when coppers ask questions;ih_k_s_eh_p_t w_eh_n k_aa_p_er_z ae_s_k k_w_eh_s_ch_ah_n_z
g;28;uhh So this a case of amnesia;ah s_ow dh_ih_s ah k_ey_s ah_v ae_m_n_iy_zh_ah
l;29;that whip game a eggbeater;dh_ae_t w_ih_p g_ey_m ah eh_g_ha_b_iy_t_er
g;30;thats more scales than a room full of libras;dh_ae_t_s m_ao_r s_k_ey_l_z dh_ae_n ah r_uw_m f_uh_l ah_v l_iy_b_r_ah_z
g;31;watch out for lions and moochers and cheaters;w_aa_ch aw_t f_ao_r l_ay_ah_n_z ah_n_d  ah_n_d ch_iy_t_er_z
g;32;thats Three strikes like the shoes (is) Adidas;dh_ae_t_s th_r_iy s_t_r_ay_k_s l_ay_k dh_ah sh_uw_z ih_z ah_d_iy_d_ah_s
h;33;got ta dodge fuck niggas I ain-t got no choice;g_aa_t t_aa d_aa_jh f_ah_k n_ih_g_ae_s ay ey_n_t g_aa_t n_ow ch_oy_s
h;34;screaming fuck these hoes till I got no voice;s_k_r_iy_m_ih_ng f_ah_k dh_iy_z hh_ow_z t_ih_l ay g_aa_t n_ow v_oy_s
e;35;and I pray that God protect me from all my foes;ah_n_d ay p_r_ey dh_ae_t g_aa_d p_r_ax_t_eh_k_t m_iy f_r_ah_m ao_l m_ay f_ow_z
e;36;then I started losing friends but you know how it goes;dh_eh_n ay s_t_aa_r_t_ah_d l_uw_z_ih_ng f_r_eh_n_d_z b_ah_t y_uw n_ow hh_aw ih_t g_ow_z
m;38;bitch Im slicker than Ricky and you faker than a McChicken;b_ih_ch ay_m s_l_ih_k_er dh_ae_n r_ih_k_iy ah_n_d y_uw f_ey_k_er dh_ae_n ah 
a;39;my main chick (is) New Vicki and my side chick Don-T do hickeys;m_ay m_ey_n ch_ih_k ih_z n_uw v_ih_k_iy ah_n_d m_ay s_ay_d ch_ih_k d_ow_n_t d_uw hh_ih_k_iy_z
n;40;no way Jose fill the cup Rozay;n_ow w_ey hh_ow_z_ey f_ih_l dh_ah k_ah_p R_ao_z_ae_ax
f;41;that grind don-t play;dh_ae_t g_r_ay_n_d d_ow_n_t p_l_ey
f;42;every crime cold case;eh_v_er_iy k_r_ay_m k_ow_l_d k_ey_s
f;43;100 dollar bill old face; d_aa_l_er b_ih_l ow_l_d f_ey_s
f;44;junk in the trunk How she got no waist;jh_ah_ng_k ih_n dh_ah t_r_ah_ng_k hh_aw sh_iy g_aa_t n_ow w_ey_s_t
g;45;shit just got real;sh_iy_t jh_ah_s_t g_aa_t r_iy_l
e;46;shit just got Ferocious;sh_iy_t jh_ah_s_t g_aa_t f_er_ow_sh_ah_s
e;47;roaches in my ashtray fat (as) real roaches;r_ow_ch_ah_z ih_n m_ay ae_sh_t_r_ey f_ae_t ae_z r_iy_l r_ow_ch_ah_z
o;48;ho You know I got ta ball;hh_ow y_uw n_ow ay g_aa_t t_aa b_ao_l
p;49;most of my bitches over thirty;m_ow_s_t ah_v m_ay b_ih_ch_ah_z ow_v_er th_er_d_iy
p;50;you Just talk about that barley;y_uw jh_ah_s_t t_ao_k ah_b_aw_t dh_ae_t b_aa_r_l_iy
i;51;kenny Buckley Ernie Ohh;k_eh_n_iy b_ah_k_l_iy er_n_iy 
d;52;who knew I had screws lose and I walk around with that Deuce deuce;hh_uw n_uw ay hh_ae_d s_k_r_uw_z l_uw_z ah_n_d ay w_ao_k er_aw_n_d w_ih_dh dh_ae_t d_uw_s d_uw_s
d;53;the irony while I zoom zoom;dh_ah ay_r_ah_n_iy w_ay_l ay z_uw_m z_uw_m
d;54;(is) how sun shining through a moon roof;ih_z hh_aw s_ah_n sh_ay_n_ih_ng th_r_uw ah m_uw_n r_uw_f
a;55;im a real nigga nigga;ih_m ah r_iy_l n_ih_g_ae n_ih_g_ae
b;56;big money (deal-getter);b_ih_g m_ah_n_iy d_iy_l_g_eh_t_er
a;57;i ain-t fucking with these niggas wearing Tommy Hilfiger;ay ey_n_t f_ah_k_ih_ng w_ih_dh dh_iy_z n_ih_g_ae_s w_eh_r_ih_ng t_aa_m_iy hh_ih_l_f_ay_g_er
