Rhyme Scheme Letter;Line Number;Lyrics;Phonetic Transcription
a;0;yo you know what I always wonder;y_ow y_uw n_ow hh_w_ah_t ay ao_l_w_iy_z w_ah_n_d_er
b;1;where the fuck (is) Triple T headed;hh_w_eh_r dh_iy f_ah_k ah_z t_r_ih_p_ah_l t_iy hh_eh_d_ah_d
c;2;nam saying like;n_ae_m s_ey_ih_ng l_ay_k
l;3;we take this rap game seriously;w_iy t_ey_k dh_ah_s r_ae_p g_ey_m s_ih_r_iy_ah_s_l_iy
d;4;we don-t take no shortcuts;w_iy d_ow_n t_ey_k n_ow sh_ao_r_t_k_ah_t_s
e;5;we always try to put out our best product you know;w_iy ao_l_w_iy_z t_r_ay t_ah p_uh_t aw_t aa_r b_eh_s_t p_r_aa_d_ah_k_t y_uw n_ow
e;6;but where we going;b_ah_t hh_w_eh_r w_iy g_ow_ah_n
m;7;whatchu think Spiz;w_ah_t_ch_uw th_ih_ng_k S_p_iy_z
f;9;i keep it vicious with the way I be dishing;ay k_iy_p ah_t v_ih_sh_ah_s w_ah_dh dh_iy w_ey ay b_iy d_ih_sh_ih_ng
f;10;and you don-t have to listen;ah_n_d y_uw d_ow_n hh_ae_v t_uw l_ih_s_ah_n
n;11;when I say Im simplistic;w_eh_n ay s_ey ay_m s_ih_m_p_l_ih_s_t_ih_k
f;12;cause I be running not slipping;k_aa_z ay b_iy r_ah_n_ih_ng n_ax_t s_l_ih_p_ih_ng
f;13;its Triple T in the kitchen;ih_t_s t_r_ih_p_ah_l t_iy ih_n dh_ah k_ih_ch_ah_n
b;14;you got the problems dismiss them;y_uw g_aa_t dh_ah p_r_aa_b_l_ah_m_z d_ih_s_m_ih_s dh_eh_m
f;15;i ain-t a victim;ay ey_n_t ah v_ih_k_t_ah_m
b;16;turbo got the vinyls he flip them;t_er_b_ow g_aa_t dh_ah v_ay_n_ah_l_z hh_iy f_l_ih_p dh_eh_m
f;17;im always standing on the tip;ay_m ao_l_w_ey_z s_t_ae_n_d_ih_ng aa_n dh_ah t_ih_p
f;18;and my currents always ripping;ah_n_d m_ay k_er_ah_n_t_s ao_l_w_ey_z r_ih_p_ih_ng
g;19;im serving with my shit;ay_m s_er_v_ih_ng w_ih_dh m_ay sh_iy_t
f;20;from my cup I take a sip;f_r_ah_m m_ay k_ah_p ay t_ey_k ah s_ih_p
f;21;but now Im on my second win;b_ah_t n_aw ay_m aa_n m_ay s_eh_k_ah_n_d w_ih_n
o;22;you claim some real but you pretend man;y_uw k_l_ey_m s_ah_m r_iy_l b_ah_t y_uw p_r_iy_t_eh_n_d m_ae_n
b;23;i be rolling out ten with my friends;ay b_iy r_ow_l_ih_ng aw_t t_eh_n w_ih_dh m_ay f_r_eh_n_d_z
b;24;popping and finishing ends;p_aa_p_ih_ng ah_n_d f_ih_n_ih_sh_ih_ng eh_n_d_z
b;25;Will I come down it depends;w_ah_l ay k_ah_m d_aw_n ih_t d_ah_p_eh_n_d_z
b;26;making money past and present tense;m_ey_k_ih_ng m_ah_n_iy p_ae_s_t ah_n_d p_r_ih_z_eh_n t_eh_n_s
b;27;so take a picture and I break the lens;s_ow t_ey_k ah p_ih_k_ch_er ah_n_d ay b_r_ey_k dh_ah l_eh_n_z
b;28;but when we fight we make amends;b_ah_t w_eh_n w_iy f_ay_t w_iy m_ey_k ah_m_eh_n_d_z
g;29;and I scoop you in a Benz homie;ah_n_d ay s_k_uw_p y_uw ih_n ah b_eh_n_z hh_ao_m_iy_ax
l;30;so quit reaching cause you don-t know me;s_ow k_w_ih_t r_iy_ch_ih_ng k_aa_z y_uw d_ow_n_t n_ow m_iy
e;31;ive got the shine of like six rollies;ay_v g_aa_t dh_ah sh_ay_n ah_v l_ay_k s_ih_k_s r_ow_l_iy_s
e;32;i fell behind on my paper folding;ay f_eh_l b_ah_hh_ay_n_d aa_n m_ay p_ey_p_er f_ow_l_d_ih_ng
e;33;my cribs a mansion and I know whats golden;m_ay k_r_ih_b_z ah m_ae_n_sh_ah_n ah_n_d ay n_ow w_ah_t_s g_ow_l_d_ah_n
f;34;i got the hat with the NY sewed in;ay g_aa_t dh_ah hh_ae_t w_ih_dh dh_ah  s_ow_d ih_n
p;35;now hold it;n_aw hh_ow_l_d ih_t
f;37;i think;ay th_ih_ng_k
h;38;i think I wanna be famous;ay th_ih_ng_k ay w_aa_n_ah b_iy f_ey_m_ah_s
c;39;i mean that would be dope (as) fuck right;ay m_iy_n dh_ae_t w_uh_d b_iy d_ow_p ae_z f_ah_k r_ay_t
d;40;whatchu think Thought;w_ah_t_ch_uw th_ih_ng_k th_ao_t
f;42;i start from scratch like a pinch hitter;ay s_t_aa_r_t f_r_ah_m s_k_r_ae_ch l_ay_k ah p_ih_n_ch hh_ih_t_er
b;44;im just a go getter;ay_m jh_ah_s_t ah g_ow g_eh_t_er
f;45;flow hitter;f_l_ow hh_ih_t_er
f;46;keep a bad shaped girl with the good figure;k_iy_p ah b_ae_d sh_ey_p_t g_er_l w_ih_dh dh_ah g_uh_d f_ih_g_y_er
f;47;go figure;g_ow f_ih_g_y_er
f;48;im so sicker;ay_m s_ow s_ih_k_er
b;49;tell her I be making ends;t_eh_l hh_er ay b_iy m_ey_k_ih_ng eh_n_d_z
c;50;she says like yellow signs;sh_iy s_eh_z l_ay_k y_eh_l_ow s_ay_n_z
q;51;or Griffeys like Kens;ao_r G_r_ih_f_er_ax_s l_ay_k K_er_n_s
b;52;im like baby it depends;ay_m l_ay_k b_ey_b_iy ih_t d_ah_p_eh_n_d_z
b;53;im good with the pen;ay_m g_uh_d w_ih_dh dh_ah p_eh_n
r;54;but Im better when I see your friends ten;b_ah_t ay_m b_eh_t_er w_eh_n ay s_iy y_ao_r f_r_eh_n_d_z t_eh_n
d;55;see almost always I would say its time to figure more;s_iy ao_l_m_ow_s_t ao_l_w_ey_z ay w_uh_d s_ey ih_t_s t_ay_m t_uw f_ih_g_y_er m_ao_r
d;56;but lately my figure-s have figured kinda near the floor;b_ah_t l_ey_t_l_iy m_ay f_ih_g_y_er_z hh_ae_v f_ih_g_y_er_d k_ih_n_d_ah n_ih_r dh_ah f_l_ao_r
s;57;gotta install an elevator;g_aa_t_ah ih_n_s_t_ao_l ae_n eh_l_ah_v_ey_t_er
s;58;they whining but Im no connoisseur;dh_ey w_ay_n_ih_ng b_ah_t ay_m n_ow k_aa_n_ah_s_er
t;59;im just kinda sure;ay_m jh_ah_s_t k_ih_n_d_ah sh_uh_r
i;60;that you lightweight like Coors;dh_ae_t y_uw l_ay_t_w_ey_t l_ay_k k_uw_r_z
i;61;and I am in the freight game like Coors;ah_n_d ay ae_m ih_n dh_ah f_r_ey_t g_ey_m l_ay_k k_uw_r_z
d;62;plus my laces (is) the color of some Asian decor;p_l_ah_s m_ay l_ey_s_ah_z ih_z dh_ah k_ah_l_er ah_v s_ah_m ey_zh_ah_n d_ih_k_ao_r
i;63;thought Im a mysterious dude;th_ao_t ay_m ah m_ih_s_t_ih_r_iy_ah_s d_uw_d
i;64;making curious moves;m_ey_k_ih_ng k_y_uh_r_iy_ah_s m_uw_v_z
i;65;im not Syrian but I got on some serious jewels;ay_m n_ax_t s_ih_r_iy_ah_n b_ah_t ay g_aa_t aa_n s_ah_m s_ih_r_iy_ah_s jh_uw_ah_l_z
f;66;triple;t_r_ih_p_ah_l
e;68;you know what fuck that shit yo;y_uw n_ow w_ah_t f_ah_k dh_ae_t sh_iy_t y_ow
h;69;im not doing this to be famous;ay_m n_ax_t d_uw_ih_ng dh_ih_s t_uw b_iy f_ey_m_ah_s
a;70;im not doing this for the money;ay_m n_ax_t d_uw_ih_ng dh_ih_s f_ao_r dh_ah m_ah_n_iy
c;71;im just doing this cause thats what we love to do right;ay_m jh_ah_s_t d_uw_ih_ng dh_ah_s k_aa_z dh_ae_t_s w_ah_t w_iy l_ah_v t_uw d_uw r_ay_t
a;72;i mean like yeah touring the fucking country in a bus;ay m_iy_n l_ay_k y_ae t_uh_r_ih_ng dh_ah f_ah_k_ih_ng k_ah_n_t_r_iy ih_n ah b_ah_s
i;73;yeah that be cool;y_ae dh_ae_t b_iy k_uw_l
g;74;but Im just tryna be real;b_ah_t ay_m jh_ah_s_t t_r_ih_n_ah b_iy r_iy_l
i;75;im tryna express myself with this music;ay_m t_r_ih_n_ah ih_k_s_p_r_eh_s m_ay_s_eh_l_f w_ih_dh dh_ih_s m_y_uw_z_ih_k
h;76;im tryna talk to people in a new way;ay_m t_r_ih_n_ah t_ao_k t_uw p_iy_p_ah_l ih_n ah n_y_uw w_ey
e;77;i don-t know;ay d_ow_n_t n_ow
l;78;maybe thats just me;m_ey_b_iy dh_ae_t_s jh_ah_s_t m_iy
