Rhyme Scheme Letter;Line Number;Lyrics;Phonetic Transcription
a;0;we came a long way;w_iy k_ey_m ey l_ao_ng w_ey
b;1;too far to turn back;t_uw f_aa_r t_ah t_er_n b_ae_k
c;2;no choice but to keep going;n_ow ch_oy_s b_ah_t t_ah k_iy_p g_ow_ah_n
c;3;we ready doe;w_iy r_eh_d_iy d_ow
i;4;grrahhh;g_r_r_ae_h_hh
d;6;i got bad bitches every city;ay g_aa_t b_ae_d b_ih_ch_ah_z eh_v_r_iy s_ih_t_iy
d;7;my niggas livin lavish but they all gritty;m_ay n_ih_g_ae_s l_ih_v_iy_n l_ae_v_ih_sh b_ah_t dh_ey ao_l g_r_ih_t_iy
e;8;we go out and we get it and we split the profit;w_iy g_ow aw_t ah_n_d w_iy g_ih_t ah_t ah_n_d w_iy s_p_l_ih_t dh_iy p_r_aa_f_ah_t
e;9;im keepin to myself cause I ain-t with the gossip;ay_m k_iy_p_iy_n t_uw m_ay_s_eh_l_f k_aa_z ay ey_n_t w_ih_dh dh_ah g_aa_s_ah_p
f;10;im stickin to the script Im a money getter;ay_m s_t_ih_k_iy_n t_uw dh_ah s_k_r_ih_p_t ay_m ah m_ah_n_iy g_eh_t_er
d;11;wig splitter weed smoker I don-t do the liquor;w_ih_g s_p_l_ih_t_er_r w_iy_d s_m_ow_k_er ay d_ow_n_t d_uw dh_ah l_ih_k_er
d;12;but I do the twitter DM ya big sister;b_ah_t ay d_uw dh_ah t_w_iy_t_ax_r  y_aa b_ih_g s_ih_s_t_er
e;13;full Metal don-t hide cause Im gone getcha;f_uh_l m_eh_t_ah_l d_ow_n_t hh_ay_d k_aa_z ay_m g_ao_n g_eh_t_ch_aa
e;14;pull up on your block with the drop top;p_uh_l ah_p aa_n y_ao_r b_l_aa_k w_ih_dh dh_ah d_r_aa_p t_aa_p
l;15;got my haters lookin salty cause Im everything they not;g_aa_t m_ay hh_ey_t_er_z l_uh_k_iy_n s_ao_l_t_iy k_aa_z ay_m eh_v_r_iy_th_ih_ng dh_ey n_ax_t
m;16;got them pretty bitches on me you still fuckin with them thots;g_aa_t dh_eh_m p_r_ih_t_iy b_ih_ch_ah_z aa_n m_iy y_uw s_t_ih_l f_ah_k_iy_n w_ih_dh dh_eh_m t_iy_ey1_ch_oh_t_s
g;17;rollin up that loud pack I can-t hear what you talkin bout;r_aa_l_ih_n ah_p dh_ae_t l_aw_d p_ae_k ay k_ae_n_t hh_ih_r w_ah_t y_uw t_aa_k_ah_n b_aw_t
h;18;tell them niggas come and find me you know I be duckin off;t_eh_l dh_eh_m n_ih_g_ae_s k_ah_m ah_n_d f_ay_n_d m_iy y_uw n_ow ay b_iy d_ah_k_iy_n ao_f
h;19;but if I found out you a snake then Imma have to cut you off;b_ah_t ah_f ay f_aw_n_d aw_t y_uw ah s_n_ey_k dh_eh_n I_m_ae hh_ae_v t_uw k_ah_t y_uw ao_f
g;20;i was in the back seat and I seen you walk it out;ay w_ah_z ih_n dh_ah b_ae_k s_iy_t ah_n_d ay s_iy_n y_uw w_ao_k ih_t aw_t
g;21;boy don-t come to me with that beef cause we don-t talk it out;b_oy d_ow_n_t k_ah_m t_uw m_iy w_ih_dh dh_ae_t b_iy_f k_aa_z w_iy d_ow_n_t t_ao_k ih_t aw_t
n;23;my hittas will get you;m_ay hh_ih_t_ae_s w_ah_l g_eh_t y_uw
n;24;the Nina gone kiss you;dh_ah n_ay_n_ah g_ao_n k_ih_s y_uw
n;25;ya family gone miss you;y_aa f_ae_m_ax_l_ih g_ao_n m_ih_s y_uw
f;26;i swerve in the rental Im doin 120 she givin me temple;ay s_w_er_v ih_n dh_ah r_eh_n_t_ah_l ay_m d_uw_iy_n  sh_iy g_ih_v_ih_n m_iy t_eh_m_p_ah_l
d;27;im schoolin these rappers and trappin with lyrics;ay_m s_k_uw_l_iy_n dh_iy_z r_ae_p_er_z ah_n_d t_r_ae_p_iy_n w_ih_dh l_ih_r_ih_k_s
f;28;you see how Im (snappin-);y_uw s_iy hh_aw ay_m s_n_ae_p_iy_n_eh
g;29;i be wildin out I be wildin out;ay b_iy w_ay_l_d_iy_n aw_t ay b_iy w_ay_l_d_iy_n aw_t
b;30;call a Mariah Nick Cannon;k_ao_l ah m_er_ay_ah n_ih_k k_ae_n_ah_n
c;31;bad bitches only;b_ae_d b_ih_ch_ah_z ow_n_l_iy
o;32;big bands on me;b_ih_g b_ae_n_d_z aa_n m_iy
d;33;im a 305 nigga;ay_m ah  n_ih_g_ae
o;34;get in line nigga and I promise you will know me;g_eh_t ih_n l_ay_n n_ih_g_ae ah_n_d ay p_r_aa_m_ah_s y_uw w_ah_l n_ow m_iy
a;35;the fans want the old me but fuck it I ain-t change;dh_ah f_ae_n_z w_aa_n_t dh_ah ow_l_d m_iy b_ah_t f_ah_k ih_t ay ey_n_t ch_ey_n_jh
a;36;im a big dog now and my fans so deranged;ay_m ah b_ih_g d_ah_g n_aw ah_n_d m_ay f_ae_n_z s_ow d_ih_r_ey_n_jh_d
d;37;stop hating on a nigga;s_t_aa_p hh_ey_t_ih_ng aa_n ah n_ih_g_ae
d;38;while Im doing my thing;w_ay_l ay_m d_uw_ih_ng m_ay th_ih_ng
d;39;cause this shit don-t stop till the fat lady sings;k_aa_z dh_ih_s sh_iy_t d_ow_n_t s_t_aa_p t_ih_l dh_ah f_ae_t l_ey_d_iy s_ih_ng_z
d;41;fat blunts over here;f_ae_t b_l_ah_n_t_s ow_v_er hh_ih_r
p;42;shut Up and Vibe;sh_ah_t ah_p ah_n_d v_ay_b
i;43;yung Simmie;y_ah_ng S_ih_m_iy_ax
