Rhyme Scheme Letter;Line Number;Lyrics;Phonetic Transcription
a;0;how you gone make them stand if you never had the luck;hh_aw y_uw g_ao_n m_ey_k dh_ah_m s_t_ae_n_d ih_f y_uw n_eh_v_er hh_ae_d dh_iy l_ah_k
a;1;and how you gone make them bands if they never gave a fuck;ah_n_d hh_aw y_uw g_ao_n m_ey_k dh_ah_m b_ae_n_d_z ih_f dh_ey n_eh_v_er g_ey_v ey f_ah_k
a;2;how you gone wave them hands if they never show you love;hh_aw y_uw g_ao_n w_ey_v dh_ah_m hh_ae_n_z ih_f dh_ey n_eh_v_er sh_ow y_uw l_ah_v
a;3;easy and Im glad you asked me cause I never give it up;iy_z_iy ah_n_d ay_m g_l_ae_d y_uw ae_s_k_t m_iy k_aa_z ay n_eh_v_er g_ih_v ih_t ah_p
b;5;id like to thank God for the talent;ay_d l_ay_k t_uw th_ae_ng_k g_aa_d f_ao_r dh_ah t_ae_l_ah_n_t
b;6;(as) I stack it up so many cards that I balance;ae_z ay s_t_ae_k ih_t ah_p s_ow m_eh_n_iy k_aa_r_d_z dh_ae_t ay b_ae_l_ah_n_s
b;7;instead of me giving up yards Im a challenge;ih_n_s_t_eh_d ah_v m_iy g_ih_v_ih_ng ah_p y_aa_r_d_z ay_m ah ch_ae_l_ah_n_jh
b;8;im a Push T and so far no malice;ay_m ah p_uh_sh t_iy ah_n_d s_ow f_aa_r n_ow m_ae_l_ah_s
g;9;these bars I average;dh_iy_z b_aa_r_z ay ae_v_ax_r_ih_jh
b;10;sitting here way above the bars you gather;s_ih_t_ih_ng hh_ih_r w_ey ah_b_ah_v dh_ah b_aa_r_z y_uw g_ae_dh_er
b;11;giving all the tool just to carve this pattern;g_ih_v_ih_ng ao_l dh_ah t_uw_l jh_ah_s_t t_uw k_aa_r_v dh_ih_s p_ae_t_er_n
b;12;put it mind thats all that matters these walls I shatter;p_uh_t ih_t m_ay_n_d dh_ae_t_s ao_l dh_ae_t m_ae_t_er_z dh_iy_z w_ao_l_z ay sh_ae_t_er
c;13;and winter-s coming soon my dude;ah_n_d w_ih_n_t_er_z k_ah_m_ih_ng s_uw_n m_ay d_uw_d
c;14;i don-t see another year where we could lose my dude;ay d_ow_n_t s_iy ah_n_ah_dh_er y_ih_r w_eh_r w_iy k_uh_d l_uw_z m_ay d_uw_d
c;15;get ya dreams out on these fools my dude;g_eh_t y_aa d_r_iy_m_z aw_t aa_n dh_iy_z f_uw_l_z m_ay d_uw_d
h;16;cause youre the only one you got to prove it to;k_aa_z y_uw_r dh_ah ow_n_l_iy w_ah_n y_uw g_aa_t t_uw p_r_uw_v ih_t t_uw
h;17;you ain-t bout your shit then I can-t move with you;y_uw ey_n_t b_aw_t y_ao_r sh_iy_t dh_eh_n ay k_ae_n_t m_uw_v w_ih_dh y_uw
c;18;and when we talking about needles I moved a few;ah_n_d w_eh_n w_iy t_ao_k_ih_ng ah_b_aw_t n_iy_d_ah_l_z ay m_uw_v_d ah f_y_uw
c;19;im tryna get a mill I can-t afford to move;ay_m t_r_ih_n_ah g_eh_t ey m_ih_l ay k_ae_n_t ah_f_ao_r_d t_uw m_uw_v
c;20;im writing all these lines I can-t lose the booth;ay_m r_ay_t_ih_ng ao_l dh_iy_z l_ay_n_z ay k_ae_n_t l_uw_z dh_ah b_uw_th
d;22;its only but a matter of time;ih_t_s ow_n_l_iy b_ah_t ah m_ae_t_er ah_v t_ay_m
d;23;and my values going up when Im harder to find;ah_n_d m_ay v_ae_l_y_uw_z g_ow_ih_ng ah_p w_eh_n ay_m hh_aa_r_d_er t_uw f_ay_n_d
d;24;rather be myself because Im smart and defined;r_ae_dh_er b_iy m_ay_s_eh_l_f b_ih_k_ao_z ay_m s_m_aa_r_t ah_n_d d_ah_f_ay_n_d
d;25;treat it like clay Im getting harder with time;t_r_iy_t ih_t l_ay_k k_l_ey ay_m g_eh_t_ih_ng hh_aa_r_d_er w_ih_dh t_ay_m
d;26;im just an artist with mine Im ringing off like a chime;ay_m jh_ah_s_t ae_n aa_r_t_ah_s_t w_ih_dh m_ay_n ay_m r_ih_ng_ih_ng ao_f l_ay_k ah ch_ay_m
d;27;just to keep it real don-t lose your heart and your spine;jh_ah_s_t t_uw k_iy_p ih_t r_iy_l d_ow_n_t l_uw_z y_ao_r hh_aa_r_t ah_n_d y_ao_r s_p_ay_n
d;28;cause everything you want you can put it in line;k_aa_z eh_v_r_iy_th_ih_ng y_uw w_aa_n_t y_uw k_ah_n p_uh_t ih_t ih_n l_ay_n
d;29;even if you don-t believe look for God in the signs;iy_v_ah_n ah_f y_uw d_ow_n_t b_ah_l_iy_v l_uh_k f_ao_r g_aa_d ih_n dh_ah s_ay_n_z
a;31;now they ain-t taking me under;n_aw dh_ey ey_n_t t_ey_k_ih_ng m_iy ah_n_d_er
a;32;i done came this far with my hunger;ay d_ah_n k_ey_m dh_ih_s f_aa_r w_ih_dh m_ay hh_ah_ng_g_er
a;33;ain-t no stealing my thunder;ey_n_t n_ow s_t_iy_l_ih_ng m_ay th_ah_n_d_er
a;34;so let them wonder;s_ow l_eh_t dh_eh_m w_ah_n_d_er
a;35;now they ain-t taking me under;n_aw dh_ey ey_n_t t_ey_k_ih_ng m_iy ah_n_d_er
a;36;i done came this far with my hunger;ay d_ah_n k_ey_m dh_ih_s f_aa_r w_ih_dh m_ay hh_ah_ng_g_er
a;37;ain-t no stealing my thunder;ey_n_t n_ow s_t_iy_l_ih_ng m_ay th_ah_n_d_er
a;38;so let them wonder;s_ow l_eh_t dh_eh_m w_ah_n_d_er
e;40;aww Damn now Im bout to win in this bitch;ao_ae d_ae_m n_aw ay_m b_aw_t t_uw w_ih_n ih_n dh_ih_s b_ih_ch
e;41;cause Im coming for the folks that pretend to be rich;k_aa_z ay_m k_ah_m_ih_ng f_ao_r dh_ah f_ow_k_s dh_ae_t p_r_iy_t_eh_n_d t_uw b_iy r_ih_ch
e;42;i been up on the map watchin energy switch;ay b_ih_n ah_p aa_n dh_ah m_ae_p w_aa_ch_iy_n eh_n_er_jh_iy s_w_ih_ch
e;43;and when you start to get it watch your enemies flip;ah_n_d w_eh_n y_uw s_t_aa_r_t t_uw g_eh_t ih_t w_aa_ch y_ao_r eh_n_ah_m_iy_z f_l_ih_p
f;44;now they wanna be yo friends;n_aw dh_ey w_aa_n_ah b_iy y_ow f_r_eh_n_d_z
e;45;and now they wanna act like kin;ah_n_d n_aw dh_ey w_aa_n_ah ae_k_t l_ay_k k_ih_n
f;46;and now they wanna make amends;ah_n_d n_aw dh_ey w_aa_n_ah m_ey_k ah_m_eh_n_d_z
f;47;they flock when you get them ends;dh_ey f_l_aa_k w_eh_n y_uw g_eh_t dh_eh_m eh_n_d_z
e;48;now Im done being bitter and Im on to bigger pictures;n_aw ay_m d_ah_n b_iy_ih_ng b_ih_t_er ah_n_d ay_m aa_n t_uw b_ih_g_er p_ih_k_ch_er_z
e;49;and its no small talk getting on to bigger business;ah_n_d ih_t_s n_ow s_m_ao_l t_ao_k g_eh_t_ih_ng aa_n t_uw b_ih_g_er b_ih_z_n_ah_s
f;50;im building on the map and moving on to bigger benches;ay_m b_ih_l_d_ih_ng aa_n dh_ah m_ae_p ah_n_d m_uw_v_ih_ng aa_n t_ah b_ih_g_er b_eh_n_ch_ah_z
i;51;and Im stuck doing me I ain-t dealing with the censes;ah_n_d ay_m s_t_ah_k d_uw_ih_ng m_iy ay ey_n_t d_iy_l_ih_ng w_ih_dh dh_ah s_eh_n_s_s
f;52;everything I write Im hittin multiple dimensions;eh_v_r_iy_th_ih_ng ay r_ay_t ay_m hh_ih_t_iy_n m_ah_l_t_ah_p_ah_l d_ih_m_eh_n_sh_ah_n_z
f;53;riding on a new wave and you looking at the tempest;r_ay_d_ih_ng aa_n ah n_y_uw w_ey_v ah_n_d y_uw l_uh_k_ih_ng ae_t dh_ah t_eh_m_p_ah_s_t
e;54;say they want to win but they looking kinda skiddish;s_ey dh_ey w_aa_n_t t_uw w_ih_n b_ah_t dh_ey l_uh_k_ih_ng k_ih_n_d_ah s_k_ih_d_d_ih_sh
l;55;call me 10 years later when Im starin at the finish and Im out;k_ao_l m_iy  y_ih_r_z l_ey_t_er w_eh_n ay_m s_t_ae_r_ih_n ae_t dh_ah f_ih_n_ih_sh ah_n_d ay_m aw_t
a;57;now they ain-t takin me under;n_aw dh_ey ey_n_t t_ae_k_iy_m m_iy ah_n_d_er
a;58;i done came this far with my hunger ain-t no stealing my thunder;ay d_ah_n k_ey_m dh_ih_s f_aa_r w_ih_dh m_ay hh_ah_ng_g_er ey_n_t n_ow s_t_iy_l_ih_ng m_ay th_ah_n_d_er
a;59;so let them wonder;s_ow l_eh_t dh_eh_m w_ah_n_d_er
a;60;now they ain-t taking me under;n_aw dh_ey ey_n_t t_ey_k_ih_ng m_iy ah_n_d_er
a;61;i done came this far with my hunger;ay d_ah_n k_ey_m dh_ih_s f_aa_r w_ih_dh m_ay hh_ah_ng_g_er
a;62;ain-t no stealing my thunder;ey_n_t n_ow s_t_iy_l_ih_ng m_ay th_ah_n_d_er
a;63;so let them wonder;s_ow l_eh_t dh_eh_m w_ah_n_d_er
g;65;aight;ah_iy_g_h_t
