Rhyme Scheme Letter;Line Number;Lyrics;Phonetic Transcription
a;0;trevors getting pissed off but were used to that;t_r_eh_v_er_z g_ih_t_ih_ng p_ih_s_t ao_f b_ah_t w_iy_r y_uw_z_d t_uw dh_ae_t
a;1;and Franklin (is) the driver got Chop in the back;ah_n_d f_r_ae_ng_k_l_ih_n ih_z dh_ah d_r_ay_v_er g_aa_t ch_aa_p ih_n dh_ah b_ae_k
a;2;michael-s aim you can-t match up his shots Do not lack;m_ay_k_ah_l_z ey_m y_uw k_ae_n_t m_ae_ch ah_p hh_ih_z sh_aa_t_s d_uw n_ax_t l_ae_k
b;3;thats why your dead on the ground won-t get up after (tha-aat);dh_ae_t_s w_ay y_ao_r d_eh_d aa_n dh_ah g_r_aw_n_d w_ow_n_t g_eh_t ah_p ae_f_t_er th_ae_aa_ae_t
c;4;yes I just robbed an old lady because Im crooked;y_eh_s ay jh_ah_s_t r_aa_b_d ae_n ow_l_d l_ey_d_iy b_ih_k_ao_z ay_m k_r_uh_k_ah_d
d;5;equipped my grenades It-S time to cook it;ih_k_w_ih_p_t m_ay g_r_ah_n_ey_d_z ih_t_s t_ay_m t_uw k_uh_k ih_t
b;6;they here the sirens;dh_ey hh_ih_r dh_ah s_ay_r_ah_n_z
