Rhyme Scheme Letter;Line Number;Lyrics;Phonetic Transcription
b;0;hands up in the air tonight its my night to shine single ladies hmu on those;hh_ae_n_z ah_p ih_n_ch dh_iy eh_r t_uw_n_ay_t ah_t_s m_ay n_ay_t t_ah sh_ay_n s_ih_ng_g_ah_l l_ey_d_iy_z m_uw aa_n dh_ow_z
c;1;phone numbers your body danceing on the the walls how lovely it looks I love;f_ow_n n_ah_m_b_er_z y_uh_r b_aa_d_iy d_ae_n_s_ih_ng aa_n dh_iy dh_iy w_ao_l_z hh_aw l_ah_v_l_iy ah_t l_uh_k_s ay l_ah_v
d;2;coloring these pictures designs 4 wheels to roll over u niggas I fuck her in;k_ah_l_er_ih_ng dh_iy_z p_ih_k_ch_er_z d_ah_z_ay_n_z ah_ae w_iy_l_z t_ah r_ow_l ow_v_er ih_k n_ih_g_ae_s ay f_ah_k hh_er ih_n_ch
a;3;the back but I think before I do putting out words getting them out my mind;dh_iy b_ae_k b_ah_t ay th_ih_ng_k b_iy_f_ao_r ay d_uw p_uh_t_ih_ng aw_t w_er_d_z g_ih_t_ih_ng dh_ah_m aw_t m_ay m_ay_n_d
e;4;tomb tomb tomb bitch mummie wrap these ppl leave them in darkness one gun to;t_uw_m t_uw_m t_uw_m b_ih_ch m_ah_m_iy r_ae_p dh_iy_z p_iy_p_iy1_eh1_m_l l_iy_v dh_ah_m ih_n_ch d_aa_r_k_n_ah_s hh_w_ah_n g_ah_n t_ah
b;5;clips loaded who wants it first protected here there almost every place u;k_l_ih_p_s l_ow_d_ah_d hh_uw w_aa_n_t_s ah_t f_er_s_t p_er_t_eh_k_t_ah_d hh_ih_r dh_eh_r ao_l_m_ow_s_t eh_v_r_iy p_l_ey_s ih_k
a;6;can-t think right;k_ae_n_t th_ih_ng_k r_ay_t
