Rhyme Scheme Letter;Line Number;Lyrics;Phonetic Transcription
a;0;theres way too many straps off in my kitchen;dh_eh_r_s w_ey t_uw m_eh_n_iy s_t_r_ae_p_s ao_f ih_n m_ay k_ih_ch_ah_n
a;1;theres way too many slides off in my kitchen;dh_eh_r_s w_ey t_uw m_eh_n_iy s_l_ay_d_z ao_f ih_n m_ay k_ih_ch_ah_n
a;2;i had to move my stove out my kitchen;ay hh_ae_d t_uw m_uw_v m_ay s_t_ow_v aw_t m_ay k_ih_ch_ah_n
a;3;just to keep these niggas out my kitchen;jh_ah_s_t t_uw k_iy_p dh_iy_z n_ih_g_ae_s aw_t m_ay k_ih_ch_ah_n
b;5;theres way to many straps off in my livin room;dh_eh_r_s w_ey t_uw m_eh_n_iy s_t_r_ae_p_s ao_f ih_n m_ay l_ih_v_iy_n r_uw_m
b;6;birds everywhere smells like chicken fumes;b_er_d_z eh_v_r_iy_w_eh_r s_m_eh_l_z l_ay_k ch_ih_k_ah_n f_y_uw_m_z
b;7;i don-t think you pussy boy you perfume;ay d_ow_n_t th_ih_ng_k y_uw p_uh_s_iy b_oy y_uw p_er_f_y_uw_m
b;8;i just pull up on him let them bullet vroom;ay jh_ah_s_t p_uh_l ah_p aa_n hh_ih_m l_eh_t dh_eh_m b_uh_l_ah_t v_r_uw_m
c;9;i hit so many plates off in my trap spot;ay hh_ih_t s_ow m_eh_n_iy p_l_ey_t_s ao_f ih_n m_ay t_r_ae_p s_p_aa_t
l;10;all I know (is) juug til I cap out;ao_l ay n_ow ih_z jh_uw_uw_g t_ih_l ay k_ae_p aw_t
c;11;all I know (is) get it til the work gone;ao_l ay n_ow ih_z g_eh_t ih_t t_ih_l dh_ah w_er_k g_ao_n
d;12;nigga I been robbin since them chirp phones;n_ih_g_ae ay b_ih_n r_aa_b_ih_n s_ih_n_s dh_eh_m ch_er_p f_ow_n_z
c;13;i reunite with gangsters at the jack spot;ay r_iy_uw_n_ay_t w_ih_dh g_ae_ng_s_t_er_z ae_t dh_ah jh_ae_k s_p_aa_t
c;14;all white mollies got my block hot;ao_l w_ay_t m_aa_l_iy_s g_aa_t m_ay b_l_aa_k hh_aa_t
c;15;4 in the mornin and they still soft;ah_ae ih_n dh_ah m_oh_r_n_ax_n ah_n_d dh_ey s_t_ih_l s_aa_f_t
c;16;all they know (is) Woop we need that ready rock;ao_l dh_ey n_ow ih_z  w_iy n_iy_d dh_ae_t r_eh_d_iy r_aa_k
e;17;still in the kitchen water (whippin-);s_t_ih_l ih_n dh_ah k_ih_ch_ah_n w_ao_t_er w_ih_p_iy_n_eh
e;18;700 ways thats how we (livin-); w_ey_z dh_ae_t_s hh_aw w_iy l_ih_v_iy_n_eh
a;19;you can catch a hot one in the kitchen;y_uw k_ah_n k_ae_ch ah hh_aa_t w_ah_n ih_n dh_ah k_ih_ch_ah_n
a;20;i can-t let em disrespect my kitchen;ay k_ae_n_t l_eh_t eh_m d_ih_s_r_ah_s_p_eh_k_t m_ay k_ih_ch_ah_n
a;22;theres way too many straps off in my kitchen;dh_eh_r_s w_ey t_uw m_eh_n_iy s_t_r_ae_p_s ao_f ih_n m_ay k_ih_ch_ah_n
a;23;theres way too many slides off in my kitchen;dh_eh_r_s w_ey t_uw m_eh_n_iy s_l_ay_d_z ao_f ih_n m_ay k_ih_ch_ah_n
a;24;i had to move my stove out my kitchen;ay hh_ae_d t_uw m_uw_v m_ay s_t_ow_v aw_t m_ay k_ih_ch_ah_n
a;25;just to keep these niggas out my kitchen;jh_ah_s_t t_uw k_iy_p dh_iy_z n_ih_g_ae_s aw_t m_ay k_ih_ch_ah_n
e;26;im exactly what the streets been (missin-);ay_m ih_g_z_ae_k_t_l_iy w_ah_t dh_ah s_t_r_iy_t_s b_ih_n m_ih_s_iy_n_eh
e;27;every time I talk they pay attention;eh_v_er_iy t_ay_m ay t_ao_k dh_ey p_ey ah_t_eh_n_sh_ah_n
a;28;man don-t disrespect me in my kitchen;m_ae_n d_ow_n_t d_ih_s_r_ah_s_p_eh_k_t m_iy ih_n m_ay k_ih_ch_ah_n
a;29;i swear you can catch one in the kitchen;ay s_w_eh_r y_uw k_ah_n k_ae_ch w_ah_n ih_n dh_ah k_ih_ch_ah_n
a;31;a lot of water whippin in the kitchen;ah l_aa_t ah_v w_ao_t_er w_ih_p_iy_n ih_n dh_ah k_ih_ch_ah_n
a;32;a lot of niggas die behind them pigeons;ah l_aa_t ah_v n_ih_g_ae_s d_ay b_ah_hh_ay_n_d dh_eh_m p_ih_jh_ah_n_z
a;33;right wrist look like a bag of piffin;r_ay_t r_ih_s_t l_uh_k l_ay_k ah b_ae_g ah_v s_ih_f_ih_n
m;34;left wrist look like Im truly gettin it;l_eh_f_t r_ih_s_t l_uh_k l_ay_k ay_m t_r_uw_l_iy s_eh_t_iy_n ih_t
f;35;a lot of kush jars off in my cabinets;ah l_aa_t ah_v k_uh_sh jh_aa_r_z ao_f ih_n m_ay k_ae_b_ah_n_ah_t_s
a;36;real trap niggas be attached to bricks;r_iy_l t_r_ae_p n_ih_g_ae_s b_iy ah_t_ae_ch_t t_uw b_r_ih_k_s
g;37;woop gang niggas got me jackin shit;w_ow_oh_p g_ae_ng n_ih_g_ae_s g_aa_t m_iy jh_ae_k_iy_m sh_iy_t
g;38;molly on your bitch like a mack and shit;m_aa_l_iy aa_n y_ao_r b_ih_ch l_ay_k ah m_ae_k ah_n_d sh_iy_t
l;39;ain-t never hard to find Im where that curve at;ey_n_t n_eh_v_er hh_aa_r_d t_uw f_ay_n_d ay_m w_eh_r dh_ae_t k_er_v ae_t
l;40;that used to be where niggas sell them birds at;dh_ae_t y_uw_z_d t_uw b_iy w_eh_r n_ih_g_ae_s s_eh_l dh_eh_m b_er_d_z ae_t
f;41;now we scramblin for that pack like we ain-t hear of sacks;n_aw w_iy s_k_r_ae_m_b_ah_iy_n f_ao_r dh_ae_t p_ae_k l_ay_k w_iy ey_n_t hh_ih_r ah_v s_ae_k_s
f;42;and niggas steady callin for that purp bag;ah_n_d n_ih_g_ae_s s_t_eh_d_iy k_ao_l_iy_n f_ao_r dh_ae_t p_er_p b_ae_g
h;43;we still be takin shit how we came up;w_iy s_t_ih_l b_iy t_ae_k_iy_m sh_iy_t hh_aw w_iy k_ey_m ah_p
h;44;niggas HollyWoop we switched the name up;n_ih_g_ae_s  w_iy s_w_ih_ch_t dh_ah n_ey_m ah_p
h;45;niggas totin pistols gettin flamed up;n_ih_g_ae_s t_ow_t_iy_m p_ih_s_t_ah_l_z s_eh_t_iy_n f_l_ey_m_d ah_p
h;46;just for trying to disrespect my kitchen cuh;jh_ah_s_t f_ao_r t_r_ay_ih_ng t_uw d_ih_s_r_ah_s_p_eh_k_t m_ay k_ih_ch_ah_n k_ah_b_ae
a;48;got too many birds in my trap too many straps in my kitchen;g_aa_t t_uw m_eh_n_iy b_er_d_z ih_n m_ay t_r_ae_p t_uw m_eh_n_iy s_t_r_ae_p_s ih_n m_ay k_ih_ch_ah_n
a;49;i smoke jars jars to the face when FedEx bring shipments;ay s_m_ow_k jh_aa_r_z jh_aa_r_z t_uw dh_ah f_ey_s w_eh_n f_eh_d_eh_k_s b_r_ih_ng sh_ih_p_m_ah_n_t_s
e;50;true Religions got bands in (em-) ziplocs got grams in (em-);t_r_uw r_iy_l_ih_jh_ah_n_z g_aa_t b_ae_n_d_z ih_n eh_m_eh z_ih_p_l_oh_k_s g_aa_t g_r_ae_m_z ih_n eh_m_eh
e;51;chicken coop thats a van got birds stuffed and crammed in (em-);ch_ih_k_ah_n k_uw_p dh_ae_t_s ah v_ae_n g_aa_t b_er_d_z s_t_ah_f_t ah_n_d k_r_ae_m_d ih_n eh_m_eh
c;52;i sell drugs where the killers be and I really hang with robbers;ay s_eh_l d_r_ah_g_z w_eh_r dh_ah k_ih_l_er_z b_iy ah_n_d ay r_ih_l_iy hh_ae_ng w_ih_dh r_aa_b_er_z
e;53;and these belt blocks and mollies all came from (robbin-);ah_n_d dh_iy_z b_eh_l_t b_l_aa_k_s ah_n_d m_aa_l_iy_s ao_l k_ey_m f_r_ah_m r_aa_b_ih_n_eh
i;54;high risk high profit just to live that high life;hh_ay r_ih_s_k hh_ay p_r_aa_f_ah_t jh_ah_s_t t_uw l_ay_v dh_ae_t hh_ay l_ay_f
i;55;im cloud surfin on kush clouds Im really livin that cloud life;ay_m k_l_aw_d s_er_f_iy_n aa_n k_uh_sh k_l_aw_d_z ay_m r_ih_l_iy l_ih_v_iy_n dh_ae_t k_l_aw_d l_ay_f
c;56;shoutout to my shooters one time for my robbers;sh_aw_t_aw_t t_uw m_ay sh_uw_t_er_z w_ah_n t_ay_m f_ao_r m_ay r_aa_b_er_z
c;57;big bank take little bank so I fed his ass to my robbers;b_ih_g b_ae_ng_k t_ey_k l_ih_t_ah_l b_ae_ng_k s_ow ay f_eh_d hh_ih_z ae_s t_uw m_ay r_aa_b_er_z
d;58;stay the out my kitchen keep your hands off my stove;s_t_ey dh_ah aw_t m_ay k_ih_ch_ah_n k_iy_p y_ao_r hh_ae_n_d_z ao_f m_ay s_t_ow_v
d;59;and if you pull up with that sack my whole team on go;ah_n_d ah_f y_uw p_uh_l ah_p w_ih_dh dh_ae_t s_ae_k m_ay hh_ow_l t_iy_m aa_n g_ow
h;60;i only deal with the plug cuz the middle man trying to make some;ay ow_n_l_iy d_iy_l w_ih_dh dh_ah p_l_ah_g k_ah_z dh_ah m_ih_d_ah_l m_ae_n t_r_ay_ih_ng t_uw m_ey_k s_ah_m
h;61;i only deal with the plug cuz in the end ima take some;ay ow_n_l_iy d_iy_l w_ih_dh dh_ah p_l_ah_g k_ah_z ih_n dh_ah eh_n_d ih_m_ah t_ey_k s_ah_m
l;62;put bars in the trash can;p_uh_t b_aa_r_z ih_n dh_ah t_r_ae_sh k_ah_n
