Rhyme Scheme Letter;Line Number;Lyrics;Phonetic Transcription
i;0;uh yo;ah y_ow
a;1;im getting mine baby Im on the grind daily;ay_m g_eh_t_ih_ng m_ay_n b_ey_b_iy ay_m aa_n dh_ah g_r_ay_n_d d_ey_l_iy
a;2;and all these rhymes baby been on my mind lately;ah_n_d ao_l dh_iy_z r_ay_m_z b_ey_b_iy b_ih_n aa_n m_ay m_ay_n_d l_ey_t_l_iy
a;3;and I may die crazy cuz I won-t die lazy;ah_n_d ay m_ey d_ay k_r_ey_z_iy k_ah_z ay w_ow_n_t d_ay l_ey_z_iy
b;4;its now or never I said its now or never man;ih_t_s n_aw ao_r n_eh_v_er ay s_eh_d ih_t_s n_aw ao_r n_eh_v_er m_ae_n
l;5;im gonna shine baby Ill make the grind pay me;ay_m g_aa_n_ah sh_ay_n b_ey_b_iy ay_l m_ey_k dh_ah g_r_ay_n_d p_ey m_iy
a;6;and all these fine ladies theyll know my lines baby;ah_n_d ao_l dh_iy_z f_ay_n l_ey_d_iy_z dh_ey_l n_ow m_ay l_ay_n_z b_ey_b_iy
a;7;and I may die crazy cuz I won-t die lazy;ah_n_d ay m_ey d_ay k_r_ey_z_iy k_ah_z ay w_ow_n_t d_ay l_ey_z_iy
b;8;its now or never I said its now or never man;ih_t_s n_aw ao_r n_eh_v_er ay s_eh_d ih_t_s n_aw ao_r n_eh_v_er m_ae_n
c;10;don-t apologise for honesty or compromise for modesty;d_ow_n_t ax_p_oh_l_ax_jh_ay_z f_ao_r aa_n_ah_s_t_iy ao_r k_aa_m_p_r_ah_m_ay_z f_ao_r m_aa_d_ah_s_t_iy
c;11;be grateful for whats monetary stay faithful to the odyssey;b_iy g_r_ey_t_f_ah_l f_ao_r w_ah_t_s m_aa_n_ah_t_eh_r_iy s_t_ey f_ey_th_f_ah_l t_uw dh_ah aa_d_ah_s_iy
c;12;talk to people honestly and ward off animosity;t_ao_k t_uw p_iy_p_ah_l aa_n_ah_s_t_l_iy ah_n_d w_ao_r_d ao_f ae_n_ah_m_aa_s_ah_t_iy
c;13;but better mediocrity and peddle generosity;b_ah_t b_eh_t_er m_iy_d_iy_aa_k_r_ah_t_iy ah_n_d p_eh_d_ah_l jh_eh_n_er_aa_s_ah_t_iy
m;14;want it then go get it if you talk it you should live it;w_aa_n_t ih_t dh_eh_n g_ow g_eh_t ih_t ah_f y_uw t_ao_k ih_t y_uw sh_uh_d l_ay_v ih_t
m;15;if I said it then I meant it if I spit it then I live it;ah_f ay s_eh_d ih_t dh_eh_n ay m_eh_n_t ih_t ah_f ay s_p_ih_t ih_t dh_eh_n ay l_ay_v ih_t
b;16;to drugs Im not enamoured you can ZubyQuote that;t_uw d_r_ah_g_z ay_m n_ax_t eh_n_ae_m_er_d y_uw k_ah_n  dh_ae_t
b;17;never arming any hammers but I do evoke crack;n_eh_v_er aa_r_m_ih_ng eh_n_iy hh_ae_m_er_z b_ah_t ay d_uw ih_v_ow_k k_r_ae_k
d;18;my audios addictive and Im sinning but Im winning;m_ay aa_d_iy_ow_z ah_d_ih_k_t_ih_v ah_n_d ay_m s_ih_n_ih_ng b_ah_t ay_m w_ih_n_ih_ng
d;19;see me grinning while Im chilling cuz Im swimming with some women;s_iy m_iy g_r_ih_n_ih_ng w_ay_l ay_m ch_ih_l_ih_ng k_ah_z ay_m s_w_ih_m_ih_ng w_ih_dh s_ah_m w_ih_m_ah_n
e;20;thrilling Spanish honeys who don-t ask your boy for money;th_r_ih_l_ih_ng s_p_ae_n_ih_sh hh_ah_n_iy_z hh_uw d_ow_n_t ae_s_k y_ao_r b_oy f_ao_r m_ah_n_iy
e;21;but tell papi that hes guapo even when Im dressing bummy;b_ah_t t_eh_l p_ae_p_iy dh_ae_t hh_iy_s g_w_aa_p_oh iy_v_ah_n w_eh_n ay_m d_r_eh_s_ih_ng b_ah_m_m_y
n;22;some tell me that they love me I tell them to quit lying;s_ah_m t_eh_l m_iy dh_ae_t dh_ey l_ah_v m_iy ay t_eh_l dh_eh_m t_uw k_w_ih_t l_ay_ih_ng
n;23;they tell him that they mean it and I tell them to keep trying;dh_ey t_eh_l hh_ih_m dh_ae_t dh_ey m_iy_n ih_t ah_n_d ay t_eh_l dh_eh_m t_uw k_iy_p t_r_ay_ih_ng
o;24;always asking if my album covers digitally enhanced;ao_l_w_ey_z ae_s_k_ih_ng ah_f m_ay ae_l_b_ah_m k_ah_v_er_z d_ih_jh_ah_t_ah_l_iy ih_n_hh_aa_n_s_t
b;25;like nah baby girl Im very physically advanced;l_ay_k n_aa b_ey_b_iy g_er_l ay_m v_eh_r_iy f_ih_z_ih_k_ah_l_iy ah_d_v_ae_n_s_t
f;27;uh the first cut should be the deepest;ah dh_ah f_er_s_t k_ah_t sh_uh_d b_iy dh_ah d_iy_p_ah_s_t
f;28;the second one-s to penetrate your mental through the speakers;dh_ah s_eh_k_ah_n_d w_ah_n_z t_uw p_eh_n_ah_t_r_ey_t y_ao_r m_eh_n_t_ah_l th_r_uw dh_ah s_p_iy_k_er_z
f;29;behind the dying meekness (is) the actual uniqueness;b_ah_hh_ay_n_d dh_ah d_ay_ih_ng m_iy_k_n_eh_s ih_z dh_iy ae_k_ch_ua_l y_uw_n_iy_k_n_ah_s
f;30;of my mind and rhyming sleekness not no fabricated weakness;ah_v m_ay m_ay_n_d ah_n_d r_ay_m_ih_ng s_l_iy_k_ha_n_eh_s n_ax_t n_ow f_ae_b_r_ih_k_ey_t_ah_d w_iy_k_n_ah_s
d;31;the motive the fitness the meaning of insistence;dh_iy m_ow_t_ih_v dh_ah f_ih_t_n_ah_s dh_ah m_iy_n_ih_ng ah_v ih_n_s_ih_s_t_ah_n_s
d;32;my family the witness my reason for existence;m_ay f_ae_m_ax_l_ih dh_ah w_ih_t_n_ah_s m_ay r_iy_z_ah_n f_ao_r eh_g_z_ih_s_t_ah_n_s
d;33;believe Ill leave with something from a decade of persistence;b_ah_l_iy_v ay_l l_iy_v w_ih_dh s_ah_m_th_ih_ng f_r_ah_m ah d_eh_k_ey_d ah_v p_er_s_ih_s_t_ah_n_s
p;34;grew my audience from nothing f the path of least resistance;g_r_uw m_ay aa_d_iy_ah_n_s f_r_ah_m n_ah_th_ih_ng eh_f dh_ah p_ae_th ah_v l_iy_s_t r_ih_z_ih_s_t_ax_n_s
f;35;was rocking it for freebie when my flow was still uneasy;w_ah_z r_aa_k_ih_ng ih_t f_ao_r f_r_iy_b_iy w_eh_n m_ay f_l_ow w_ah_z s_t_ih_l ah_n_iy_z_iy
l;36;now Im flying out to Europe and the people want to see me;n_aw ay_m f_l_ay_ih_ng aw_t t_uw y_uh_r_ah_p ah_n_d dh_ah p_iy_p_ah_l w_aa_n_t t_uw s_iy m_iy
l;37;but if you think its easy step into these shoes and be me;b_ah_t ah_f y_uw th_ih_ng_k ih_t_s iy_z_iy s_t_eh_p ih_n_t_uw dh_iy_z sh_uw_z ah_n_d b_iy m_iy
f;38;rock a couple hundred shows sell a couple thousand CDs;r_aa_k ah k_ah_p_ah_l hh_ah_n_d_r_ah_d sh_ow_z s_eh_l ah k_ah_p_ah_l th_aw_z_ah_n_d s_iy_d_iy_z
l;39;in a couple different countries how I know my people love me;ih_n ah k_ah_p_ah_l d_ih_f_r_ax_n_t k_ah_n_t_r_iy_z hh_aw ay n_ow m_ay p_iy_p_ah_l l_ah_v m_iy
l;40;i sign a lot of autographs and ladies often hug me;ay s_ay_n ah l_aa_t ah_v ao_t_ah_g_r_ae_f_s ah_n_d l_ey_d_iy_z ao_f_ah_n hh_ah_g m_iy
g;41;they tell me Im the bestest been invested since conception;dh_ey t_eh_l m_iy ay_m dh_ah b_eh_s_t_st b_ih_n ih_n_v_eh_s_t_ah_d s_ih_n_s k_ah_n_s_eh_p_sh_ah_n
g;42;now my dream (is) half reality protected from inception;n_aw m_ay d_r_iy_m ih_z hh_ae_f r_iy_ae_l_ah_t_iy p_r_ax_t_eh_k_t_ih_d f_r_ah_m ih_n_s_eh_p_sh_ah_n
h;44;whats the hardest obligation of an artist occupation;w_ah_t_s dh_ah hh_aa_r_d_ah_s_t aa_b_l_ah_g_ey_sh_ah_n ah_v ae_n aa_r_t_ah_s_t aa_k_y_ah_p_ey_sh_ah_n
h;45;its trying to find elation amongst hate and admiration;ih_t_s t_r_ay_ih_ng t_uw f_ay_n_d ah_l_ey_sh_ah_n ah_m_ah_ng_s_t hh_ey_t ah_n_d ae_d_m_er_ey_sh_ah_n
h;46;don-t ever look for trouble call it fated dedication;d_ow_n_t eh_v_er l_uh_k f_ao_r t_r_ah_b_ah_l k_ao_l ih_t f_ey_t_ah_d d_eh_d_ah_k_ey_sh_ah_n
h;47;haters trying to pop my bubble with serrated provocation;hh_ey_t_er_z t_r_ay_ih_ng t_uw p_aa_p m_ay b_ah_b_ah_l w_ih_dh s_eh_r_ey_t_ah_d p_r_aa_v_ah_k_ey_sh_ah_n
a;48;but my frame control (is) tight and Ive been too many places;b_ah_t m_ay f_r_ey_m k_ah_n_t_r_ow_l ih_z t_ay_t ah_n_d ay_v b_ih_n t_uw m_eh_n_iy p_l_ey_s_ah_z
h;49;and killed way too many stages to be fazed by aggravation;ah_n_d k_ih_l_d w_ey t_uw m_eh_n_iy s_t_ey_jh_ah_z t_uw b_iy f_ey_z_d b_ay ae_g_r_ah_v_ey_sh_ah_n
a;50;i charge on negativity its positively stated;ay ch_aa_r_jh aa_n n_eh_g_ah_t_ih_v_ah_t_iy ih_t_s p_aa_z_ah_t_ih_v_l_iy s_t_ey_t_ah_d
q;51;discharge my creativity and write when Im frustrated;d_ih_s_ch_aa_r_jh_ah m_ay k_r_iy_ey_t_ih_v_ah_t_iy ah_n_d r_ay_t w_eh_n ay_m f_r_ah_s_t_r_ey_t_ah_d
i;52;so am I motivated Or maybe Im just different;s_ow ae_m ay m_ow_t_ah_v_ey_t_ah_d ao_r m_ey_b_iy ay_m jh_ah_s_t d_ih_f_r_ax_n_t
d;53;driven by desire I don-t really have a wish list;d_r_ih_v_ah_n b_ay d_ah_z_ay_r ay d_ow_n_t r_ih_l_iy hh_ae_v ah w_ih_sh l_ih_s_t
d;54;flipping through the fire if I crave its on my hit list;f_l_ih_p_ih_ng th_r_uw dh_ah f_ay_er ah_f ay k_r_ey_v ih_t_s aa_n m_ay hh_ih_t l_ih_s_t
d;55;livings never dire when youre brave enough to get rich;l_ih_v_ih_ng_z n_eh_v_er d_ay_r w_eh_n y_uw_r b_r_ey_v ah_n_ah_f t_uw g_eh_t r_ih_ch
a;56;or try vaguely defy lazy vie greatly;ao_r t_r_ay v_ey_g_l_iy d_ah_f_ay l_ey_z_iy v_ay g_r_ey_t_l_iy
a;57;and whine faintly no riches come to cry babies;ah_n_d w_ay_n f_ey_n_t_l_iy n_ow r_ih_ch_ah_z k_ah_m t_uw k_r_ay b_ey_b_iy_z
a;58;deny safety just make that leap and fly bravely;d_ah_n_ay s_ey_f_t_iy jh_ah_s_t m_ey_k dh_ae_t l_iy_p ah_n_d f_l_ay b_r_ey_v_l_iy
a;59;and if you die crazy at least you tried baby;ah_n_d ah_f y_uw d_ay k_r_ey_z_iy ae_t l_iy_s_t y_uw t_r_ay_d b_ey_b_iy
