Rhyme Scheme Letter;Line Number;Lyrics;Phonetic Transcription
a;0;rap Genius Rap Genius;r_ae_p jh_iy_n_y_ah_s r_ae_p jh_iy_n_y_ah_s
a;1;this shit (is) so convenient Rap Genius;dh_ih_s sh_iy_t ih_z s_ow k_ah_n_v_iy_n_y_ah_n_t r_ae_p jh_iy_n_y_ah_s
a;2;whated he say What-d he say Rap Genius;w_ah_t_t hh_iy s_ey w_ah_t_ah_d hh_iy s_ey r_ae_p jh_iy_n_y_ah_s
a;3;so convenient my nigga Rap Genius;s_ow k_ah_n_v_iy_n_y_ah_n_t m_ay n_ih_g_ae r_ae_p jh_iy_n_y_ah_s
a;4;rap Genius Rap Genius;r_ae_p jh_iy_n_y_ah_s r_ae_p jh_iy_n_y_ah_s
a;5;this shit (is) so convenient Rap Genius;dh_ah_s sh_iy_t ah_z s_ow k_ah_n_v_iy_n_y_ah_n_t r_ae_p jh_iy_n_y_ah_s
a;6;whated he say What-d he say Rap Genius;w_ah_t_t hh_iy s_ey w_ah_t_ah_d hh_iy s_ey r_ae_p jh_iy_n_y_ah_s
a;7;rap Genius my nigga Rap Genius;r_ae_p jh_iy_n_y_ah_s m_ay n_ih_g_ae r_ae_p jh_iy_n_y_ah_s
b;9;im riding on the beat like I don-t give a fuck;ay_m r_ay_d_ih_ng aa_n dh_ah b_iy_t l_ay_k ay d_ow_n_t g_ih_v ah f_ah_k
b;10;id rather have a bitch that could fuck and suck;ay_d r_ah_dh_er hh_ae_v ey b_ih_ch dh_ah_t k_uh_d f_ah_k ah_n_d s_ah_k
b;11;im swagging on the beat like (is) this enough;ay_m s_w_ae_g_ih_ng aa_n dh_ah b_iy_t l_ay_k ih_z dh_ih_s ah_n_ah_f
b;12;should I rap about guns so Im really tough;sh_uh_d ay r_ae_p ah_b_aw_t g_ah_n_z s_ow ay_m r_ih_l_iy t_ah_f
c;13;young asshole should of went to class more;y_ah_ng ae_s_hh_ow_l sh_uh_d ah_v w_eh_n_t t_uw k_l_ae_s m_ao_r
d;14;doing shit that ya-ll never did;d_uw_ih_ng sh_iy_t dh_ae_t y_aa_l n_eh_v_er d_ih_d
e;15;and Im fresh man like sophomore;ah_n_d ay_m f_r_eh_sh m_ae_n l_ay_k s_aa_f_m_ao_r
c;16;ya-ll niggas wack like soft porn;y_aa_l n_ih_g_ae_s w_ae_k l_ay_k s_aa_f_t p_ao_r_n
c;17;and my points far like half court;ah_n_d m_ay p_oy_n_t_s f_aa_r l_ay_k hh_ae_f k_ao_r_t
c;18;i don-t play fair Im a poor sport;ay d_ow_n_t p_l_ey f_eh_r ay_m ah p_uh_r s_p_ao_r_t
e;19;and Ya-ll niggas green like osbourne;ah_n_d y_aa_l n_ih_g_ae_s g_r_iy_n l_ay_k aa_s_b_er_n
e;20;head of the party Im always tardy;hh_eh_d ah_v dh_ah p_aa_r_t_iy ay_m ao_l_w_ey_z t_aa_r_d_iy
f;21;im not a doctor Im your papa I ain-t;ay_m n_ax_t ah d_aa_k_t_er ay_m y_ao_r p_aa_p_ah ay ey_n_t
g;22;carry my team up on my back thats why Im;k_ae_r_iy m_ay t_iy_m ah_p aa_n m_ay b_ae_k dh_ae_t_s w_ay ay_m
f;23;you tryna be king Im sorry bro the spot (is) taken;y_uw t_r_ih_n_ah b_iy k_ih_ng ay_m s_aa_r_iy b_r_ow dh_ah s_p_aa_t ih_z t_ey_k_ah_n
a;25;rap Genius Rap Genius;r_ae_p jh_iy_n_y_ah_s r_ae_p jh_iy_n_y_ah_s
a;26;this shit (is) so convenient Rap Genius;dh_ih_s sh_iy_t ah_z s_ow k_ah_n_v_iy_n_y_ah_n_t r_ae_p jh_iy_n_y_ah_s
a;27;whated he say What-d he say Rap Genius;w_ah_t_t hh_iy s_ey w_ah_t_ah_d hh_iy s_ey r_ae_p jh_iy_n_y_ah_s
a;28;so convenient my nigga Rap Genius;s_ow k_ah_n_v_iy_n_y_ah_n_t m_ay n_ih_g_ae r_ae_p jh_iy_n_y_ah_s
a;29;rap Genius Rap Genius;r_ae_p jh_iy_n_y_ah_s r_ae_p jh_iy_n_y_ah_s
a;30;this shit (is) so convenient Rap Genius;dh_ih_s sh_iy_t ih_z s_ow k_ah_n_v_iy_n_y_ah_n_t r_ae_p jh_iy_n_y_ah_s
a;31;whated he say What-d he say Rap Genius;w_ah_t_t hh_iy s_ey w_ah_t_ah_d hh_iy s_ey r_ae_p jh_iy_n_y_ah_s
a;32;rap Genius my nigga Rap Genius;r_ae_p jh_iy_n_y_ah_s m_ay n_ih_g_ae r_ae_p jh_iy_n_y_ah_s
d;34;its Timmy Im killing Im back in the building;ih_t_s t_ih_m_iy ay_m k_ih_l_ih_ng ay_m b_ae_k ih_n dh_ah b_ih_l_d_ih_ng
d;35;got racks to the ceiling I laugh like a villain;g_aa_t r_ae_k_s t_uw dh_ah s_iy_l_ih_ng ay l_ae_f l_ay_k ah v_ih_l_ah_n
d;36;might stack 50 million might stack 50 billion;m_ay_t s_t_ae_k  m_ih_l_y_ah_n m_ay_t s_t_ae_k  b_ih_l_y_ah_n
d;37;nigga Im balling thats Spaulding thats Wilson;n_ih_g_ae ay_m b_ao_l_ih_ng dh_ae_t_s s_p_ao_l_d_ih_ng dh_ae_t_s w_ih_l_s_ah_n
h;38;(as) far (as) features you call me I kill it;ae_z f_aa_r ae_z f_iy_ch_er_z y_uw k_ao_l m_iy ay k_ih_l ih_t
i;39;im just a youngin thats ballin like Krillin;ay_m jh_ah_s_t ah y_ah_n_jh_ih_n dh_ae_t_s b_ae_l_ih_n l_ay_k K_r_iy_l_ax_n
a;40;bars got these wack rappers all in they feelings;b_aa_r_z g_aa_t dh_iy_z w_ae_k r_ae_p_er_z ao_l ih_n dh_ey f_iy_l_ih_ng_z
a;41;but I don-t give two flying fucks how they feeling;b_ah_t ay d_ow_n_t g_ih_v t_uw f_l_ay_ih_ng f_ah_k_s hh_aw dh_ey f_iy_l_ih_ng
d;42;ain-t too many rappers next to me nigga;ey_n_t t_uw m_eh_n_iy r_ae_p_er_z n_eh_k_s_t t_uw m_iy n_ih_g_ae
d;43;d E A D till the death of me nigga;d_iy iy ah d_iy t_ih_l dh_ah d_eh_th ah_v m_iy n_ih_g_ae
d;45;earning my stripes like a referee nigga;er_n_ih_ng m_ay s_t_r_ay_p_s l_ay_k ah r_eh_f_er_iy n_ih_g_ae
d;46;somebody tell this beat Rest In Peace nigga;s_ah_m_b_aa_d_iy t_eh_l dh_ih_s b_iy_t r_eh_s_t ih_n p_iy_s n_ih_g_ae
d;47;soon someone should be arresting me nigga;s_uw_n s_ah_m_w_ah_n sh_uh_d b_iy er_eh_s_t_ih_ng m_iy n_ih_g_ae
b;48;cause this (is) straight murder man fuck;k_aa_z dh_ih_s ih_z s_t_r_ey_t m_er_d_er m_ae_n f_ah_k
l;49;who you heard of;hh_uw y_uw hh_er_d ah_v
g;50;recording in my bedroom like Im Bo Burnham;r_ah_k_ao_r_d_ih_ng ih_n m_ay b_eh_d_r_uw_m l_ay_k ay_m b_ow b_er_n_ah_m
f;51;man fuck the lames;m_ae_n f_ah_k dh_ah l_ey_m_z
a;52;they gone hate even though I slaughtered this shit;dh_ey g_ao_n hh_ey_t iy_v_ah_n dh_ow ay s_l_ao_t_er_d dh_ih_s sh_iy_t
f;53;they should call me James;dh_ey sh_uh_d k_ao_l m_iy jh_ey_m_z
d;54;cause I ball like LeBron in this bitch;k_aa_z ay b_ao_l l_ay_k l_eh_b_r_ah_n ih_n dh_ih_s b_ih_ch
m;55;sometimes these things happen;s_ah_m_t_ay_m_z dh_iy_z th_ih_ng_z hh_ae_p_ah_n
h;56;cause when I rap I mean it;k_aa_z w_eh_n ay r_ae_p ay m_iy_n ih_t
a;57;my raps the meanest my raps the cleanest;m_ay r_ae_p_s dh_ah m_iy_n_ah_s_t m_ay r_ae_p_s dh_ah k_l_iy_n_ah_s_t
a;58;god damn motherfucker Im a rapping genius RAP GENIUS;g_aa_d d_ae_m m_ao_th_eh_r_f_uw_k_k_ax_r ay_m ah r_ae_p_ih_ng jh_iy_n_y_ah_s r_ae_p jh_iy_n_y_ah_s
a;60;rap Genius Rap Genius;r_ae_p jh_iy_n_y_ah_s r_ae_p jh_iy_n_y_ah_s
a;61;this shit (is) so convenient Rap Genius;dh_ih_s sh_iy_t ih_z s_ow k_ah_n_v_iy_n_y_ah_n_t r_ae_p jh_iy_n_y_ah_s
a;62;whated he say What-d he say Rap Genius;w_ah_t_t hh_iy s_ey w_ah_t_ah_d hh_iy s_ey r_ae_p jh_iy_n_y_ah_s
a;63;so convenient my nigga Rap Genius;s_ow k_ah_n_v_iy_n_y_ah_n_t m_ay n_ih_g_ae r_ae_p jh_iy_n_y_ah_s
a;64;rap Genius Rap Genius;r_ae_p jh_iy_n_y_ah_s r_ae_p jh_iy_n_y_ah_s
a;65;this shit (is) so convenient Rap Genius;dh_ih_s sh_iy_t ih_z s_ow k_ah_n_v_iy_n_y_ah_n_t r_ae_p jh_iy_n_y_ah_s
a;66;whated he say What-d he say Rap Genius;w_ah_t_t hh_iy s_ey w_ah_t_ah_d hh_iy s_ey r_ae_p jh_iy_n_y_ah_s
a;67;rap Genius my nigga Rap Genius;r_ae_p jh_iy_n_y_ah_s m_ay n_ih_g_ae r_ae_p jh_iy_n_y_ah_s
d;69;get it like Im Freshman like Sophomore like we fresh and y-all niggas;g_eh_t ih_t l_ay_k ay_m f_r_eh_sh_m_ah_n l_ay_k s_aa_f_m_ao_r l_ay_k w_iy f_r_eh_sh ah_n_d y_ao_l n_ih_g_ae_s
h;70;soft and it could also be a double enten-  wait it IS ain-t no could it;s_aa_f_t ah_n_d ih_t k_uh_d ao_l_s_ow b_iy ah d_ah_b_ah_l er_ _n w_ey_t ih_t ih_z ey_n_t n_ow k_uh_d ih_t
n;71;(is) a double entendre cause like we fresh means like we freshmen we the;ih_z ah d_ah_b_ah_l aa_n_t_aa_n_d_r_ah k_aa_z l_ay_k w_iy f_r_eh_sh m_iy_n_z l_ay_k w_iy f_r_eh_sh_m_eh_n w_iy dh_ah
n;72;new we the new people and y-all some old ass sophomores need to get the;n_y_uw w_iy dh_ah n_y_uw p_iy_p_ah_l ah_n_d y_ao_l s_ah_m ow_l_d ae_s s_aa_f_m_ao_r_z n_iy_d t_uw g_eh_t dh_ah
o;73;fuck out our way and then y-all niggas wack like soft porn means we go;f_ah_k aw_t aw_r w_ey ah_n_d dh_eh_n y_ao_l n_ih_g_ae_s w_ae_k l_ay_k s_aa_f_t p_ao_r_n m_iy_n_z w_iy g_ow
p;74;hard and y-all soft and y-all probably gay porn too cause y-all gay and;hh_aa_r_d ah_n_d y_ao_l s_aa_f_t ah_n_d y_ao_l p_r_aa_b_ah_b_l_iy g_ey p_ao_r_n t_uw k_aa_z y_ao_l g_ey ah_n_d
m;75;then my points far like half court (is) like y-all seen the half court line;dh_eh_n m_ay p_oy_n_t_s f_aa_r l_ay_k hh_ae_f k_ao_r_t ih_z l_ay_k y_ao_l s_iy_n dh_ah hh_ae_f k_ao_r_t l_ay_n
a;76;you know how far it (is) from the basket its not Rap Dumbass its Rap Genius;y_uw n_ow hh_aw f_aa_r ih_t ih_z f_r_ah_m dh_ah b_ae_s_k_ah_t ih_t_s n_ax_t r_ae_p D_uw_m_b_ax_s ih_t_s r_ae_p jh_iy_n_y_ah_s
q;77;i don-t think I really need to annotate that part I don-t think And then I;ay d_ow_n_t th_ih_ng_k ay r_ih_l_iy n_iy_d t_uw ae_n_ah_t_ey_t dh_ae_t p_aa_r_t ay d_ow_n_t th_ih_ng_k ah_n_d dh_eh_n ay
a;78;don-t play fair Im a poor sport we so rich that we don-t even have to be;d_ow_n p_l_ey f_eh_r ay_m ah p_uh_r s_p_ao_r_t w_iy s_ow r_ih_ch dh_ae_t w_iy d_ow_n_t iy_v_ah_n hh_ae_v t_uw b_iy
r;79;good sports we can be poor sports cause we not poor niggas we still rich we;g_uh_d s_p_ao_r_t_s w_iy k_ah_n b_iy p_uh_r s_p_ao_r_t_s k_aa_z w_iy n_ax_t p_uh_r n_ih_g_ae_s w_iy s_t_ih_l r_ih_ch w_iy
d;80;get green like the Osbournes and yo nigga green like Osbourne cause yo nigga;g_eh_t g_r_iy_n l_ay_k dh_ah  ah_n_d y_ow n_ih_g_ae g_r_iy_n l_ay_k aa_s_b_er_n k_aa_z y_ow n_ih_g_ae
a;81;green (as) in he green with envy and he green like inexperienced and he green;g_r_iy_n ae_z ih_n hh_iy g_r_iy_n w_ih_dh eh_n_v_iy ah_n_d hh_iy g_r_iy_n l_ay_k ih_n_ih_k_s_p_ih_r_iy_ah_n_s_t ah_n_d hh_iy g_r_iy_n
g;82;like shit cause he ain-t shit and we (is) the shit nigga HuHAW Im ded;l_ay_k sh_iy_t k_aa_z hh_iy ey_n_t sh_iy_t ah_n_d w_iy ih_z dh_ah sh_iy_t n_ih_g_ae  ay_m d_ah_d
