Rhyme Scheme Letter;Line Number;Lyrics;Phonetic Transcription
m;0;i had a dream that my soul was stolen Actually no I sold it;ay hh_ae_d ey d_r_iy_m dh_ah_t m_ay s_ow_l w_ah_z s_t_ow_l_ah_n ae_k_ch_ah_w_ah_l_iy n_ow ay s_ow_l_d ah_t
a;1;but the whole situation seemed so hopeless;b_ah_t dh_iy hh_ow_l s_ih_ch_uw_ey_sh_ah_n s_iy_m_d s_ow hh_ow_p_l_ah_s
n;2;before it all unfolded it was dope until the;b_iy_f_ao_r ah_t ao_l ah_n_f_ow_l_d_ah_d ah_t w_ah_z d_ow_p ah_n_t_ih_l dh_iy
n;3;guys setting prices trying to buy the rhymes told me;g_ay_z s_eh_t_ih_ng p_r_ay_s_ah_z t_r_ay_ng t_ah b_ay dh_iy r_ay_m_z t_ow_l_d m_iy
b;4;turn a blind eye (as) they took a;t_er_n ey b_l_ay_n_d ay eh_z dh_ey t_uh_k ey
c;5;couple lines;k_ah_p_ah_l l_ay_n_z
d;6;saw them cook a couple lies (as) they through it in the batter;s_ao dh_ah_m k_uh_k ey k_ah_p_ah_l l_ay_z eh_z dh_ey th_r_uw ah_t ih_n_ch dh_iy b_ae_t_er
b;7;(as) I heard the chitter chatter This and thatll make you famous;eh_z ay hh_er_d dh_iy ch_ih_t_er_r ch_ae_t_er dh_ih_s ah_n_d dh_ae_t_l m_ey_k y_uw f_ey_m_ah_s
d;8;make you matter Silver platter;m_ey_k y_uw m_ae_t_er s_ih_l_v_er p_l_ae_t_er
c;9;served up all the wiring;s_er_v_d ah_p ao_l dh_ah w_ay_r_ih_ng
o;10;fame and the fortune The songs of a siren Aspiring for;f_ey_m ah_n_d dh_ah f_ao_r_ch_ah_n dh_ah s_ao_ng_z ah_v ah s_ay_r_ah_n ah_s_p_ay_r_ih_ng f_ao_r
c;11;what Im destined for desiring;w_ah_t ay_m d_eh_s_t_ah_n_d f_ao_r d_ah_z_ay_r_ih_ng
e;12;i once;ay w_ah_n_s
c;13;was a lion that roamed through the lands of Zion before I was tamed by pirates;w_ah_z ah l_ay_ah_n dh_ae_t r_ow_m_d th_r_uw dh_ah l_ae_n_d_z ah_v z_ay_ah_n b_ah_f_ao_r ay w_ah_z t_ey_m_d b_ay p_ay_r_ah_t_s
f;15;why must I die just so that I can live I watch a Muslim digesting a pig;w_ay m_ah_s_t ay d_ay jh_ah_s_t s_ow dh_ae_t ay k_ah_n l_ay_v ay w_aa_ch ey m_ah_z_l_ah_m d_ay_jh_eh_s_t_ih_ng ey p_ih_g
p;16;(as) a priest (is) molesting a kid Allegedly they telling me that thats what I;eh_z ey p_r_iy_s_t ah_z m_ah_l_eh_s_t_ih_ng ey k_ih_d ah_l_eh_jh_ah_d_l_iy dh_ey t_eh_l_ih_ng m_iy dh_ah_t dh_ae_t_s w_ah_t ay
f;17;did;d_ih_d
g;18;they said a man dies best when he kill himself (fore-) I digress;dh_ey s_eh_d ah m_ae_n d_ay_z b_eh_s_t w_eh_n hh_iy k_ih_l hh_ih_m_s_eh_l_f f_ao_r_eh ay d_ay_g_r_eh_s
d;19;readers digested the kid Arrested the kid Im imprisoned by attraction;r_iy_d_er_z d_ay_jh_eh_s_t_ah_d dh_ah k_ih_d er_eh_s_t_ah_d dh_ah k_ih_d ay_m ih_m_p_r_ih_z_ah_n_d b_ay ah_t_r_ae_k_sh_ah_n
q;20;(as) my lust takes control of my action and its;ae_z m_ay l_ah_s_t t_ey_k_s k_ah_n_t_r_ow_l ah_v m_ay ae_k_sh_ah_n ah_n_d ih_t_s
d;21;actually half of the fraction of the subtraction theyre doing to my passion;ae_k_ch_ah_w_ah_l_iy hh_ae_f ah_v dh_ah f_r_ae_k_sh_ah_n ah_v dh_iy s_ah_b_t_r_ae_k_sh_ah_n dh_ey_r d_uw_ih_ng t_uw m_ay p_ae_sh_ah_n
h;23;it changed how I thought into a train of thought;ih_t ch_ey_n_jh_d hh_aw ay th_ao_t ih_n_t_uw ah t_r_ey_n ah_v th_ao_t
h;24;that made me oblivious the pain that I brought;dh_ae_t m_ey_d m_iy ah_b_l_ih_v_iy_ah_s dh_ah p_ey_n dh_ae_t ay b_r_ao_t
h;25;from the way that I talk to the way that I walk;f_r_ah_m dh_ah w_ey dh_ae_t ay t_ao_k t_uw dh_ah w_ey dh_ae_t ay w_ao_k
i;26;(as) I walk on the train tracks that break if I spark;ae_z ay w_ao_k aa_n dh_ah t_r_ey_n t_r_ae_k_s dh_ae_t b_r_ey_k ah_f ay s_p_aa_r_k
i;27;i watch (as) a dog causes pain with a bark;ay w_aa_ch ae_z ah d_ah_g k_aa_z_ah_z p_ey_n w_ih_dh ah b_aa_r_k
e;28;to a herculean man with a tied back mane and some muzzled up;t_uw ey hh_er_k_y_uw_l_iy_ah_n m_ae_n w_ih_dh ah t_ay_d b_ae_k m_ey_n ah_n_d s_ah_m m_ah_z_ah_l_d ah_p
r;29;fangs that could slay through a rock and it was the;f_ae_ng_z dh_ae_t k_uh_d s_l_ey th_r_uw ah r_aa_k ah_n_d ih_t w_ah_z dh_ah
s;30;same bark that had murdered 2Pac;s_ey_m b_aa_r_k dh_ae_t hh_ae_d m_er_d_er_d 
f;31;all this;ao_l dh_ih_s
g;32;through a cage that they all kept me locked in I watched them;th_r_uw ah k_ey_jh dh_ae_t dh_ey ao_l k_eh_p_t m_iy l_aa_k_t ih_n ay w_aa_ch_t dh_eh_m
t;33;change up the name of the doctrine;ch_ey_n_jh ah_p dh_ah n_ey_m ah_v dh_iy d_oh_k_t_r_ih_n
f;34;my actions controlled by an actor they dropped in;m_ay ae_k_sh_ah_n_z k_ah_n_t_r_ow_l_d b_ay ae_n ae_k_t_er dh_ey d_r_aa_p_t ih_n
u;35;with the same name but his brain was concocted;w_ih_dh dh_ah s_ey_m n_ey_m b_ah_t hh_ih_z b_r_ey_n w_ah_z k_ah_n_k_aa_k_t_ah_d
d;36;(as) I was a plane with a lame in the cockpit I need a damn;ae_z ay w_ah_z ah p_l_ey_n w_ih_dh ey l_ey_m ih_n dh_ah k_aa_k_p_ih_t ay n_iy_d ah d_ae_m
w;37;locksmith God just stop it;l_aa_k_s_m_ih_th g_aa_d jh_ah_s_t s_t_aa_p ih_t
c;39;first from a dream to a twisted nightmare;f_er_s_t f_r_ah_m ah d_r_iy_m t_uw ah t_w_ih_s_t_ah_d n_ay_t_m_eh_r
g;40;lost in a fallacy of this writers affair;l_ao_s_t ih_n ah f_ae_l_ah_s_iy ah_v dh_ih_s r_ay_t_er_z ah_f_eh_r
g;42;im envisioning a young black Icarus And his wings theyre beginning there;ay_m eh_n_v_ih_zh_ah_n_ih_ng ah y_ah_ng b_l_ae_k ih_k_er_ah_s ah_n_d hh_ih_z w_ih_ng_z dh_ey_r b_ih_g_ih_n_ih_ng dh_eh_r
f;43;diminishing;d_ah_m_ih_n_ih_sh_ih_ng
f;44;his body-s still flying but his soul in its innocence;hh_ih_z b_aa_d_iy_z s_t_ih_l f_l_ay_ih_ng b_ah_t hh_ih_z s_ow_l ih_n ih_t_s ih_n_ah_s_ah_n_s
w;45;falls through the floor to fires in the pit of it;f_ao_l_z th_r_uw dh_ah f_l_ao_r t_uw f_ay_er_z ih_n dh_ah p_ih_t ah_v ih_t
i;46;his resistance (is) killed at the concrete but his body (is) way beyond arms;hh_ih_z r_ih_z_ih_s_t_ax_n_s ih_z k_ih_l_d ae_t dh_ah k_ah_n_k_r_iy_t b_ah_t hh_ih_z b_aa_d_iy ih_z w_ey b_ih_aa_n_d aa_r_m_z
l;47;reach;r_iy_ch
l;48;soaring in a plane that (is) landing in Palm Beach;s_ao_r_ih_ng ih_n ah p_l_ey_n dh_ae_t ih_z l_ae_n_d_ih_ng ih_n_ch p_aa_m b_iy_ch
f;49;but its really just a dresses up Zombie Im weak from the image;b_ah_t ih_t_s r_ih_l_iy jh_ah_s_t ah d_r_eh_s_ah_z ah_p z_aa_m_b_iy ay_m w_iy_k f_r_ah_m dh_ah ih_m_ah_jh
q;50;and still feel powerless Soul isn-t powerless I just lack empowerments;ah_n_d s_t_ih_l f_iy_l p_aw_er_l_ah_s s_ow_l ih_z_n_t p_aw_er_l_ah_s ay jh_ah_s_t l_ae_k ih_m_p_aw_er_m_ah_n_t_s
e;51;touch;t_ah_ch
g;52;hidden under bricks its a bit too much Up until the actor only very;hh_ih_d_ah_n ah_n_d_er b_r_ih_k_s ih_t_s ah b_ih_t t_uw m_ah_ch ah_p ah_n_t_ih_l dh_ah ae_k_t_er ow_n_l_iy v_eh_r_iy
l;53;briefly;b_r_iy_f_l_iy
n;54;he sees me It-s almost like he wants to release me;hh_iy s_iy_z m_iy ih_t_s ao_l_m_ow_s_t l_ay_k hh_iy w_aa_n_t_s t_uw r_iy_l_iy_s m_iy
m;55;its his ball now Free me or defeat me;ih_t_s hh_ih_z b_ao_l n_aw f_r_iy m_iy ao_r d_ah_f_iy_t m_iy
l;56;hold up Suddenly Im not so sleepy;hh_ow_l_d ah_p s_ah_d_ah_n_l_iy ay_m n_ax_t s_ow s_l_iy_p_iy
l;57;nothing comes easy;n_ah_th_ih_ng k_ah_m_z iy_z_iy
c;59;first from a dream to a twisted nightmare;f_er_s_t f_r_ah_m ah d_r_iy_m t_uw ah t_w_ih_s_t_ah_d n_ay_t_m_eh_r
g;60;lost in a fallacy of this writers affair;l_ao_s_t ih_n ah f_ae_l_ah_s_iy ah_v dh_ih_s r_ay_t_er_z ah_f_eh_r
a;61;back to the place where your dreams ran your soul;b_ae_k t_uw dh_ah p_l_ey_s w_eh_r y_ao_r d_r_iy_m_z r_ae_n y_ao_r s_ow_l
a;62;you try to hide it but everyone knows;y_uw t_r_ay t_ah hh_ay_d ih_t b_ah_t eh_v_r_iy_w_ah_n n_ow_z
a;63;you try to validate what you do not own;y_uw t_r_ay t_uw v_ae_l_ah_d_ey_t w_ah_t y_uw d_uw n_ax_t ow_n
a;64;explosions of rhythmic patterns and intone;ih_k_s_p_l_ow_zh_ah_n_z ah_v r_ih_dh_m_ih_k p_ae_t_er_n_z ah_n_d ih_n_t_ow_n
c;65;our audacious trial and we hereby;aw_r aa_d_ey_sh_ah_s t_r_ay_ax_l ah_n_d w_iy hh_ih_r_b_ay
e;66;give you a song of rest Your dreams lullaby;g_ih_v y_uw ah s_ao_ng ah_v r_eh_s_t y_ao_r d_r_iy_m_z l_ah_l_ah_b_ay
