Rhyme Scheme Letter;Line Number;Lyrics;Phonetic Transcription
a;0;i got 4 bitches in my intertube in my pool;ay g_aa_t ah_ae b_ih_ch_ah_z ih_n_ch m_ay ih_n_t_er_t_uw_b ih_n_ch m_ay p_uw_l
a;1;i fuck fat horny bitches at high school;ay f_ah_k f_ae_t hh_ao_r_n_iy b_ih_ch_ah_z ae_t hh_ay s_k_uw_l
c;2;i met them at pornhub cuz they were fucking skanks;ay m_eh_t dh_eh_m ae_t p_ao_r_n_hh_ah_b k_ah_z dh_ey w_er f_ah_k_ih_ng s_k_ae_n_k_s
b;3;all I can say (is) there pussy smelled really fucking rank;ao_l ay k_ah_n s_ey ih_z dh_eh_r p_uh_s_iy s_m_eh_l_d r_ih_l_iy f_ah_k_ih_ng r_ae_ng_k
d;4;i got more swag than kanye west has;ay g_aa_t m_ao_r s_w_ae_g dh_ae_n k_ah_n_iy_ax w_eh_s_t hh_ah_z
d;5;i got more awards than beck has;ay g_aa_t m_ao_r ah_w_ao_r_d_z dh_ae_n b_eh_k hh_ah_z
b;6;i got more money than bill gates and hova have;ay g_aa_t m_ao_r m_ah_n_iy dh_ae_n b_ih_l g_ey_t_s ah_n_d hh_ow_v_ae hh_ae_v
d;7;i got more bitches than drake has;ay g_aa_t m_ao_r b_ih_ch_ah_z dh_ae_n d_r_ey_k hh_ah_z
e;8;they call me a legend;dh_ey k_ao_l m_iy ah l_eh_jh_ah_n_d
c;9;i just say im the reverend;ay jh_ah_s_t s_ey ih_m dh_ah r_eh_v_ax_r_ax_n_d
